,title,type,release_year,rating,runtime,description,genres,cast,director,country,imdb_link,date_added
359,Marvel Studios' Captain Marvel,movie,2019,PG-13,126 min,"Marvel Studios’ Captain Marvel takes you on a spectacular adventure from the 1990s, tracing the path of Carol Danvers (Brie Larson) as she becomes one of the most powerful heroes in the universe. When a galactic war reaches Earth, she meets young agent Nick Fury (Samuel L. Jackson) at the center of a maelstrom, leading to her ultimate destiny as an Avenger! Some flashing lights sequences or patterns may affect photosensitive viewers.","Action-Adventure,Science Fiction,Superhero","Brie Larson,Samuel Jackson,Ben Mendelsohn,Djimon Hounsou,Lee Pace,Lashana Lynch","Anna Boden,Ryan Fleck","United States,Australia",https://www.imdb.com/title/tt4154664/?ref_=plg_rt_1,"Added to Disney+:November 12, 2019"
360,Marvel Studios' Doctor Strange,movie,2016,PG-13,116 min,"From Marvel Studios comes the story of world-famous neurosurgeon Dr. Stephen Strange, whose life changes forever after a horrific car accident robs him of the use of his hands. When traditional medicine fails him, he's forced to look for healing, and hope, in a mysterious enclave known as Kamar-Taj. He quickly learns that this is not just a center for healing... it's also the front line of a battle against unseen dark forces bent on destroying our reality. Before long, Strange, armed with newly acquired magical powers, is forced to choose whether to return to his old life or leave it behind to defend the world as the most powerful sorcerer in existence. Some flashing lights sequences or patterns may affect photosensitive viewers.","Action-Adventure,Fantasy,Superhero","Benedict Cumberbatch,Chiwetel Ejiofor,Rachel McAdams,Benedict Wong,Michael Stuhlbarg,Benjamin Bratt",Scott Derrickson,United States,https://www.imdb.com/title/tt1211837/?ref_=plg_rt_1,"Added to Disney+:November 12, 2019"
361,Marvel Studios' Guardians of the Galaxy,movie,2014,PG-13,122 min,"An action-packed, epic space adventure, Marvel Studios' Guardians of the Galaxy expands the Marvel Cinematic Universe into the cosmos, where brash adventurer Peter Quill finds himself the object of an unrelenting bounty hunt after stealing a mysterious orb coveted by Ronan, a powerful villain with ambitions that threaten the entire universe. To evade the ever-persistent Ronan, Quill is forced into an uneasy truce with a quartet of disparate misfits: Rocket, a gun-toting raccoon; Groot, a tree-like humanoid; the deadly and enigmatic Gamora; and revenge-driven Drax the Destroyer. But when Quill discovers the true power of the orb and the menace it poses to the cosmos, he must do his best to rally his ragtag rivals for a last, desperate stand – with the galaxy’s fate in the balance. Some flashing lights sequences or patterns may affect photosensitive viewers.","Action-Adventure,Comedy,Science Fiction","Chris Pratt,Zoë Saldana,Dave Bautista,Vin Diesel,Bradley Cooper,Lee Pace",James Gunn,United States,https://www.imdb.com/title/tt2015381/?ref_=plg_rt_1,"Added to Disney+:November 12, 2019"
362,Marvel Studios' Guardians of the Galaxy Vol. 2,movie,2017,PG-13,137 min,"Set to the sonic backdrop of Awesome Mixtape #2, Marvel Studios’ Guardians of the Galaxy Vol. 2 continues the team’s adventures as they traverse the outer reaches of the cosmos. The Guardians must fight to keep their newfound family together as they unravel the mystery of Peter Quill’s true parentage. Old foes become new allies, and characters from the classic comics come to their aid as the Marvel Cinematic Universe continues to expand. Some flashing lights sequences or patterns may affect photosensitive viewers.","Action-Adventure,Comedy,Science Fiction","Chris Pratt,Bradley Cooper,Vin Diesel,Pom Klementieff,Zoë Saldana,Dave Bautista",James Gunn,United States,https://www.imdb.com/title/tt3896198/?ref_=plg_rt_1,"Added to Disney+:November 12, 2019"
363,Marvel Studios' Iron Man,movie,2008,PG-13,127 min,"Tony Stark, a billionaire industrialist and genius inventor, is kidnapped and forced to build a devastating weapon. Instead, using his intelligence and ingenuity, Tony builds a high-tech suit of armor and escapes captivity. When he uncovers a nefarious plot with global implications, he dons his powerful armor and vows to protect the world as Iron Man. Contains tobacco depictions.","Action-Adventure,Science Fiction,Superhero","Robert Downey,Robert Downey Jr.,Terrence Howard,Jeff Bridges,Gwyneth Paltrow,Leslie Bibb",Jon Favreau,United States,https://www.imdb.com/title/tt0371746/?ref_=plg_rt_1,"Added to Disney+:November 12, 2019"
364,Marvel Studios' Iron Man 2,movie,2010,PG-13,125 min,"With the world now aware that he is Iron Man, billionaire inventor Tony Stark faces pressure from all sides to share his technology with the military. He is reluctant to divulge the secrets of his armored suit, fearing the information will fall into the wrong hands. With Pepper Potts and ""Rhodey"" Rhodes by his side, Tony must forge new alliances and confront a powerful new enemy, all the while realizing that not only is there a madman out to destroy him, but the very technology designed to save his life is slowly killing him. Contains tobacco depictions.","Action-Adventure,Science Fiction,Superhero","Robert Downey,Robert Downey Jr.,Gwyneth Paltrow,Don Cheadle,Scarlett Johansson,Sam Rockwell",Jon Favreau,United States,https://www.imdb.com/title/tt1228705/?ref_=plg_rt_1,"Added to Disney+:November 12, 2019"
365,Marvel Studios' Iron Man 3,movie,2013,PG-13,132 min,"Marvel Studios' Iron Man 3 pits brash-but-brilliant industrialist Tony Stark/Iron Man against an enemy whose reach knows no bounds. When Stark finds his personal world destroyed at his enemy's hands, he embarks on a harrowing quest to find those responsible. This journey, at every turn, will test his mettle. With his back against the wall, Stark is left to survive by his own devices, relying on his ingenuity and instincts to protect those closest to him. As he fights his way back, Stark discovers the answer to the question that has secretly haunted him: Does the man make the suit, or does the suit make the man?","Action-Adventure,Science Fiction,Superhero","Robert Downey Jr.,Gwyneth Paltrow,Don Cheadle,Guy Pearce,Rebecca Hall,Stephanie Szostak",Shane Black,United States,https://www.imdb.com/title/tt1300854/?ref_=plg_rt_1,"Added to Disney+:November 12, 2019"
366,Marvel Studios' The Avengers,movie,2012,PG-13,145 min,"Nick Fury, Director of the international peacekeeping agency known as S.H.I.E.L.D., finds himself in need of a team to pull the world back from the brink of disaster. The Avengers – Iron Man, The Incredible Hulk, Thor and Captain America – assemble alongside Black Widow and Hawkeye to battle an unexpected enemy: the Asgardian God Loki, who commands a powerful Chitauri army threatening global safety and security.","Action-Adventure,Fantasy,Science Fiction","Robert Downey Jr.,Robert Downey,Chris Evans,Mark Ruffalo,Chris Hemsworth,Scarlett Johansson",Joss Whedon,United States,https://www.imdb.com/title/tt0848228/?ref_=plg_rt_1,"Added to Disney+:November 12, 2019"
367,Marvel Studios' Thor,movie,2011,PG-13,116 min,"This epic adventure spans the Marvel universe from present-day Earth to the cosmic realm of Asgard. At the center of the story is The Mighty Thor, a powerful but arrogant warrior whose reckless actions reignite an ancient war. As a result, Thor's father Odin banishes his son to Earth where he is forced to live among humans. From Earth, Thor must make preparations to stop his evil brother Loki from dethroning Odin, seizing power and imposing his villainous rule on all of Asgard. When the darkest forces are sent to invade Earth, Thor learns what it takes to be a true hero.","Action-Adventure,Fantasy,Superhero","Chris Hemsworth,Natalie Portman,Tom Hiddleston,Anthony Hopkins,Stellan Skarsgård,Kat Dennings",Kenneth Branagh,United States,https://www.imdb.com/title/tt0800369/?ref_=plg_rt_1,"Added to Disney+:November 12, 2019"
368,Marvel Studios' Thor: Ragnarok,movie,2017,PG-13,132 min,"The Mighty Thor is imprisoned on the other side of the universe... without his mighty hammer. He's in a race against time to get back to Asgard to stop Ragnarok, the cataclysmic destruction of his home world and the end of Asgardian civilization at the hands of an all-powerful new threat, the ruthless Hela. But first, he must survive a deadly gladiatorial contest that pits him against his former ally and fellow Avenger – the Incredible Hulk. Some flashing lights sequences or patterns may affect photosensitive viewers.","Action-Adventure,Comedy,Fantasy","Chris Hemsworth,Tom Hiddleston,Cate Blanchett,Idris Elba,Jeff Goldblum,Tessa Thompson",Taika Waititi,United States,https://www.imdb.com/title/tt3501632/?ref_=plg_rt_1,"Added to Disney+:December 5, 2019"
369,Marvel Studios' Thor: The Dark World,movie,2013,PG-13,114 min,"Marvel Studios' Thor: The Dark World continues the adventures of Thor, the Mighty Avenger, as he battles to save Earth and all the Nine Realms from a shadowy enemy that predates the universe itself. In the aftermath of Marvel Studios' Thor and Marvel Studios' The Avengers, Thor fights to restore order across the cosmos... but an ancient race led by the vengeful Malekith returns to plunge the universe back into darkness. To defeat an enemy that even Odin and Asgard cannot withstand, Thor sets out on his most dangerous and personal journey yet, forced into an alliance with the treacherous Loki to save not only his people and those he loves…but our universe itself.","Action-Adventure,Fantasy,Science Fiction","Chris Hemsworth,Natalie Portman,Tom Hiddleston,Anthony Hopkins,Rene Russo,Stellan Skarsgård",Alan Taylor,United States,https://www.imdb.com/title/tt1981115/?ref_=plg_rt_1,"Added to Disney+:November 12, 2019"
370,Marvel's Iron Man & Hulk: Heroes United,movie,2013,PG,74 min,"Hulk’s pulverizing brute strength and Tony Stark’s high-tech brainpower come together to face off against the ultimate enemy. When Zzzax, a seemingly invincible, energy-devouring monster threatens to destroy the planet, this unlikeliest pairing of Avengers is mankind’s only hope. Alone, neither can defeat the awesome power of Zzzax. As a duo, they just might have a chance – if they can find a way to work together without smashing heads before time runs out.","Action-Adventure,Animation,Science Fiction","Adrian Pasdar,Fred Tatasciore,David Kaye,Dee Baker,Robin Downes",Leo Riley,United States,https://www.imdb.com/title/tt3221698/?ref_=plg_rt_1,"Added to Disney+:February 16, 2020"
371,Mary Poppins,movie,1964,G,142 min,"“Practically Perfect In Every Way” Mary Poppins (Julie Andrews) flies out of the windy London skies and into the home of two mischievous children. With the help of a carefree chimney sweep named Bert (Dick Van Dyke), the spirited nanny turns every chore into a game and every day into a “Jolly Holiday” to reconnect the children with their parents. Contains tobacco depictions.","Family,Fantasy,Musical","Julie Andrews,Dick Van Dyke,David Tomlinson,Glynis Johns,Hermione Baddeley,Karen Dotrice",Robert Stevenson,United States,https://www.imdb.com/title/tt0058331/?ref_=plg_rt_1,"Added to Disney+:November 12, 2019"
372,Mater and the Ghostlight,movie,2006,TV-Y7,8 min,"Mater - the rusty but trusty tow truck - spends the day playing scary pranks on the townsfolk of Radiator Springs. That night at Flo's V8 Café, Sheriff tells everyone about the legend of the Ghostlight, a mysterious blue light that haunts those very parts. As his friends head home, Mater is left alone in the dark to ponder whether the legend of the fabled Ghostlight is true.","Animation,Comedy,Family","Larry the Cable Guy ,Owen Wilson,Michael Wallis,Bonnie Hunt,Paul Newman,Cheech Marin",John Lasseter,United States,https://www.imdb.com/title/tt0901686/?ref_=plg_rt_1,"Added to Disney+:November 12, 2019"
373,Meet the Deedles,movie,1998,PG,94 min,"Laughter is taken to the ""X-treme"" when Hawaiian surfer dudes Phil and Stew Deedle are mistaken for park ranger recruits. Though these two brothers are ready for any sports challenge from skateboarding to rock-climbing, their daredevil attitude will be put to the test by Frank Slater (Dennis Hopper), a demented ex-park ranger living in an underground grotto... and plotting revenge against the park service that fired him years before. Can these clueless brothers stop Slater from carrying out his plan to steal Yellowstone's most famous landmark, Old Faithful?","Buddy,Comedy","Paul Walker,Steve Wormer,John Ashton,A.J. Langer,Robert Englund,Megan Cavanagh",Steve Boyum,United States,https://www.imdb.com/title/tt0120645/?ref_=plg_rt_1,"Added to Disney+:November 12, 2019"
374,Meet the Robinsons,movie,2007,G,97 min,"Have the ""time"" of your life in this thrilling adventure that takes you to a new world filled with imagination and surprises. Join a brilliant young inventor named Lewis as he sets off on a time-traveling journey to find the family he never knew. In the fantastical world of 2037, hip-hoppin' frogs and dogs that wear glasses are as common as talking dinosaurs. In an amazing twist, Lewis discovers that the fate of the future rests in his hands, but he can't save it alone – he'll need every bit of help he can get from the wonderfully wacky Robinson family, who help him learn to keep moving forward and never stop believing in himself.","Action-Adventure,Animation,Family","Angela Bassett,Daniel Hansen,Jordan Fry,Matthew Josten,John Ford,Dara McGarry",Stephen Anderson,United States,https://www.imdb.com/title/tt0396555/?ref_=plg_rt_1,"Added to Disney+:November 12, 2019"
375,Melody Time,movie,1948,TV-PG,76 min,"In the grand tradition of Disney's great musical classics, Melody Time features seven timeless stories, each enhanced with high-spirited music and unforgettable characters. Disney favorite Donald Duck puts on a display of jazzy antics as the star of ""Blame It On The Samba."" Music becomes a real adventure for a busy bumble bee in ""Bumble Boogie."" Cheer on the mischievous young tugboat in ""Little Toot"" and root for the heroes of legend and myth in ""Johnny Appleseed"" and ""Pecos Bill."" You'll tap your toes and clap your hands in this witty feast for the eyes and ears. This program is presented as originally created. It may contain outdated cultural depictions.","Animation,Anthology,Family","Roy Rogers,Trigger ,Dennis Day,The Andrews Sisters ,Fred Waring and His Pennsylvanians ,Freddy Martin","Clyde Geronimi,Jack Kinney,Hamilton Luske",United States,https://www.imdb.com/title/tt0040580/?ref_=plg_rt_1,"Added to Disney+:November 12, 2019"
376,Mickey and the Seal,movie,1948,TV-G,7 min,"Mickey accidentally takes a seal home, after it sneaks into his picnic basket. When Mickey takes a bath, the seal is discovered and Mickey returns him to the park. Later, however, Mickey and Pluto discover that the bathroom is filled with seals!","Animation,Family",,Charles Nichols,,,"Added to Disney+:May 29, 2020"
377,Mickey Down Under,movie,1948,TV-G,7 min,"Mickey, in the Australian bush, throws a boomerang that gets caught in Pluto’s mouth. Mickey then discovers an egg of an emu. Unfortunately, the parent chases him, but Pluto and the boomerang zoom into his path, leaving the emu all tangled. This program is presented as originally created. It may contain outdated cultural depictions.","Animation,Comedy,Family",,Charles Nichols,,,"Added to Disney+:November 12, 2019"
378,"Mickey, Donald, Goofy: The Three Musketeers",movie,2004,G,71 min,"Best buddies Mickey, Donald, and Goofy are small-time janitors with big dreams of becoming Musketeers. Their lives are turned upside down when Peg-Leg Pete, captain of the Musketeers, and his sinister lieutenant Clarabelle use them in a dastardly plot to rid the kingdom of Princess Minnie – the only mouse standing in Pete's way to the throne. Mickey, Donald, and Goofy may not look like heroes, but they have a surprise for Pete. Powered by teamwork and friendship, they soon learn that they can accomplish anything if they work together.","Action-Adventure,Animation,Family","Wayne Allwine,Tony Anselmo,Bill Farmer,Russi Taylor,Tress MacNeille,Jim Cummings",Donovan Cook,United States,https://www.imdb.com/title/tt0371823/?ref_=plg_rt_1,"Added to Disney+:November 12, 2019"
379,Mickey's Birthday Party,movie,1942,TV-G,8 min,The gang gives Mickey a surprise party that turns into a jam session with everyone playing instruments while Goofy has problems baking a cake. Contains tobacco depictions. This program is presented as originally created. It may contain outdated cultural depictions.,"Animation,Comedy,Family","Walt Disney,Thelma Boardman,Pinto Colvig,Clarence Nash,Florence Gill",Riley Thomson,United States,https://www.imdb.com/title/tt0035064/?ref_=plg_rt_1,"Added to Disney+:November 12, 2019"
380,Mickey's Christmas Carol,movie,1983,G,26 min,"Mickey, Donald, Goofy and all their pals star in an all-time Christmas classic. Ebenezer Scrooge is far too greedy to understand that Christmas is a time for kindness and generosity, but with the guidance of some newfound friends, Scrooge learns to embrace the spirit of the season. Contains tobacco depictions.","Animation,Comedy,Family","Alan Young,Wayne Allwine,Hal Smith,Will Ryan,Eddy Carroll,Patricia Parris",Burny Mattinson,United States,https://www.imdb.com/title/tt0085936/?ref_=plg_rt_1,"Added to Disney+:November 12, 2019"
381,Mickey's Delayed Date,movie,1947,TV-G,7 min,"What could be better than falling asleep early in a comfortable easy chair with your faithful dog at your feet? Even though Mickey's evening started slow and lazy, things get moving in a hurry when Minnie calls from outside the big dance, wondering why he's late. Luckily, his best pal Pluto is happy to help wrangle the uncooperative evening wear and help get him out the door. But when Mickey forgets the tickets, it's Pluto to the rescue, and soon they're braving the hustle and bustle of city traffic to make it in time. This program is presented as originally created. It may contain outdated cultural depictions.","Animation,Comedy,Family",,Charles Nichols,,,"Added to Disney+:November 12, 2019"
382,Mickey's Once Upon a Christmas,movie,1999,TV-G,67 min,"Mickey, Minnie, Goofy, Donald, Daisy and Pluto gather to reminisce about love, magic, and surprises in three wonder-filled stories of Christmas past. In the fine tradition of Disney storytelling, Minnie and Mickey recall the year they both gave up what was most important to them for the sake of the other, making for one unforgettable Christmas. Goofy and Max retell when they experienced a series of hilarious but season-shaking events... until a visit from the real Santa made it a most magical holiday. Thinking back to when they wished Christmas was every day, Donald's nephews Huey, Dewey, and Louie remember their dream turning into a comical catastrophe, eventually teaching them what true holiday spirit is all about. Contains tobacco depictions.","Animation,Anthology,Comedy","Kelsey Grammer,Wayne Allwine,Russi Taylor,Tony Anselmo,Diane Michelle,Tress MacNeille","Bradley Raymond,Jun Falkenstein,Bill Speers",United States,https://www.imdb.com/title/tt0238414/?ref_=plg_rt_1,"Added to Disney+:November 12, 2019"
383,Mickey's Rival,movie,1936,TV-G,9 min,"Mickey's rival, Mortimer, strives for Minnie's affections on an afternoon outing. As he woos Minnie, he plays practical jokes on Mickey and even his car threatens Mickey's car. This program is presented as originally created. It may contain outdated cultural depictions.","Animation,Comedy,Family","Walt Disney,Marcelite Garner,Sonny Dawson","Wilfred Jackson,Walt Disney",United States,https://www.imdb.com/title/tt0027964/?ref_=plg_rt_1,"Added to Disney+:November 12, 2019"
384,Mickey's Trailer,movie,1938,TV-PG,8 min,"On their trip out of the city for a vacation, Mickey, Donald, and Goofy plan on having lots of fun and relaxation with their trailer, but all does not go as they plan. They soon have their hands full when the trailer gets away from them. Despite a steep mountain road and a speedy express train, the car and trailer eventually meet once again. This program is presented as originally created. It may contain outdated cultural depictions.","Animation,Comedy,Family","Clarence Nash,Pinto Colvig,Walt Disney",Ben Sharpsteen,United States,https://www.imdb.com/title/tt0030448/?ref_=plg_rt_1,"Added to Disney+:November 12, 2019"
385,Mickey's Twice Upon a Christmas,movie,2004,G,70 min,"Find out who's been naughty and who's been nice in this spectacular Christmas celebration. Santa Claus joins Mickey, Minnie and all their pals in an original movie about discovering the true joys of Christmas. Watch the hilarious antics of stubborn old Donald as he tries in vain to resist the joy of the season, and laugh along with Mickey and Pluto as they learn a great lesson about the power of friendship.","Animation,Anthology,Comedy","Wayne Allwine,Tony Anselmo,Jeff Bennett,Jim Cummings,Bill Farmer,Tress MacNeille",Matthew O'Callaghan,United States,https://www.imdb.com/title/tt0424279/?ref_=plg_rt_1,"Added to Disney+:November 12, 2019"
386,Mighty Joe Young,movie,1998,PG,116 min,"The legendary Joe, a playful, smart fifteen-foot-tall gorilla, and his lifelong best friend Jill Young (Charlize Theron) have grown up together in the remote mountains of Central Africa. When Joe's peaceful existence is shattered by poachers, Jill and zoologist Gregg O'Hara (Bill Paxton) rescue their innocent friend and move him to the safety of an animal conservancy in California. But Joe's safety is short-lived. No longer a myth, his notoriety makes him a target for an enemy from his past – a ruthless hunter who will do anything to capture the Mighty Joe. Contains tobacco depictions.","Action-Adventure,Animals & Nature,Family","Bill Paxton,Charlize Theron,Rade Šerbedžija,Regina King,Peter Firth,Naveen Andrews",Ron Underwood,United States,https://www.imdb.com/title/tt0120751/?ref_=plg_rt_1,"Added to Disney+:November 12, 2019"
387,Mike's New Car,movie,2002,TV-G,5 min,"Mike discovers that being the top-ranking laugh collector at Monsters, Inc. has its benefits, such as earning enough money to buy a six-wheel drive car that's loaded with gadgets. That new car smell doesn't last long enough, however, as Sulley jump-starts an ill-fated road test that teaches Mike the true meaning of buyer's remorse. Mike's pride in his new wheels is only surpassed by Sulley's lack of skills at the control panel. The two eventually agree on one thing: walking to work might be the best, at least today.","Animation,Buddy,Comedy","Billy Crystal,John Goodman","Pete Docter,Roger Gould",United States,https://www.imdb.com/title/tt0323250/?ref_=plg_rt_1,"Added to Disney+:November 12, 2019"
388,Millions,movie,2005,PG,99 min,"Seven-year-old Damian believes he's received a divine gift from above when a suitcase filled with cash literally falls out of the sky. Against the advice of his older brother Anthony, Damian is anxious to share the wealth with those less fortunate. But when the loot turns out to be stolen, his noble intentions are put to the test with heartwarming and hilarious results.","Comedy,Drama,Family","James Nesbitt,Daisy Donovan,Alexander Nathan Etel,Lewis Owen Mcgibbon",Danny Boyle,United Kingdom,https://www.imdb.com/title/tt0366777/?ref_=plg_rt_1,"Added to Disney+:November 12, 2019"
389,Minutemen,movie,2008,TV-G,91 min,"To spare other kids from humiliating and totally uncool high school experiences, senior Virgil and his buddies invent the ultimate time machine, traveling back in time just far enough to alter conversations, events and interactions that led to them being stigmatized as part of the ""out"" crowd. But when they accidentally open a black hole, they learn that turning back the clock can create a massive mess.","Action-Adventure,Comedy,Science Fiction","Jason Dolley,Luke Benward,Nicholas Braun,Chelsea Staub,Steven McQueen,Kara Crane",Lev Spiro,United States,https://www.imdb.com/title/tt1072755/?ref_=plg_rt_1,"Added to Disney+:November 12, 2019"
390,Miracle,movie,2004,PG,137 min,"Filled with exhilarating nonstop hockey action and heart-racing suspense, Miracle is the inspiring story behind one of the greatest moments in sports history – the 1980 United States ice hockey team's triumphant Olympic victory against the Soviet Union. Kurt Russell gives a brilliant performance as the dynamic and determined coach Herb Brooks, who had an impossible dream: beat the seemingly unbeatable Soviets at their own game. Starting with a handpicked group of 26 undisciplined kids, Brooks coached them to play like they never played before, turning 20 of them into a team that believed they could achieve the unachievable and unite a nation with a new feeling of hope.","Drama,Historical,Sports","Kurt Russell,Patricia Clarkson,Noah Emmerich,Sean McCann,Kenneth Welsh,Eddie Cahill",Gavin O'Connor,"Canada,United States",https://www.imdb.com/title/tt0349825/?ref_=plg_rt_1,"Added to Disney+:November 12, 2019"
391,Miracle at Midnight,movie,1998,TV-14,89 min,"To protect Denmark’s Jews from the horror of Nazi concentration camps, Karl Koster and his family begin the heroic, but dangerous, task of deceiving the Nazis and hiding Jewish families. When the Koster men must go into hiding themselves, Karl's wife and daughter are left to face capture by the suspicious Gestapo.","Drama,Historical","Sam Waterston,Mia Farrow,Justin Whalin,Patrick Malahide,Benedick Blythe",Ken Cameron,United States,https://www.imdb.com/title/tt0157996/?ref_=plg_rt_1,"Added to Disney+:November 12, 2019"
