,title,type,release_year,rating,runtime,description,genres,cast,director,country,imdb_link,date_added
180,Expedition Amelia,movie,2019,TV-PG,94 min,"National Geographic Explorer-at-Large Dr. Robert Ballard is planning an expedition to solve the mystery of the disappearance of Amelia Earhart. Expedition Amelia follows the clues that have led Ballard to a remote island in the Pacific and delves into Earhart herself, especially how she became one of the most intriguing and inspirational figures in history.","Action-Adventure,Documentary,Historical","Allison Janney,Bob Ballard,Fredrik Hiebert",Chad Cohen,United States,https://www.imdb.com/title/tt10719984/?ref_=plg_rt_1,"Added to Disney+:December 1, 2019"
181,Expedition Mars: Spirit & Opportunity,movie,2019,TV-PG,88 min,"Expedition Mars brings to life one of the greatest sagas of the space age – the epic adventures of the Mars rovers Spirit and Opportunity. Expected to last only a few months, the mighty rovers lasted for years, climbing crater walls and surviving dust storms, frigid nights, and broken wheels. Intrepid explorers, they reinvigorated NASA’s Mars program and opened the Martian frontier.",Documentary,Bray Poor,Mark Davis,United States,https://www.imdb.com/title/tt6279452/?ref_=plg_rt_1,"Added to Disney+:November 12, 2019"
182,Fantasia,movie,1940,G,126 min,"Walt Disney's timeless masterpiece is a celebration of sight and sound, featuring eight sequences marrying classical music with the most innovative animation of its day. See dancing fairies, fish, flowers, mushrooms and leaves in the ""Nutcracker Suite""; follow Mickey Mouse in his iconic role as ""The Socerer's Apprentice""; laugh along with a comic ballet starring hippos, elephants, alligators and ostriches in ""Dance of the Hours""; and hold on to your seat when the evil Chernabog summons restless souls in ""Night on Bald Mountain."" Watch the music come to life, hear the pictures burst into song and experience the excitement that is Fantasia. This program is presented as originally created. It may contain outdated cultural depictions.","Animation,Family,Fantasy","Deems Taylor,Walt Disney,Leopold Stokowski","Samuel Armstrong,James Algar,Bill Roberts",United States,https://www.imdb.com/title/tt0032455/?ref_=plg_rt_1,"Added to Disney+:November 12, 2019"
183,Fantasia 2000,movie,2000,G,76 min,"Inspired by Walt Disney's vision of the original Fantasia as a work-in-progress, Fantasia 2000 continues that vision in a creative blend of classical music and the latest animated imagery, featuring ""The Sorcerer's Apprentice"" and seven new sequences. See whales soar through the clouds and into space in ""Pines of Rome""; laugh with a flock of flamingos as they try to persuade one of their own to behave in ""The Carnival of the Animals""; urge on Donald Duck, as Noah's assistant, trying to get animals into the ark in ""Pomp and Circumstance""; and root for four 1930s New Yorkers wishing for a better life in ""Rhapsody in Blue.""  With technological tools and innovations that blend traditional animation with modern flair, this is a feast for your eyes, ears and heart.","Animation,Family,Fantasy","Steve Martin,Itzhak Perlman,Quincy Jones,Bette Midler,James Jones,Penn Teller","Pixote Hunt,Hendel Butoy,Eric Goldberg",United States,https://www.imdb.com/title/tt0120910/?ref_=plg_rt_1,"Added to Disney+:November 12, 2019"
184,Fantastic Four (2015),movie,2015,PG-13,100 min,"A young genius builds a portal to another dimension with help from friends and colleagues but an accident leaves one stranded and the others altered with unusual powers. Four years later, the stranded victor returns as a megalomaniacal conqueror and the others must put aside their differences to stop him as the Fantastic Four.","Action-Adventure,Family,Science Fiction","Miles Teller,Michael Jordan,Kate Mara,Jamie Bell,Toby Kebbell,Reg Cathey",Josh Trank,,,"Added to Disney+:June 19, 2020"
185,Fantastic Mr. Fox,movie,2009,PG,88 min,"Mr. and Mrs. Fox live a happy home life with their eccentric son Ash and visiting nephew Kristopherson. That is until Mr. Fox slips into his sneaky, old ways and plots the greatest chicken heist the animal world has ever seen. Based on Charlie and the Chocolate Factory, the beloved, best-selling book by Roald Dahl, Fantastic Mr. Fox is family fun at its finest.","Animation,Comedy,Crime","George Clooney,Meryl Streep,Jason Schwartzman,Bill Murray,Wally Wolodarsky,Eric Anderson",Wes Anderson,"United States,United Kingdom",https://www.imdb.com/title/tt0432283/?ref_=plg_rt_1,"Added to Disney+:May 22, 2020"
186,Ferdinand the Bull,movie,1938,TV-G,8 min,"In this Academy Award winning short, Ferdinand is a quiet, gentle bull who only wants to stop and smell the flowers. But, when he is stung by a bee, the townspeople believe he is ferocious and take him to the bullfight ring! Once in the ring, all Ferdinand cares about is the bouquet of tossed to the matador. Contains tobacco depictions. This program is presented as originally created. It may contain outdated cultural depictions.","Animation,Comedy,Family",,Dick Rickard,United States,https://www.imdb.com/title/tt0030128/?ref_=plg_rt_1,"Added to Disney+:November 12, 2019"
187,Finding Dory,movie,2016,PG,98 min,"From the Academy Award®–winning creators of Disney•Pixar’s Finding Nemo (Best Animated Feature, 2003) comes an epic undersea adventure filled with imagination, humor and heart. When Dory, the forgetful blue tang (Ellen DeGeneres), suddenly remembers she has a family who may be looking for her, she, Marlin (Albert Brooks) and Nemo (Hayden Rolence) take off on a life-changing quest to find them…with help from Hank, a cantankerous octopus; Bailey, a beluga whale who’s convinced his biological sonar skills are on the fritz; and Destiny, a nearsighted whale shark! Dive into the movie overflowing with unforgettable characters, dazzling animation and gallons of fun! Some flashing lights sequences or patterns may affect photosensitive viewers.","Action-Adventure,Animation,Comedy","Ellen DeGeneres,Albert Brooks,Ed O'Neill,Kaitlin Olson,Hayden Rolence,Ty Burrell","Andrew Stanton,Angus MacLane",United States,https://www.imdb.com/title/tt2277860/?ref_=plg_rt_1,"Added to Disney+:November 12, 2019"
188,Finding Nemo,movie,2003,G,103 min,"Nemo, an adventurous young clownfish, is unexpectedly captured from Australia's Great Barrier Reef and taken to a dentist's office aquarium. It's up to Marlin (Albert Brooks), his worrisome father, and Dory (Ellen DeGeneres), a friendly but forgetful regal blue tang fish, to make the epic journey to bring Nemo home. Their adventure brings them face-to-face with vegetarian sharks, surfer dude turtles, hypnotic jellyfish, hungry seagulls and more. Marlin discovers a bravery he never knew, but will he be able to find his son?","Action-Adventure,Animation,Comedy","Albert Brooks,Ellen DeGeneres,Alexander Gould,Willem Dafoe,Brad Garrett,Allison Janney",Andrew Stanton,"United States,Australia",https://www.imdb.com/title/tt0266543/?ref_=plg_rt_1,"Added to Disney+:November 12, 2019"
189,First Kid,movie,1996,PG,102 min,"Sinbad plays wisecracking Secret Service agent Sam Simms, assigned to protect the President's rebellious 14-year-old son Luke (Brock Pierce). Simms would much rather be protecting the President, and Luke would prefer to be just a regular kid without a watchdog trailing him everywhere he goes. But a genuine friendship develops between the two when Simms volunteers to teach Luke how to deal with a school bully (Zachery Ty Bryan), and to untie his tongue so that he can win over a cute girl in class. But when Luke's mysterious Internet buddy convinces him to ditch his bodyguard in a crowded mall, the fun and games suddenly become a matter of life and death! Contains tobacco depictions.","Buddy,Comedy,Coming of Age","Sinbad ,Robert Guillaume,Timothy Busfield,Brock Pierce,James Naughton,Art Fleur",David Evans,United States,https://www.imdb.com/title/tt0116311/?ref_=plg_rt_1,"Added to Disney+:November 12, 2019"
190,Flight of the Navigator,movie,1986,PG,90 min,"David Freeman is an ordinary boy destined for a most extraordinary adventure aboard a spectacular, futuristic spacecraft. After a mystifying disappearance, David returns possessing vast, undiscovered knowledge about the farthest reaches of the universe. With these sudden navigational powers, David is able to take the fantastic flying machine anywhere he desires, accompanied by both its wisecracking robotic commander, Max, and an assortment of bizarre extraterrestrial creatures.","Action-Adventure,Science Fiction","Joey Cramer,Veronica Cartwright,Cliff De Young,Sarah Parker,Matt Adler,Howard Hesseman",Randal Kleiser,United States,https://www.imdb.com/title/tt0091059/?ref_=plg_rt_1,"Added to Disney+:November 12, 2019"
191,Float,movie,2019,PG,10 min,"In ""Float,"" a father discovers that his son is different from other kids in the most unusual way. To keep them both safe from judgement, Dad covers him and keeps him out of sight – but when his son’s ability becomes public, Dad must decide whether to run and hide or to accept his son as he is.","Animation,Family,Fantasy","Eli Fucile,Bobby Rubio,Luna Watson,Mika Kubo",Bobby Rubio,United States,https://www.imdb.com/title/tt9536846/?ref_=plg_rt_1,"Added to Disney+:November 12, 2019"
192,Flowers and Trees,movie,1932,TV-Y7,8 min,The story of the cartoon concerns two trees in love who are threatened by a jealous old stump that attempts to burn the forest down in order to destroy them. But he only succeeds in reducing himself to ash. The forest revives and celebrates the wedding. This program is presented as originally created. It may contain outdated cultural depictions.,"Animation,Family,Kids",,Burt Gillett,United States,https://www.imdb.com/title/tt0022899/?ref_=plg_rt_1,"Added to Disney+:November 12, 2019"
193,Flubber,movie,1997,PG,96 min,"Brilliant but befuddled Professor Phillip Brainard (Robin Williams) is on the brink of inventing a revolutionary energy source... and missing his wedding to Dr. Sara Jean Reynolds (Marcia Gay Harden), president of financially challenged Medfield College, for the third time. When Phillip experiments with his own theory, he instead creates Flubber, a miraculous elastic goo. Phillip and Weebo, his flying cyber sidekick, soon discover that when Flubber is applied to anything, it can bounce super high and fast. But is Flubber good enough to win back Sara and save Medfield from its financial problems?","Comedy,Family,Science Fiction","Robin Williams,Marcia Harden,Christopher McDonald,Raymond Barry,Clancy Brown,Ted Levine",Les Mayfield,United States,https://www.imdb.com/title/tt0119137/?ref_=plg_rt_1,"Added to Disney+:November 12, 2019"
194,Food for Feudin',movie,1950,TV-G,7 min,"Chip and Dale are busy collecting nuts and hiding them in a tree, when Pluto comes along and tries to hide his bone in the same tree. When all of the nuts end up in Pluto's dog house, Chip and Dale must come up with a way to get the nuts back. This program is presented as originally created. It may contain outdated cultural depictions.","Animation,Comedy,Family",,Charles Nichols,,,"Added to Disney+:November 12, 2019"
195,For the Birds,movie,2001,G,4 min,"One by one, a flock of small birds perches on a telephone wire. Sitting close together has problems enough, and then comes along a large dopey bird who tries to join them. The birds of a feather can’t help but make fun of him – and the clique mentality proves embarrassing in the end.","Animation,Comedy,Family",,Ralph Eggleston,United States,https://www.imdb.com/title/tt0248808/?ref_=plg_rt_1,"Added to Disney+:November 12, 2019"
196,Forky Asks a Question: What is a Computer?,movie,2019,TV-G,6 min,"
                    Trixie explains to Forky what a computer does as they experience the common stresses of technology.                                      ","Animation,Comedy,Family","Tony Hale,Kristen Schaal,James Brinkley,Bob Peterson",Bob Peterson,,,"Added to Disney+:December 13, 2019"
197,Forky Asks a Question: What is a Friend?,movie,2019,TV-G,6 min,Forky shares his thoughts on what makes a good friend based on his limited exposure to the world inside Bonnie’s house.,"Animation,Comedy,Family","Tony Hale,John Ratzenberger,Bob Peterson",Bob Peterson,,,"Added to Disney+:November 15, 2019"
198,Forky Asks a Question: What is a Leader?,movie,2019,TV-G,6 min,"Dolly teaches Forky about the qualities of a good leader, and Forky puts those qualities to the test!","Animation,Comedy,Family","Tony Hale,Bonnie Hunt,Bob Peterson",Bob Peterson,,,"Added to Disney+:December 20, 2019"
199,Forky Asks a Question: What is a Pet?,movie,2019,TV-G,7 min,"Forky meets Rib Tickles and finds her charming and pleasant, only to be schooled by Rib on the dangers of law enforcement. Some flashing lights sequences or patterns may affect photosensitive viewers.","Animation,Comedy,Family","Tony Hale,Aloma Wright,Bob Peterson",Bob Peterson,,,"Added to Disney+:December 27, 2019"
200,Forky Asks a Question: What is Art?,movie,2019,TV-G,7 min,Mr. Pricklepants mentors Forky about the complexities of being an actor and the art of a convincing performance.,"Animation,Comedy,Family","Tony Hale,Robin Downes,Bob Peterson",Bob Peterson,,,"Added to Disney+:November 22, 2019"
201,Forky Asks a Question: What is Love?,movie,2019,TV-G,7 min,"Forky attempts to understand the concept of love from Bonnie’s elder toys who believe they’ve been there, done that.","Animation,Comedy,Family","Tony Hale,Carl Reiner,Mel Brooks,Carol Burnett,Betty White,Kristen Schaal",Bob Peterson,,,"Added to Disney+:December 6, 2019"
202,Forky Asks a Question: What is Money?,movie,2019,TV-G,6 min,"
                    Hamm attempts to give Forky a lesson on how the US monetary system works.                                      ","Animation,Comedy,Family","Tony Hale,John Ratzenberger,Bob Peterson",Bob Peterson,,,"Added to Disney+:November 12, 2019"
203,Forky Asks a Question: What is Time?,movie,2019,TV-G,6 min,"
                    Rex uses the age of dinosaurs as an example to give Forky an understanding of the concept of time.                                      ","Animation,Comedy,Family","Tony Hale,Wallace Shawn,Alan Oppenheimer,Bob Peterson",Bob Peterson,,,"Added to Disney+:November 29, 2019"
204,Frank and Ollie,movie,1995,PG,89 min,"Before computer graphics, special effects wizardry and advanced technology, the magic of animation flowed from the pencils of two of the greatest animators The Walt Disney Studios ever produced: Frank Thomas and Ollie Johnston. Frank and Ollie, the talent behind Bambi, Pinocchio, Lady and the Tramp, The Jungle Book and more, set the standard for many of today's animated hits. It was their creative genius that helped make Disney synonymous with brilliant animation, magnificent music and emotional storytelling. Take a journey with these extraordinary artists as they share secrets, insights and the inspiration behind some of the greatest animated movies the world has ever known.","Biographical,Documentary","Frank Thomas,Ollie Johnston,Sylvia Roemer,John Canemaker,John Culhane,Marie Johnston",Theodore Thomas,United States,https://www.imdb.com/title/tt0113104/?ref_=plg_rt_1,"Added to Disney+:November 12, 2019"
205,Frankenweenie (2012),movie,2012,PG,88 min,"From Disney and creative genius Tim Burton (Alice in Wonderland, The Nightmare Before Christmas) comes the hilarious and offbeat Frankenweenie, a heartwarming tale about a boy and his dog. After unexpectedly losing his beloved dog Sparky, young Victor harnesses the power of science to bring his best friend back to life – with just a few minor adjustments. He tries to hide his home-sewn creation, but when Sparky gets out, Victor's fellow students, teachers and the entire town learn that getting a new ""leash on life"" can be monstrous.","Animation,Drama,Parody","Catherine O'Hara,Martin Short,Martin Landau,Charlie Tahan,Atticus Shaffer,Winona Ryder",Tim Burton,United States,https://www.imdb.com/title/tt1142977/?ref_=plg_rt_1,"Added to Disney+:April 1, 2020"
206,Frankenweenie (Short),movie,1984,PG,27 min,"Meet Sparky, an ordinary family dog, who, through an extraordinary set of circumstances, becomes Frankenweenie! He and the Frankenstein family share an exciting yet bizarre adventure that makes this one of the most outrageously funny films you’ve ever seen! It stars young Barret Oliver with Daniel Stern and Shelley Duvall as his parents. Let Frankenweenie give your funny bone a jolt – it’ll have your entire family in stitches!","Drama,Parody,Science Fiction","Shelley Duvall,Daniel Stern,Barret Oliver",Tim Burton,United States,https://www.imdb.com/title/tt0087291/?ref_=plg_rt_1,"Added to Disney+:November 12, 2019"
207,Freaky Friday (1977),movie,1976,G,98 min,"Trading places was never so funny, and it could only happen on Friday the 13th. That's when the tomboyish and free-spirited Annabel (Jodie Foster) switches bodies with her straitlaced mother, Ellen (Barbara Harris), and suddenly finds herself responsible for running the entire household. In turn, Ellen, now in her daughter's body, faces the daunting challenges of school, including a typing test, field hockey competition and much more! Contains tobacco depictions.","Comedy,Family,Fantasy","Barbara Harris,Jodie Foster,John Astin,Patsy Kelly,Dick Van Patten,Vicki Schreck",Gary Nelson,United States,https://www.imdb.com/title/tt0076054/?ref_=plg_rt_1,"Added to Disney+:November 12, 2019"
208,Freaky Friday (2003),movie,2003,PG,98 min,"Dr. Tess Coleman (Jamie Lee Curtis) and her teenage daughter Anna (Lindsay Lohan) have one thing in common: they don't relate to each other on anything. Not clothes or men or Anna's passion to be in a rock band. Nothing. Then one Friday night, a little mystic mayhem changes their lives and they wake up to the biggest freak-out ever – Tess and Anna are trapped inside each other's body. With Tess's wedding on Saturday, the two must find a way to switch back... and fast. Literally forced to walk in each other's shoes, will they gain respect and understanding for the other's point of view?","Comedy,Family,Fantasy","Jamie Curtis,Lindsay Lohan,Harold Gould,Chad Murray,Stephen Tobolowsky,Christina Vidal",Mark Waters,United States,https://www.imdb.com/title/tt0322330/?ref_=plg_rt_1,"Added to Disney+:November 12, 2019"
209,Freaky Friday (2018),movie,2018,TV-G,93 min,"In Disney’s madcap musical comedy about a body-swapping mother and daughter, Ellie is a feisty sixteen-year-old trying to assert her independence. Katherine is a stressed mom who can’t understand her stubborn teenager. There’s a big confrontation when Katherine won’t allow Ellie to join “The Hunt,” an all-night scavenger quest. When they both angrily wish each other could see things her way, the power of an hourglass causes them to magically switch bodies. Now they must spend the day in each other’s shoes while they hunt down the matching hourglass so they can change back to their true selves.","Comedy,Coming of Age,Fantasy","Cozi Zuehlsdorff,Heidi Blickenstaff,Jason Maybaum,Alex Désert,Ricky He,Kahyun Kim",Steve Carr,United States,https://www.imdb.com/title/tt7631348/?ref_=plg_rt_1,"Added to Disney+:November 12, 2019"
210,Free Solo,movie,2018,TV-PG,101 min,"A stunning, intimate and unflinching portrait of free solo climber Alex Honnold, as he prepares to achieve his lifelong dream: scaling the face of the world’s most famous rock – the 3,200-foot El Capitan in Yosemite National Park – without a rope. Renowned filmmakers E. Chai Vasarhelyi and Jimmy Chin capture the death-defying climb with exquisite artistry and masterful, vertigo-inducing camerawork.","Action-Adventure,Documentary,Sports","Alex Honnold,Tommy Caldwell","Elizabeth Vasarhelyi,Jimmy Chin",United States,https://www.imdb.com/title/tt7775622/?ref_=plg_rt_1,"Added to Disney+:November 12, 2019"
211,Frenemies,movie,2012,TV-G,88 min,"Geek vs. chic…beauty vs. beast…downtown vs. uptown…how do you know?  Follow the lives of three very different sets of friends, each dealing with the ups and downs of friendship. As all three sets weave through each other's lives, they ultimately need to work out their differences to figure out what friendships mean to them.","Anthology,Comedy,Coming of Age","Zendaya ,Bella Thorne,Mary Mouser,Nick Robinson,Stefanie Scott,Connor Price",Daisy Mayer,United States,https://www.imdb.com/title/tt1865368/?ref_=plg_rt_1,"Added to Disney+:November 12, 2019"
212,Frozen,movie,2013,PG,105 min,"Fearless optimist Anna teams up with rugged mountain man Kristoff and his loyal reindeer Sven in an epic journey to find Anna's sister Elsa, whose icy powers have trapped the kingdom of Arendelle in eternal winter. Encountering Everest-like conditions, mystical trolls and a hilarious snowman named Olaf, will the trio find Elsa in time to save Arendelle?","Animation,Fantasy,Kids","Kristen Bell,Idina Menzel,Jonathan Groff,Josh Gad,Santino Fontana,Alan Tudyk","Chris Buck,Jennifer Lee",United States,https://www.imdb.com/title/tt2294629/?ref_=plg_rt_1,"Added to Disney+:November 12, 2019"
213,Frozen II,movie,2019,PG,107 min,"Why was Elsa born with magical powers? What truths about the past await Elsa as she ventures into the unknown to the enchanted forests and dark seas beyond Arendelle? The answers are calling her but also threatening her kingdom. Together with Anna, Kristoff, Olaf and Sven, she'll face a dangerous but remarkable journey. In Frozen, Elsa feared her powers were too much for the world. In Frozen II, she must hope they are enough.","Action-Adventure,Animation,Family","Kristen Bell,Idina Menzel,Josh Gad,Jonathan Groff,Sterling Brown,Evan Wood","Chris Buck,Jennifer Lee",United States,https://www.imdb.com/title/tt4520988/?ref_=plg_rt_1,"Added to Disney+:March 14, 2020"
214,Full-Court Miracle,movie,2003,TV-G,95 min,"The life of Lamont Carr inspired this cross-cultural, spiritual story of an African-American former college basketball star who is convinced by a group of Jewish school boys to coach their winless basketball team. The boys are also studying the miraculous Chanukah story of Judah and the Maccabees and, finding similarities between Lamont and Judah, they become convinced that he is an incarnation of the Jewish hero. The importance of perseverance, teamwork, the pursuit of dreams, faith and the miracle of light are presented in a stirring and welcoming manner as the coach and young team build toward the day of the championship game.","Coming of Age,Drama,Sports","Alex Linz,R.H. Thomson,Sean Marquette,Jase Blankfort,Erik Knudsen,David Sazant",Stuart Gillard,United States,https://www.imdb.com/title/tt0382142/?ref_=plg_rt_1,"Added to Disney+:November 12, 2019"
215,Fun and Fancy Free,movie,1947,G,74 min,"This delightful gem not only sparkles with charm, but is rich in history-making Disney moments. It was the last animated feature starring Walt Disney as the voice of Mickey Mouse, and the only film featuring four of Walt's most famous characters:  Mickey Mouse, Donald Duck, Goofy and Jiminy Cricket. In Disney's classic tradition of great storytelling, unforgettable characters, music and adventure, Jiminy Cricket hosts two lively tales:  Bongo, the whimsical story of a little circus bear who proves that the size of his heart and brain is bigger than the most bearish bully; and Mickey and the Beanstalk, where Mickey, Donald and Goofy confront Willie the Giant in Disney's animated adaptation of ""Jack and the Beanstalk.""","Action-Adventure,Animation,Comedy","Edgar Bergen,Dinah Shore,Luana Patten,Clarence Nash,Mickey Mouse,Cliff Edwards","Jack Kinney,W. Roberts,Hamilton Luske",United States,https://www.imdb.com/title/tt0039404/?ref_=plg_rt_1,"Added to Disney+:November 12, 2019"
216,Fuzzbucket,movie,1986,TV-G,46 min,"Although he appears to be imaginary to everyone besides 12-year-old Mikey, Fuzzbucket is very real. He just happens to be invisible. Wise and caring, this wonderfully wacky creature becomes Mikey's best friend, helping him through the first day of junior high and a maze of family squabbles. In return, Mikey helps create a concoction that will make him visible to everyone.","Buddy,Comedy,Coming of Age","Chris Hebert,Phil Fondacaro,Joe Regalbuto,Wendy Phillips,Robyn Lively,John Vernon",Mick Garris,United States,https://www.imdb.com/title/tt0286639/?ref_=plg_rt_1,"Added to Disney+:November 12, 2019"
217,G-Force,movie,2009,PG,91 min,"Just as the G-Force, an elite team of highly trained guinea pigs, is about to save the world, the FBI shuts down the secret unit. But these next-generation action heroes – Darwin, loyal team leader; Blaster, weapons expert with attitude to spare; Juarez, drop-dead gorgeous martial arts diva; and tag-along Hurley – won't be stopped. Armed with the latest in high-tech spy equipment, and with the FBI on their tails, the fur flies as they race against the clock to save the world.","Action-Adventure,Comedy,Family","Bill Nighy,Will Arnett,Zach Galifianakis,Kelli Garner,Tyler Jones,Jack Conley","Hoyt Yeatman,Hoyt Yeatman IV",United States,https://www.imdb.com/title/tt0436339/?ref_=plg_rt_1,"Added to Disney+:March 15, 2020"
