,title,type,release_year,rating,runtime,description,genres,cast,director,country,imdb_link,date_added
566,The Biscuit Eater,movie,1972,G,93 min,"This classic film proves that nothing warms the heart like the story of a boy and his dog. Lonnie (Johnny Whitaker) and Text (George Spell) are two friends determined, against all odds, to turn a misfit hound into a hero. Tennessee farmer and dog trainer Harve McNeil (Earl Holliman) tells his son Lonnie that his dog, Moreover, is a good-for-nothing ""biscuit eater."" But Lonnie and Text won't give up on the outcast, determined to beat the odds in time to prove he has championship potential. Featuring valuable lessons about honesty, friendship and fair play – your family will love this endearing story. This program is presented as originally created. It may contain outdated cultural depictions.","Animals & Nature,Drama,Family","Earl Holliman,Patricia Crowley,Lew Ayres,Godfrey Cambridge,Beah Richards,Clifton James",Vincent McEveety,United States,https://www.imdb.com/title/tt0068276/?ref_=plg_rt_1,"Added to Disney+:November 12, 2019"
567,The Black Cauldron,movie,1985,PG,82 min,"Fantasy, magic and fun are all brewed together in this legendary adventure. Whoever releases the mysterious Black Cauldron's power will be invincible. The fearsome Horned King will do anything to possess it, but he is challenged by the most unlikely adversary: a young assistant pig keeper named Taran, who dreams of doing heroic deeds. With a motley team including the brave Princess Eilonwy, a minstrel named Fflewddur Fflam and Hen Wen, a remarkable pig who can predict the future, Taran embarks on a quest to stop the Black Cauldron's evil once and for all. Will he have the courage to succeed?","Action-Adventure,Animation,Coming of Age","Grant Bardsley,Susan Sheridan,Freddie Jones,Nigel Hawthorne,Arthur Malet,John Byner","Ted Berman,Richard Rich","United States,United Kingdom",https://www.imdb.com/title/tt0088814/?ref_=plg_rt_1,"Added to Disney+:November 12, 2019"
568,The Black Hole,movie,1979,PG,98 min,"A deep-space expedition comes across a long-lost spaceship perched precariously at the edge of a black hole – the vast, empty nothingness where space and time end. Anything that crosses its border enters a universe of the complete unknown. In this story of genius robots and mad humanoids, audiences take a spectacular descent into nature's ultimate mystery: The Black Hole.","Action-Adventure,Science Fiction,Thriller","Maximilian Schell,Anthony Perkins,Robert Forster,Joseph Bottoms,Yvette Mimieux,Ernest Borgnine",Gary Nelson,United States,https://www.imdb.com/title/tt0078869/?ref_=plg_rt_1,"Added to Disney+:November 12, 2019"
569,The Blue Umbrella,movie,2013,G,7 min,"It is just another evening commute until the rain starts to fall, and the city comes alive to the sound of dripping rain pipes, whistling awnings and gurgling gutters. And in the midst, two umbrellas – one blue, one not – fall eternally in love.","Animation,Family,Kids",Sarah Jaffe,Saschka Unseld,United States,https://www.imdb.com/title/tt2616880/?ref_=plg_rt_1,"Added to Disney+:November 12, 2019"
570,The Boy Who Talked to Badgers,movie,1975,TV-PG,90 min,"Young Benjamin MacDonald has chores to do, much like any other boy living on the frontier might. But ""Benjy"" would much rather spend his days wandering the prairie with his best friends. Much to his father's dismay, his best friends just happen to be covered in fur and feathers. Benjy seems to get along with animals better than people, and some folks even say he can talk to them. When one of Benjy's furry friends, an old badger, goes missing, Benjy sets off to find him and gets swept away in a raging river that carries him far from home. Now lost and injured, Benjy must rely on his badger friend to survive the harsh wilderness. Contains tobacco depictions. This program is presented as originally created. It may contain outdated cultural depictions.","Action-Adventure,Animals & Nature,Drama","Carl Betz,Salome Jens,Christian Juttner,Robert Donner,Denver Pyle,Stuart Lee",Gary Nelson,United States,https://www.imdb.com/title/tt0072728/?ref_=plg_rt_1,"Added to Disney+:April 3, 2020"
571,The Boys: The Sherman Brothers' Story,movie,2009,PG,102 min,"Their music is unforgettable. Their name is legend. The Boys: The Sherman Brothers' Story is an intimate journey through the lives of Robert and Richard Sherman, the astoundingly prolific Academy Award® winning songwriting team. While their songs, ""A Spoonful Of Sugar (Mary Poppins)"" and ""I Want To Be Like You (Jungle Book),"" to name a few, celebrated family entertainment and happy endings, their life together was not as harmonious. Go behind the scenes for a fascinating glimpse into how Walt Disney used the language of music to bring the brothers together, creating a cinematic legacy like no other. Contains tobacco depictions.","Biographical,Documentary,Music",,"Jeffrey Sherman,Gregory Sherman",United States,https://www.imdb.com/title/tt1015971/?ref_=plg_rt_1,"Added to Disney+:May 22, 2020"
572,The Brave Little Toaster Goes to Mars,movie,1998,TV-G,73 min,"Robbie, the master's baby, has been mysteriously beamed to Mars. It's up to Toaster, his old pals and a houseful of new friends – a fan, microwave, calculator, bag of cheddar-flavored popcorn and ""the contraption in the junk drawer"" – to reach for the stars and bring him safely home.","Action-Adventure,Animation,Kids","Deanna Oliver,Tim Stack,Roger Kabler,Thurl Ravenscroft,Eric Lloyd,Farrah Fawcett",Robert Ramirez,United States,https://www.imdb.com/title/tt0147926/?ref_=plg_rt_1,"Added to Disney+:November 12, 2019"
573,The Castaway Cowboy,movie,1974,G,91 min,"When Costain, a shanghaied Texas cowboy, jumps ship off the coast of Kauai, a 12-year-old-boy rescues him from drowning. While Costain waits to return home, he decides to help the boy's mother's failing potato plantation by turning it into a cattle ranch. But first, he must outwit an unscrupulous businessman and an evil witch doctor, and turn the easygoing islanders into ridin' and ropin' cowpokes.","Action-Adventure,Family,Western","James Garner,Vera Miles,Robert Culp,Eric Shea,Elizabeth Smith,Manu Tupou",Vincent McEveety,United States,https://www.imdb.com/title/tt0071288/?ref_=plg_rt_1,"Added to Disney+:November 12, 2019"
574,The Cat from Outer Space,movie,1978,G,104 min,"Cosmic comedy is on the prowl when an extraterrestrial cat named Jake is forced to crash-land his spaceship on Earth. Befriended by an offbeat physicist named Frank, Jake leads Frank, his girlfriend Liz, their gambling-obsessed coworker Link, the U.S. Army, a master criminal and a team of baffled scientists on endless escapades during his unscheduled and hilarious visit.","Comedy,Family,Science Fiction","Ken Berry,Sandy Duncan,Harry Morgan,Roddy McDowall,McLean Stevenson,Jesse White",Norman Tokar,United States,https://www.imdb.com/title/tt0077305/?ref_=plg_rt_1,"Added to Disney+:October 1, 2019"
575,The Cheetah Girls,movie,2003,TV-G,94 min,"Meet The Cheetah Girls (Raven-Symoné, Adrienne Bailon, Kiely Williams, Sabrina Bryan), four New York teens facing the challenges of growing up as they dance and sing their way toward that elusive record deal. As the girls gear up to rehearse for the school talent competition, they're discovered by famous record producer Jackal Johnson. But the feisty foursome soon learn that their big break is not what they expected, as Jackal wants to remake them into something they're not. Ultimately, the path to stardom challenges their friendship, and the girls must find a way to come together to achieve their dreams. Packed with hot songs and cool moves, these darling divas steal the show in this hit Disney Channel movie.","Coming of Age,Drama,Music","Raven ,Adrienne Bailon,Kiely Williams,Sabrina Bryan,Juan Chioran,Lori Alter",Oz Scott,"Canada,United States",https://www.imdb.com/title/tt0338852/?ref_=plg_rt_1,"Added to Disney+:November 12, 2019"
576,The Cheetah Girls 2,movie,2006,TV-G,98 min,"Best friends Galleria (Raven-Symoné), Chanel (Adrienne Bailon), Dorinda (Sabrina Bryan) and Aqua (Kiely Williams), aka girl band ""The Cheetahs,"" get the opportunity of a lifetime when they strut their way to Barcelona, Spain, to perform in an international music festival. With the other girls preoccupied with other things (like getting their shop on), Galleria will need to restore the girls' focus if they hope to have a shot at winning the music competition. Along the way, the ""amigas Cheetahs"" learn that, although their paths are not the same, they are lucky to have one another for the journey.","Coming of Age,Drama,Music","Raven-Symoné ,Adrienne Bailon,Sabrina Bryan,Kiely Williams,Belinda Peregrin,Lori Alter",Kenny Ortega,United States,https://www.imdb.com/title/tt0800318/?ref_=plg_rt_1,"Added to Disney+:November 12, 2019"
577,The Cheetah Girls: One World,movie,2008,TV-G,85 min,"They've rocked the U.S., taken Spain by storm, and now they're off to India for the adventure of a lifetime. When the stylin' Cheetah Girls get cast in a Bollywood musical, they're ready to show the world their totally cool dance moves and movie star potential. This could be their big break! But when Chanel (Adrienne Bailon), Aqua (Kiely Williams) and Dorinda (Sabrina Bryan) find out they have to compete against each other for the starring role, their friendship – and the group – may be in serious trouble. Can they make their own dreams come true and still remain The Cheetah Girls? Find out as they journey halfway around the world and follow their dreams to Bollywood.","Comedy,Coming of Age,Music","Adrienne Bailon,Sabrina Bryan,Kiely Williams,Roshan Seth,Michael Steger,Kunal Sharma",Paul Hoen,United States,https://www.imdb.com/title/tt1013542/?ref_=plg_rt_1,"Added to Disney+:November 12, 2019"
578,The Christmas Star,movie,1986,TV-G,94 min,"Counterfeiter Horace McNickle escapes prison through his extraordinary likeness to St. Nick. The police are closing in, but Christmas is so near that there are Santas everywhere. McNickle is desperate to recover loot from an earlier caper but can’t make a move until he takes advantage of two neighborhood kids who really believe he is Santa.","Crime,Drama,Family","Edward Asner,René Auberjonois,Jim Metzler,Susan Tyrrell,Karen Landry,Alan North",Alan Shapiro,"Canada,United States",https://www.imdb.com/title/tt0090840/?ref_=plg_rt_1,"Added to Disney+:November 12, 2019"
579,The Chronicles of Narnia: Prince Caspian,movie,2008,PG,154 min,"A year after their first journey to Narnia, siblings Peter, Susan, Edmund and Lucy Pevensie return, finding that centuries have passed in the magical kingdom.  Much has changed, and all is not well in the once-peaceful place they left. To restore the rightful heir, Prince Caspian, they must again join with majestic lion Aslan, friendly new Narnian creatures and the Prince himself as they lead the Narnians on a remarkable journey to bring peace and glory to their enchanted land.","Action-Adventure,Family,Fantasy","Georgie Henley,Skandar Keynes,William Moseley,Anna Popplewell,Ben Barnes,Peter Dinklage",Andrew Adamson,"United States,Poland,Slovenia,Czech Republic,United Kingdom",https://www.imdb.com/title/tt0499448/?ref_=plg_rt_1,"Added to Disney+:November 12, 2019"
580,"The Chronicles of Narnia: The Lion, the Witch and the Wardrobe",movie,2005,PG,147 min,"Prepare to enter another world when Walt Disney Pictures and Walden Media present C.S. Lewis' timeless and beloved adventure. With the stunningly realistic special effects, you'll experience the exploits of Lucy, Edmund, Susan, and Peter, four siblings who find the world of Narnia through a magical wardrobe while playing a game of ""hide-and-seek"" at the country estate of a mysterious professor. Once there, the children discover a charming, once peaceful land inhabited by talking beasts, dwarfs, fauns, centaurs, and giants that has been turned into a world of eternal winter by the evil White Witch, Jadis. Aided by the wise and magnificent lion Aslan, the children lead Narnia into a spectacular climactic battle to be free of the Witch's glacial powers forever! Contains tobacco depictions.","Action-Adventure,Family,Fantasy","Georgie Henley,Skandar Keynes,William Moseley,Anna Popplewell,Tilda Swinton,James McAvoy",Andrew Adamson,"United Kingdom,United States",https://www.imdb.com/title/tt0363771/?ref_=plg_rt_1,"Added to Disney+:November 12, 2019"
581,The Color of Friendship,movie,2000,TV-G,83 min,"Two girls from opposite sides of the world come together and change each other’s lives. Mahree lives in apartheid South Africa with her wealthy family. Piper Dellums is the daughter of a U.S. congressman in Washington, D.C. When Mahree is chosen to spend a semester at the Dellums' house, she and Piper realize they weren’t what each other expected. Each girl has to face the assumptions she has made and learn the true color of friendship.","Biographical,Drama","Carl Lumbly,Penny Johnson,Shadia Simmons,Anthony Burnett,Travis Davis,Lindsey Haun",Kevin Hooks,"Canada,United States",https://www.imdb.com/title/tt0213565/?ref_=plg_rt_1,"Added to Disney+:November 12, 2019"
582,The Computer Wore Tennis Shoes,movie,1969,G,90 min,"Dexter Riley (Kurt Russell), a handsome but bumbling Medfield College student, accidentally becomes a ""human computer"" when he is effortlessly transformed from half-wit to genius in an electrifying computer mishap. Gamblers, gangsters and greedy college deans are quick to fight for control of his computer-like brain... especially when Dexter nonchalantly starts blabbing the syndicate's secrets!","Comedy,Crime,Science Fiction","Kurt Russell,Cesar Romero,Joe Flynn,William Schallert,Alan Hewitt,Richard Bakalyan",Robert Butler,United States,https://www.imdb.com/title/tt0065566/?ref_=plg_rt_1,"Added to Disney+:November 12, 2019"
583,The Country Bears,movie,2002,G,91 min,"One of the most heartwarming family adventures ever, this hilarious comedy is packed with fantastic fun and foot-stomping music for the whole family. For Beary Barrington, The Country Bears' young #1 fan, fitting in with his all-too-human family is proving im-paws-ible. When he runs away to find Country Bear Hall and his heroes, he discovers the venue that made them famous is near foreclosure. Beary hightails it over the river and through the woods to get the Bears in the Band back together for an all-out reunion concert to save Country Bear Hall. And on the way to find his place in the world, Beary learns that true families are made up of those people who love you the most.","Comedy,Music","Christopher Walken,Stephen Tobolowsky,Daryl Mitchell,M.C. Gainey,Diedrich Bader,Alex Rocco",Peter Hastings,United States,https://www.imdb.com/title/tt0276033/?ref_=plg_rt_1,"Added to Disney+:November 12, 2019"
584,The Emperor's New Groove,movie,2000,G,82 min,"Emperor Kuzco (David Spade) thought he had it all: a devoted populace to rule over, a wardrobe of glamorous garb and his unwavering ""groove."" But his world is flipped upside down when he's turned into a llama by his devious adviser Yzma (Eartha Kitt), and her hunky henchman Kronk (Patrick Warburton). Now the once-mighty ruler is forced into an unlikely alliance with pleasant peasant Pacha (John Goodman). Together, they must overcome their differences as they embark on a groovy adventure. Discovering the good in everyone has never been so much fun!","Action-Adventure,Animation,Family","David Spade,John Goodman,Eartha Kitt,Patrick Warburton,Wendie Malick,Eli Linnetz",Mark Dindal,United States,https://www.imdb.com/title/tt0120917/?ref_=plg_rt_1,"Added to Disney+:November 12, 2019"
585,The Even Stevens Movie,movie,2003,TV-G,94 min,"Dream vacation? Dream on! Ren (Christy Carlson Romano), Louis (Shia LaBeouf), and the entire Stevens family battle ferocious squirrels, angry natives and one another on the surprise adventure of a lifetime. Out of the blue, the Stevens win an all-expense-paid trip to a secluded hideaway on the sunny isle of Mandelino... just what they need to get away from everyday stress. Unfortunately, their too-good-to-be-true week in paradise has actually been set up by a new ""extreme reality"" television series. And in a quest for blockbuster ratings, the show's unscrupulous host will try to turn the family's dream vacation into a savagely funny nightmare.","Action-Adventure,Comedy","Shia LaBeouf,Christy Romano,Tom Virtue,Nick Spano,Steven Lawrence,A.J. Trauth",Sean McNamara,United States,https://www.imdb.com/title/tt0327698/?ref_=plg_rt_1,"Added to Disney+:November 12, 2019"
586,The Finest Hours,movie,2016,PG-13,119 min,"Based on the extraordinary true story of the greatest small-boat rescue in Coast Guard history, this is a saga of courage, loyalty and honor in the face of overwhelming odds. When a massive storm strikes off the coast of Cape Cod, it rips a T-2 oil tanker in half, trapping more than 30 sailors on its rapidly sinking stern. As Captain Bernie Webber (Chris Pine) and his crew set out in a 12-seat rescue boat to save them, Chief Engineer Ray Sybert (Casey Affleck) struggles to buy his men more time. This gripping tale is packed with heroic larger-than-life action, driven by the men’s faith in their mission, themselves and one another.","Action-Adventure,Disaster,Drama","Chris Pine,Casey Affleck,Ben Foster,Holliday Grainger,John Ortiz,Kyle Gallner",Craig Gillespie,United States,https://www.imdb.com/title/tt2025690/?ref_=plg_rt_1,"Added to Disney+:March 6, 2020"
587,The Flood,movie,2018,TV-PG,93 min,"In the heart of southern Africa’s largest desert lies a miracle – the Okavango Delta in Botswana. One of the most diverse habitats on Earth, each year it undergoes an epic transformation as desert becomes water wonderland. For many, the floodwaters are a lifeline. For others, they bring harsh challenges. But for all, life is ruled by the pulsing of Africa’s great flood.","Animals & Nature,Documentary",Angela Bassett,Brad Bestelink,United States,https://www.imdb.com/title/tt9154632/?ref_=plg_rt_1,"Added to Disney+:November 12, 2019"
588,The Fox and the Hound,movie,1981,G,85 min,"When a feisty little fox named Tod meets Copper, an adorable hound puppy, the two grow up together and vow to be best buddies forever. But when Copper is expected to take on his natural role as a hunting dog, he and Tod face the ultimate test of their unlikely friendship.","Action-Adventure,Animation,Buddy","Mickey Rooney,Kurt Russell,Pearl Bailey,Jack Albertson,Sandy Duncan,Jeanette Nolan","Art Stevens,Ted Berman,Richard Rich",United States,https://www.imdb.com/title/tt0082406/?ref_=plg_rt_1,"Added to Disney+:November 12, 2019"
589,The Fox and the Hound 2,movie,2006,G,72 min,"Get ready to go a little bit country! The classic tale of friendship and loyalty, Tod and Copper still go together like an itch and a scratch. But when Copper gets a shot at the big time with a nutty group of hound dog howlers, their purebred friendship is put to the test.","Action-Adventure,Animation,Buddy","Reba McEntire,Patrick Swayze,Jonah Bobo,Harrison Fahn,Jeff Foxworthy,Vicki Lawrence",Jim Kammerud,United States,https://www.imdb.com/title/tt0465997/?ref_=plg_rt_1,"Added to Disney+:November 12, 2019"
590,The Game Plan,movie,2007,PG,112 min,"One of football's toughest players ever takes on his biggest challenge yet – fatherhood. A superstar with an ego bigger than a football field, Joe Kingman is getting ready for a run at the championship game when the 8-year-old daughter he never knew existed shows up at his not-so-family-friendly bachelor pad. As the big game gets closer, he begins to realize the most meaningful win he can achieve is the heart of the one little fan who counts the most. Some flashing lights sequences or patterns may affect photosensitive viewers.","Comedy,Family,Sports","Dwayne Johnson,Kyra Sedgwick,Morris Chestnut,Roselyn Sanchez,Madison Pettis,Gordon Clapp",Andy Fickman,United States,https://www.imdb.com/title/tt0492956/?ref_=plg_rt_1,"Added to Disney+:November 12, 2019"
591,The Ghosts of Buxley Hall,movie,1980,TV-PG,93 min,"The ghostly residents of 100-year-old Buxley Hall conjure up supernatural mayhem when the financially strapped school is forced to allow girls into the boys-only academy. Their only hope is 13-year-old Jeremy, a shy cadet who is heir to a fortune. But when the ghosts learn that Jeremy’s conniving aunt is out to steal his inheritance so she can buy the school and demolish it, they charge to his rescue.","Comedy,Family,Fantasy","Dick O'Neill,Victor French,Louise Latham,Rad Daly,Monte Markham,Ruta Lee",Bruce Bilson,United States,https://www.imdb.com/title/tt0080788/?ref_=plg_rt_1,"Added to Disney+:November 12, 2019"
592,The Goddess of Spring,movie,1934,TV-Y7,10 min,"The lovely goddess of spring, Persephone, is kidnapped by Hades, thus bringing about the winter season. This program is presented as originally created. It may contain outdated cultural depictions.","Animation,Family,Fantasy",,Wilfred Jackson,United States,https://www.imdb.com/title/tt0025184/?ref_=plg_rt_1,"Added to Disney+:November 12, 2019"
593,The Golden Touch,movie,1935,TV-Y7,11 min,"A dwarf grants the king's wish that everything he touches will turn to gold. When the king finds that he cannot eat, he is no longer happy with the gift. By giving up his worldly property, he finds happiness going from riches to rags. This program is presented as originally created. It may contain outdated cultural depictions.","Animation,Family,Fantasy",,Walt Disney,United States,https://www.imdb.com/title/tt0026423/?ref_=plg_rt_1,"Added to Disney+:November 12, 2019"
594,The Good Dinosaur,movie,2015,PG,94 min,"In Disney•Pixar's epic journey into the world of dinosaurs, an 11-year-old apatosaurus named Arlo is swept away by a raging river and finds himself hundreds of miles away from home. While traveling through a harsh and mysterious landscape, Arlo makes an unlikely human friend and learns the power of confronting his fears, discovering what he’s truly capable of doing. Some flashing lights sequences or patterns may affect photosensitive viewers.","Action-Adventure,Animation,Buddy","Jeffrey Wright,Frances McDormand,Maleah Padilla,Ryan Teeple,Jack McGraw,Marcus Scribner",Peter Sohn,United States,https://www.imdb.com/title/tt1979388/?ref_=plg_rt_1,"Added to Disney+:November 12, 2019"
595,The Great Mouse Detective,movie,1986,G,74 min,"The clues are in, the chase is on, and the case of the century is about to break wide open in Disney's greatest little mystery in history. Come along on a journey through the cobblestone streets of 1897 London, where some suspicious ""mousechief"" is the suspenseful start to this thrilling musical adventure. Olivia, the brave daughter of a beloved toy maker, turns to Basil of Baker Street for help with her father's disappearance. Basil's jolly assistant, Dr. Dawson, and loyal dog Toby lend a paw – and nose – as they search for clues through their charming miniature world. The final chase leads to Professor Ratigan (Vincent Price), a hard-hearted criminal. Can Basil outwit Ratigan to save Olivia's father and all of Mousedom? Contains tobacco depictions.","Animation,Family,Mystery","Vincent Price,Barrie Ingham,Val Bettin,Susanne Pollatschek,Candy Candido,Diana Chesney","John Musker,Ron Clements,Dave Michener",United States,https://www.imdb.com/title/tt0091149/?ref_=plg_rt_1,"Added to Disney+:October 1, 2019"
596,The Great Muppet Caper,movie,1981,G,98 min,"Stop the presses! The crime of the century has occurred, and investigative reporters Kermit, Fozzie and Gonzo are out to crack the case in this song-filled, star-studded extravaganza directed by the legendary Jim Henson. Our heroes arrive in London to interview Lady Holiday (Diana Rigg), a high-fashion designer whose priceless diamond necklace has just been stolen. But when Kermit mistakes lovely receptionist/would-be model Miss Piggy for her aristocratic employer, it's love at first sight. Unfortunately, Lady Holiday's scheming brother (Charles Grodin) is also wooing the sultry swine so he can frame her for another brazen jewel heist. Now it's up to Kermit and his Muppet pals to clear Piggy's name and catch the real culprits. Contains tobacco depictions.","Comedy,Crime,Family","Jim Henson,Frank Oz,Dave Goelz,Jerry Nelson,Richard Hunt,Charles Grodin",Jim Henson,"United Kingdom,United States",https://www.imdb.com/title/tt0082474/?ref_=plg_rt_1,"Added to Disney+:November 12, 2019"
597,The Greatest Game Ever Played,movie,2005,PG,122 min,"Based on an inspirational true story, Shia LaBeouf stars as amateur golfer Francis Ouimet. Armed with nothing but talent, the working-class youth has a seemingly impossible dream: to compete against the world's greatest player, his idol Harry Vardon. Soon, with the help of his spunky, 10-year-old caddy Eddie, Francis boldly breaks down all barriers with a thrilling display of unrivaled drive, skill and heart... and challenges the golf pro for the U.S. Open Championship. Contains tobacco depictions.","Biographical,Sports","Shia LaBeouf,Stephen Dillane,Peter Firth,Elias Koteas,Stephen Marcus,Josh Flitter",Bill Paxton,"United States,Canada",https://www.imdb.com/title/tt0388980/?ref_=plg_rt_1,"Added to Disney+:November 12, 2019"
598,The Haunted Mansion,movie,2003,PG,89 min,"Eddie Murphy stars as a real estate agent whose family comes face-to-face with 999 grim, grinning ghosts in creepy old Gracey Manor. Now with the help of supernatural psychic Madame Leota (Jennifer Tilly), they hilariously battle to break the mansion of its age-old curse... and do it before the clock strikes 13.","Comedy,Family,Fantasy","Eddie Murphy,Terence Stamp,Nathaniel Parker,Marsha Thomason,Jennifer Tilly,Wallace Shawn",Rob Minkoff,United States,https://www.imdb.com/title/tt0338094/?ref_=plg_rt_1,"Added to Disney+:November 12, 2019"
