,title,type,release_year,rating,runtime,description,genres,cast,director,country,imdb_link,date_added
404,DreamWorks Holiday Classics,tvshow,2011,TV-PG,1 Season,"Join your DreamWorks friends for these four holiday specials, featuring Shrek and Donkey, Hiccup and Toothless, and the wacky animals from Madagascar.","Kids' TV,TV Comedies","Ben Stiller,David Schwimmer,Chris Rock,Jada Pinkett Smith,Jay Baruchel,Gerard Butler,Craig Ferguson,America Ferrera,Eddie Murphy,Mike Myers,Antonio Banderas,Cameron Diaz",,United States,https://www.imdb.com/title/tt6979738/?ref_=plg_rt_1,"Added to Netflix:December 16, 2018"
405,DreamWorks How to Train Your Dragon Legends,tvshow,2011,TV-PG,1 Season,"In this set of shorts, Hiccup and the gang learn about different species of dragons. Then, Gobber goes in search of the Boneknapper Dragon.","Kids' TV,TV Action & Adventure,TV Sci-Fi & Fantasy","Jay Baruchel,Craig Ferguson,America Ferrera,Gerard Butler",,United States,https://www.imdb.com/title/tt2542490/?ref_=plg_rt_1,"Added to Netflix:January 20, 2020"
406,DreamWorks Kung Fu Panda Awesome Secrets,tvshow,2008,TV-PG,1 Season,"In this pair of adventures, Po tells the story of how masters Thundering Rhino, Storming Ox and Croc met and takes on Shifu's biggest challenge yet.","Kids' TV,TV Action & Adventure,TV Comedies","Jack Black,Dustin Hoffman,Dennis Haysbert,Paul Scheer,Randall Duk Kim,David Cross,Jessica DiCicco,Jaycee Chan,Angelina Jolie,Seth Rogen,Tony Leondis",,United States,https://www.imdb.com/title/tt1980162/?ref_=plg_rt_1,"Added to Netflix:July 1, 2019"
407,DreamWorks Shrek's Swamp Stories,tvshow,2008,TV-PG,1 Season,"Shrek celebrates Halloween, Puss in Boots is captured by soldiers, and the gang participates in a kingdom-wide singing competition.","Kids' TV,TV Action & Adventure,TV Comedies","Mike Myers,Eddie Murphy,Cameron Diaz,Antonio Banderas,Kristen Schaal,Simon Cowell,Gilles Marini,Charlotte Newhouse,Dean Edwards,Cody Cameron,Christopher Knights,Conrad Vernon",,United States,https://www.imdb.com/title/tt1725156/?ref_=plg_rt_1,"Added to Netflix:February 17, 2020"
408,DreamWorks Spooky Stories,tvshow,2009,TV-PG,1 Season,"Shrek dares his friends to bring on the scary with ghost stories told in a haunted castle. Later, Ginormica and the Monsters face alien pumpkins.","Kids' TV,TV Comedies","Antonio Banderas,Hugh Laurie,Mike Myers,Reese Witherspoon,Seth Rogen,Kristen Schaal,Dean Edwards",,United States,https://www.imdb.com/title/tt3608838/?ref_=plg_rt_1,"Added to Netflix:October 25, 2018"
409,DreamWorks Spooky Stories: Volume 2,tvshow,2011,TV-PG,1 Season,"The Shrek characters parody the music video ""Thriller""; B.O.B. and pals battle zombie carrots; and Megamind faces the effects of the Button of Doom.","Kids' TV,TV Comedies","Seth Rogen,Will Arnett,Hugh Laurie,Will Ferrell,David Cross,Sean Bishop,Kiefer Sutherland,Cody Cameron,Aron Warner",,,,"Added to Netflix:April 24, 2020"
410,Droppin' Cash: Los Angeles,tvshow,2019,TV-MA,2 Seasons,This Complex series follows the paper trail of musicians and athletes in Los Angeles as they blow through stacks on the finer things in life.,Reality TV,,,United States,https://www.imdb.com/title/tt7983796/?ref_=plg_rt_1,"New Season Added:August 28, 2019"
411,Drug Lords,tvshow,2018,TV-MA,2 Seasons,"Witness the stories of history's most notorious kingpins, their terrifying enforcers, and the men and women who've sworn to bring them down.","Crime TV Shows,Docuseries",,,United States,https://www.imdb.com/title/tt7935522/?ref_=plg_rt_1,"New Season Added:July 10, 2018"
412,Drug Squad: Costa del Sol,tvshow,2019,TV-MA,1 Season,Four intrepid and impulsive police officers form a special narcotics unit to combat the birth of drug trafficking on Spain's Costa del Sol in the 1970s.,"Crime TV Shows,International TV Shows,Spanish-Language TV Shows","Hugo Silva,Álvaro Cervantes,Miki Esparbé,Jesús Castro,Sara Sálamo,Jorge Usón,Cayetana Cabezas,Pablo Béjar,Marco Cáceres,Olivia Delcán,Jorge Suquet,Daniel Holguín,Joaquín Galletero,Carolina Yuste,Ana Fernández",,Spain,https://www.imdb.com/title/tt8476166/?ref_=plg_rt_1,"Added to Netflix:October 25, 2019"
413,"Drugs, Inc.",tvshow,2015,TV-MA,1 Season,"This absorbing documentary series follows the entire supply chain of the illicit drug trade, tracing its production, export, sale and consumption.","Crime TV Shows,Docuseries",Mike Secher,,United States,https://www.imdb.com/title/tt1688779/?ref_=plg_rt_1,"Added to Netflix:April 1, 2020"
414,Durarara!!,tvshow,2016,TV-MA,1 Season,"A young man looking for excitement moves to Ikebukuro, a district in Tokyo, where he finds a world of mystery in which the past and present mesh.","Anime Series,Crime TV Shows,International TV Shows","Toshiyuki Toyonaga,Miyuki Sawashiro,Mamoru Miyano,Kana Hanazawa,Hiroshi Kamiya,Daisuke Ono,Jun Fukuyama,Yuichi Nakamura,Yuki Kaji,Ayahi Takagaki,Kazuma Horie,Sanae Kobayashi,Takaya Kuroda,Kari Wahlgren,Darrel Guilbeau,Bryce Papenbrook,Michelle Ruff,Johnny Yong Bosch,Crispin Freeman,Yuri Lowenthal,Steve Blum",,Japan,https://www.imdb.com/title/tt1584000/?ref_=plg_rt_1,"Added to Netflix:December 20, 2018"
415,Dynasty,tvshow,2019,TV-MA,3 Seasons,The Carringtons and the Colbys feud for control over their fortune – and their children – in this updated reboot of the classic prime-time soap.,TV Dramas,"Elizabeth Gillies,Nathalie Kelley,Grant Show,James Mackay,Rafael De La Fuente,Alan Dale,Sam Adegoke,Robert Christopher Riley",,United States,https://www.imdb.com/title/tt6128300/?ref_=plg_rt_1,"New Season Added:May 23, 2020"
416,Earth to Luna!,tvshow,2014,TV-Y,1 Season,"Curious about everything and excited about science, 6-year-old Luna, her brother Jupiter and pet Clyde explore nature to learn about the world.",Kids' TV,"Angelina Carballo,Raul-Gomez Pina,Eric Anderson",,Brazil,https://www.imdb.com/title/tt6428704/?ref_=plg_rt_1,"Added to Netflix:April 10, 2020"
417,Eastsiders,tvshow,2018,TV-MA,4 Seasons,Cal turns to his friends for help through a hilariously dark time when he discovers that his partner Thom's been cheating on him.,"TV Comedies,TV Dramas","Kit Williamson,Van Hansis,Constance Wu,Matthew McKelligon,John Halbach,Stephen Guarino",,United States,https://www.imdb.com/title/tt2558816/?ref_=plg_rt_1,"New Season Added:December 1, 2019"
418,Easy,tvshow,2019,TV-MA,3 Seasons,"This eclectic, star-studded anthology follows diverse Chicagoans fumbling through the modern maze of love, sex, technology and culture.","TV Comedies,TV Dramas","Aubrey Plaza,Judy Greer,Jane Adams,Zazie Beetz,Kate Berlant,Aya Cash,Michael Chernus,Kiersey Clemons,Orlando Bloom,Malin Akerman,Marc Maron,Dave Franco,Hannibal Buress,Jake Johnson,Emily Ratajkowski,Andrew Bachelor",,United States,https://www.imdb.com/title/tt5562056/?ref_=plg_rt_1,"New Season Added:May 10, 2019"
419,Easy Fortune Happy Life,tvshow,2009,TV-MA,1 Season,"Years after a wealthy man is healed by a rural herbalist, fate lands him in the same hospital where the woman's granddaughter is treating patients.","International TV Shows,Romantic TV Shows,TV Comedies","Lan Cheng-lung,Joe Chen,Roy Chiu,Jocelyn Wang,Chieh-kai Shiou,Ting Chiang,Wang Chuan",,Taiwan,https://www.imdb.com/title/tt3756460/?ref_=plg_rt_1,"Added to Netflix:September 1, 2016"
420,Edgar Rice Burroughs' Tarzan and Jane,tvshow,2018,TV-G,2 Seasons,"Saved from a plane crash and given supernatural powers, teen Tarzan joins forces with brave city girl Jane to protect his jungle home from threats.","Crime TV Shows,Kids' TV","Marci T. House,Michael Dobson,Omari Newton,Paul Dobson,Rebecca Shoichet,Giles Panton,Kathleen Barr,Doron Bell",,,https://www.imdb.com/title/tt6216718/?ref_=plg_rt_1,"New Season Added:October 12, 2018"
421,Edge of the Universe,tvshow,2008,TV-G,1 Season,"Leading astronomers reveal the latest discoveries about death-trap planets, asteroids, comets and other wonders of the cosmos.","British TV Shows,Docuseries,Science & Nature TV",,,United Kingdom,https://www.imdb.com/title/tt6951568/?ref_=plg_rt_1,"Added to Netflix:August 1, 2016"
422,Edha,tvshow,2018,TV-MA,1 Season,"Revenge, passion and dark secrets push a successful fashion designer and single mother to her limits when she meets a handsome and mysterious man.","International TV Shows,Spanish-Language TV Shows,TV Dramas","Juana Viale,Andrés Velencoso,Delfina Chaves,Osmar Nuñez,Germán Palacios,Juan Pablo Geretto,Sofía Gala,Daniel Pacheco,Daniel Hendler,Flavio Mendoza",,Argentina,https://www.imdb.com/title/tt7956274/?ref_=plg_rt_1,"Added to Netflix:March 16, 2018"
423,Einsatzgruppen: The Nazi Death Squads,tvshow,2009,TV-MA,1 Season,"This documentary series examines the Einsatzgruppen, Nazis responsible for the mass murder of Jews, Romani and Soviet prisoners in Eastern Europe.","Docuseries,International TV Shows",Paul Bandey,,France,https://www.imdb.com/title/tt6953928/?ref_=plg_rt_1,"Added to Netflix:November 10, 2016"
424,El Barco,tvshow,2013,TV-MA,3 Seasons,Forty young crew members traveling aboard a training vessel are in for the adventure of a lifetime – especially when a storm leaves them lost at sea.,"International TV Shows,Romantic TV Shows,Spanish-Language TV Shows","Juanjo Artero,Mario Casas,Blanca Suárez,Irene Montalà,Luis Callejo,Neus Sanz,Juan Pablo Shuk,Ivan Massagué,Marina Salas,Bernabé Fernández,Javier Hernández,Patricia Arbúes,David Seijo,Giselle Calderón",,Spain,https://www.imdb.com/title/tt1788634/?ref_=plg_rt_1,"New Season Added:July 1, 2017"
425,El Cartel,tvshow,2008,TV-MA,1 Season,One man makes a fateful decision to get involved with a Colombian drug cartel in this series based on a novel by Andrés López López.,"Crime TV Shows,International TV Shows,Spanish-Language TV Shows","Manolo Cardona,Karen Martínez,Robinson Díaz,Diego Cadavid,Fernando Solórzano,Julian Arango,Sandra Reyes,Juan Pablo Raba,Fernando Arévalo",,Colombia,https://www.imdb.com/title/tt1260520/?ref_=plg_rt_1,"Added to Netflix:August 24, 2018"
426,El Cartel 2,tvshow,2010,TV-MA,1 Season,Drug trafficker Pepe Cadena navigates the treacherous waters of warring cartels in Mexico and Colombia while avoiding capture by the DEA and police.,"Crime TV Shows,International TV Shows,Spanish-Language TV Shows","Diego Cadavid,Robinson Díaz,Patricia Manterola,Carolina Guerra,John Álex Toro,Luis Eduardo Arango,Alejandro Martínez,Juan Sebastián Aragón,Víctor Mallarino,Santiago Moure,Carlos Echavarría,John Gertz",,Colombia,https://www.imdb.com/title/tt1667724/?ref_=plg_rt_1,"Added to Netflix:August 24, 2018"
427,El Chapo,tvshow,2018,TV-MA,3 Seasons,"This drama series chronicles the true story of the rise, capture and escape of notorious Mexican drug lord Joaquín ""El Chapo"" Guzmán.","Crime TV Shows,Spanish-Language TV Shows,TV Action & Adventure","Marco de la O,Humberto Busto,Alejandro Aguilar,Rodrigo Abed,Luis Fernando Peña,Juan Carlos Olivas,Rolf Petersen,Carlos Hernan Romo,Héctor Holten,Diego Vásquez,Teté Espinoza,Luis Rábago,Dolores Heredia,Cristina Michaus,Valentina Acosta,Juliette Pardau,Abril Schreiber",,"Mexico,United States",https://www.imdb.com/title/tt6692188/?ref_=plg_rt_1,"New Season Added:July 27, 2018"
428,El desconocido,tvshow,2019,TV-MA,2 Seasons,"Based on real events, the fictional story of Mexican drug lord El Chato's number one hitman, El Cholo.","Crime TV Shows,International TV Shows,Spanish-Language TV Shows","Guillermo Iván,César Manjarrez,Estrella Solís,Liliana Moreno,Marco Uriel,Mario Zaragoza,Fernando Sarfatti,José Ángel Bichir,Paty Blanco,Pía Sanz,Scarlet Gruber,Pakey Vázquez,Ivonne Montero",,Spain,https://www.imdb.com/title/tt3169770/?ref_=plg_rt_1,"New Season Added:June 14, 2019"
429,El Marginal,tvshow,2019,TV-MA,3 Seasons,"While investigating a kidnapping, an ex-cop sent to infiltrate a prison finds himself surrounded by dangerous felons who can't know his real identity.","Crime TV Shows,International TV Shows,Spanish-Language TV Shows","Juan Minujín,Martina Gusman,Gerardo Romano,Claudio Rissi,Carlos Portaluppi,Nicolás Furtado,Cristina Banegas,Abel Ayala",,Argentina,https://www.imdb.com/title/tt5820976/?ref_=plg_rt_1,"New Season Added:September 27, 2019"
430,El Reemplazante,tvshow,2013,TV-MA,2 Seasons,A former high-ranking financial executive finds redemption and romance when he's paroled after a prison sentence and becomes a math teacher.,"International TV Shows,Spanish-Language TV Shows,TV Dramas","Iván Álvarez de Araya,Blanca Lewin,Karla Melo,Sebastián Ayala,Roberto Farías,Sergio Hernández",,Chile,https://www.imdb.com/title/tt2488050/?ref_=plg_rt_1,"New Season Added:April 4, 2020"
431,El señor de los Cielos,tvshow,2019,TV-MA,7 Seasons,Only Aurelio Casillas can fill Pablo Escobar's shoes and become Mexico's biggest drug trafficker of the '90s.,"Crime TV Shows,International TV Shows,Spanish-Language TV Shows","Rafael Amaya,Ximena Herrera,Robinson Díaz,Raúl Méndez,Gabriel Porras,Carmen Villalobos,Mauricio Ochmann,Fernanda Castillo,Marlene Favela,Carmen Aub,Maritza Rodríguez",,"United States,Mexico,Colombia",https://www.imdb.com/title/tt2777882/?ref_=plg_rt_1,"New Season Added:April 30, 2020"
432,Ellen DeGeneres: Relatable,tvshow,2018,TV-MA,1 Season,"In her first special since 2003, Ellen revisits her road to stardom and details the heartfelt – and hilarious – lessons she's learned along the way.","Stand-Up Comedy & Talk Shows,TV Comedies",Ellen DeGeneres,"Joel Gallen,Tig Notaro",United States,https://www.imdb.com/title/tt7157574/?ref_=plg_rt_1,"Added to Netflix:December 18, 2018"
433,Emogenius,tvshow,2017,TV-14,1 Season,"Two pairs of contestants go head-to-head for several rounds, deciphering puzzles and messages comprised of emojis for a chance at a $10,000 prize.",Reality TV,Hunter March,,United States,https://www.imdb.com/title/tt7062438/?ref_=plg_rt_1,"Added to Netflix:December 15, 2018"
434,Empire Games,tvshow,2018,TV-14,1 Season,Interviews with scholars and dramatic reenactments bring to life the origins and history-making achievements of the world's greatest ancient empires.,Docuseries,Jim O'Brien,,"Czech Republic,United States",https://www.imdb.com/title/tt8171234/?ref_=plg_rt_1,"Added to Netflix:October 5, 2018"
435,Enemigo íntimo,tvshow,2018,TV-MA,1 Season,"Siblings separated as children who no longer recognize each other are pitted against each other in a war involving drugs, crime and betrayal.","Crime TV Shows,Spanish-Language TV Shows,TV Dramas","Raúl Méndez,Fernanda Castillo,Matias Novoa,Guillermo Quintanilla,Leonardo Daniel,Otto Sirgo,Alejandro Speitzer,Armando Hernández,Valentina Acosta,Elvira Monsell",,,,"Added to Netflix:August 8, 2018"
436,Engineering Girls,tvshow,2018,TV-MA,1 Season,"Three engineering students deal with dorm drama, date around, and do whatever it takes to make their dreams come true.","International TV Shows,TV Comedies","Barkha Singh,Kritika Avasthi,Sejal Kumar",,India,https://www.imdb.com/title/tt8502324/?ref_=plg_rt_1,"Added to Netflix:October 1, 2019"
437,Entangled,tvshow,2014,TV-14,1 Season,"When the children of two families become friends, they begin to unravel a horrific crime in the past that already linked their fathers to each other.","International TV Shows,TV Dramas","Thomas Ong,Jack Tan,Margaret Wang,Kate Pang,Huang Qi Ming,Aileen Tan,Rayson Tan,Zhang Shui Fa",,South Korea,https://www.imdb.com/title/tt4023856/?ref_=plg_rt_1,"Added to Netflix:August 1, 2017"
438,Episodes,tvshow,2017,TV-MA,5 Seasons,"Hoping to create an American version of their hit British sitcom, two screenwriters run into cultural obstacles, starting with the lead character.","Classic & Cult TV,TV Comedies","Matt LeBlanc,Tamsin Greig,Stephen Mangan,Kathleen Rose Perkins,John Pankow,Mircea Monroe",,"United States,United Kingdom",https://www.imdb.com/title/tt1582350/?ref_=plg_rt_1,"New Season Added:January 6, 2018"
439,Equestria Girls: Tales of Canterlot High,tvshow,2017,TV-Y7,1 Season,"In an alternate universe Equestria, the ponies have become teenage girls who must learn what it means to be human while attending Canterlot High.","Kids' TV,TV Comedies","Tara Strong,Ashleigh Ball,Andrea Libman,Tabitha St. Germain,Cathy Weseluck,Rebecca Shoichet,Andrew Toth,Ali Liebert",,"United States,Canada",https://www.imdb.com/title/tt6800902/?ref_=plg_rt_1,"Added to Netflix:October 1, 2017"
440,Erased,tvshow,2017,TV-14,1 Season,"After finding his mom killed, Satoru's time-traveling ability takes him back 18 years for a chance to prevent her death and those of three classmates.","International TV Shows,TV Dramas,TV Mysteries","Yuki Furukawa,Mio Yuki,Jin Shirasu,Reo Uchikawa,Rinka Kakihara,Masato Yano,Noriko Eguchi,Hidekazu Mashima,Shigeyuki Totsugi,Tomoka Kurotani",,Japan,https://www.imdb.com/title/tt7573686/?ref_=plg_rt_1,"Added to Netflix:December 15, 2017"
441,Eternal Love,tvshow,2017,TV-14,1 Season,"After the deities Bai Qian and Ye Hua meet and fall in love, their romance stands the test of three lifetimes — each an epic in its own right.","International TV Shows,Romantic TV Shows,TV Dramas","Yang Mi,Mark Chao,Dilraba Dilmurat,Ken Chang,Vengo Gao,Huang Mengying",,China,https://www.imdb.com/title/tt7514476/?ref_=plg_rt_1,"Added to Netflix:November 17, 2018"
442,Eugenie Nights,tvshow,2018,TV-14,1 Season,"In 1940s Port Said, Kariman finds comfort and solace in the arms of an unhappily married man, who also happens to be her abusive husband's brother.","International TV Shows,Romantic TV Shows,TV Dramas","Ameena Khalil,Zafer Abdeen,Injy El Mokkaddem,Khaled Kamal,Cherif Hafez,Carmen Bsaibes,Mourad Makram,Leila Ezz Al Arab,Asmaa Abou El Yazeed,Nadine Nassib Njeim",,Egypt,https://www.imdb.com/title/tt8409796/?ref_=plg_rt_1,"Added to Netflix:March 11, 2019"
443,Ever After High,tvshow,2016,TV-Y7,5 Seasons,The kids of fairy-tale characters attend a school with two cliques: those who accept their fairy-tale destinies and those who want to write their own.,Kids' TV,"Jonquil Goode,Karen Strassman,Audu Paden,Julie Maddalena,Marieve Herington,Rena Strober,Evan Smith,Wendee Lee,Haviland Stillwell,Valerie Arem,Cam Clarke,Colleen Foy,Cindy Robinson,Joe Sanfelippo,Jamieson Price,Debi Derryberry,Lindsey Ames,Rajo Zakic,Erin Fitzgerald,Malcolm Danare",,Canada,https://www.imdb.com/title/tt3312378/?ref_=plg_rt_1,"New Season Added:August 5, 2016"
444,Everyday Miracles,tvshow,2014,TV-PG,1 Season,Materials scientist Mark Miodownik takes us into the world of everyday objects that make our lives more comfortable than those of our ancestors.,"British TV Shows,Docuseries,International TV Shows",Mark Miodownik,,United Kingdom,https://www.imdb.com/title/tt4073812/?ref_=plg_rt_1,"Added to Netflix:August 1, 2017"
445,Everything Sucks!,tvshow,2018,TV-14,1 Season,"It's 1996 in a town called Boring, where high school misfits in the AV and drama clubs brave the ups and downs of teenage life in the VHS era.","TV Comedies,TV Dramas,Teen TV Shows","Jahi Di'Allo Winston,Peyton Kennedy,Patch Darragh,Claudine Mboligikpelani Nako,Rio Mangini,Quinn Liebling,Sydney Sweeney,Elijah Stevenson,Zachary Ray Sherman,Abi Brittle",,United States,https://www.imdb.com/title/tt7078710/?ref_=plg_rt_1,"Added to Netflix:February 16, 2018"
446,Evil Genius,tvshow,2018,TV-MA,1 Season,This baffling true crime story starts with the grisly death of a pizza man who robs a bank with a bomb around his neck – and gets weirder from there.,"Crime TV Shows,Docuseries,TV Mysteries",,"Trey Borzillieri,Barbara Schroeder",United States,https://www.imdb.com/title/tt8342862/?ref_=plg_rt_1,"Added to Netflix:May 11, 2018"
447,Ex-Boyfriend,tvshow,2011,TV-14,1 Season,"Still haunted by the traumatic event that ended her high school romance, a young professional gets a new subordinate: her former sweetheart.","International TV Shows,Romantic TV Shows,TV Comedies","Tony Yang,Nana Lee,Jerry Huang,Liao Yi Chiao",,China,https://www.imdb.com/title/tt6286350/?ref_=plg_rt_1,"Added to Netflix:January 1, 2017"
448,Examination of Conscience,tvshow,2019,TV-MA,1 Season,"Allegations of child sexual abuse in Spain's Catholic institutions are examined in interviews with survivors, clergy, journalists and other experts.","Crime TV Shows,Docuseries,International TV Shows",,,Spain,https://www.imdb.com/title/tt9584024/?ref_=plg_rt_1,"Added to Netflix:January 25, 2019"
449,Exclusive Edition,tvshow,2008,TV-14,1 Season,"Young journalists working for a magazine juggle careers, romance and other challenges while reporting on social issues and news stories in Malaysia.","International TV Shows,TV Dramas","Berg Lee,Yise Loo,Alvin Wong,Hady,Monday Kang,Ruobing,Wymen Yang,May June,Aenie Wong,Ernest Chong",James Lee,,,"Added to Netflix:August 14, 2017"
450,Exhibit A,tvshow,2019,TV-MA,1 Season,This true crime series shows how innocent people have been convicted with dubious forensic techniques and tools such as touch DNA and cadaver dogs.,"Crime TV Shows,Docuseries,Science & Nature TV",,,United States,https://www.imdb.com/title/tt10376904/?ref_=plg_rt_1,"Added to Netflix:June 28, 2019"
451,Explained,tvshow,2019,TV-MA,2 Seasons,"This enlightening series from Vox digs into a wide range of topics such as the rise of cryptocurrency, why diets fail, and the wild world of K-pop.","Docuseries,Science & Nature TV",,,United States,https://www.imdb.com/title/tt8005374/?ref_=plg_rt_1,"New Season Added:September 26, 2019"
452,Extras,tvshow,2006,TV-MA,2 Seasons,"Grasping hungrily for stardom, bit actor Andy Millman and his pal Maggie spend their days chasing after work as film and TV extras.","British TV Shows,TV Comedies","Ricky Gervais,Stephen Merchant,Ashley Jensen,Shaun Williamson,Shaun Pye",,"United Kingdom,United States",https://www.imdb.com/title/tt0445114/?ref_=plg_rt_1,"New Season Added:March 31, 2017"
453,Extreme Engagement,tvshow,2019,TV-MA,1 Season,An engaged couple travels the world for a year to explore marriage customs in diverse cultures. Will the journey bring them closer or tear them apart?,"International TV Shows,Reality TV","Tim Noonan,PJ Madam",,,https://www.imdb.com/title/tt10521644/?ref_=plg_rt_1,"Added to Netflix:July 12, 2019"
454,Fairy Tail,tvshow,2009,TV-MA,1 Season,"When four young wizards team up to take jobs across the kingdom, they forge a bond more powerful than any magic and grow stronger with every mission.","Anime Series,International TV Shows","Tetsuya Kakihara,Aya Hirano,Rie Kugimiya,Yuichi Nakamura,Sayaka Ohara,Satomi Sato,Yui Horie,Hiroki Yasumoto,Ryoko Ono,Hiroki Touchi,Shinpachi Tsuji,Wataru Hatano,Mai Nakahara,Katsuyuki Konishi,Eri Kitamura,Todd Haberkorn,Cherami Leigh,Tia Lynn Ballard,Newton Pittman,Colleen Clinkenbeard,Brittney Karbowski,Jad Saxton,Christopher R. Sabat,Monica Rial,Rick Keeling,R. Bruce Elliott,David Wald,Brina Palencia,Patrick Seitz,Jamie Marchi",,Japan,https://www.imdb.com/title/tt1528406/?ref_=plg_rt_1,"Added to Netflix:April 1, 2017"
455,Fall in Love with Me,tvshow,2014,TV-14,1 Season,The head of a struggling ad agency finds herself torn between a hotshot executive and a kind stranger – not realizing they're the same person.,"International TV Shows,Romantic TV Shows,TV Comedies","Aaron Yan,Tia Lee,Jack Lee,Katherine Wang,Beatrice Fang,Vince Kao,Chen Bor Jeng",,Taiwan,https://www.imdb.com/title/tt6139710/?ref_=plg_rt_1,"Added to Netflix:October 1, 2016"
456,Fallet,tvshow,2017,TV-MA,1 Season,A Swedish detective and her timid British colleague's attempt to solve a gruesome murder case nets mixed results and miscommunication.,"Crime TV Shows,International TV Shows,TV Comedies","Lisa Henni,Adam Godley,Tomas von Brömssen,Lia Boysen,Christoffer Nordenrot,Stina Rautelin,Erik Madsen,Magnus Krepper,Meliz Karlge,Linda Nilarve,Björn Granath,Richenda Carey,Dag Malmberg",,Sweden,https://www.imdb.com/title/tt6433844/?ref_=plg_rt_1,"Added to Netflix:April 1, 2018"
457,Falsa identidad,tvshow,2018,TV-MA,1 Season,Strangers Diego and Isabel flee their home in Mexico and pretend to be a married couple to escape his drug-dealing enemies and her abusive husband.,"Crime TV Shows,Spanish-Language TV Shows,TV Dramas","Luis Ernesto Franco,Camila Sodi,Sergio Goyri,Samadhi Zendejas,Eduardo Yáñez,Sonya Smith,Alejandro Camacho,Azela Robinson,Uriel del Toro,Géraldine Bazán,Gabriela Roel,Marcus Ornellas",,"Mexico,United States",https://www.imdb.com/title/tt8598690/?ref_=plg_rt_1,"Added to Netflix:June 1, 2019"
458,Family Business,tvshow,2019,TV-MA,1 Season,"After learning France is about to legalize pot, a down-on-his-luck entrepreneur and his family race to turn their butcher shop into a marijuana café.","International TV Shows,TV Comedies,TV Dramas","Jonathan Cohen,Gérard Darmon,Julia Piaton,Liliane Rovère,Olivier Rosemberg,Ali Marhyar,Lina El Arabi,Louise Coldefy,Enrico Macias,Valérie Damidot",,France,https://www.imdb.com/title/tt10423460/?ref_=plg_rt_1,"Added to Netflix:June 28, 2019"
459,Fangbone,tvshow,2016,TV-Y7,1 Season,"Magically transported from far-off Skullbania, a young barbarian teams up with an odd third-grader to protect his homeland from an evil sorcerer.","Kids' TV,TV Comedies","Taylor Abrahamse,Colin Doyle,Juan Chioran,Kathleen Laskey,Stacey DePass,Mike Kiss",,Canada,https://www.imdb.com/title/tt4358188/?ref_=plg_rt_1,"Added to Netflix:April 22, 2017"
460,Fartsa,tvshow,2015,TV-14,1 Season,"As four Russian friends grow up in the early '60s, life, love and the curse of success threaten to derail their dreams.","Crime TV Shows,International TV Shows,TV Dramas","Alexander Petrov,Fillip Gorenshtein,Maksim Emelyanov,Aleksey Vesyolkin,Zoya Berber,Ieva Andrejevaite",,Russia,https://www.imdb.com/title/tt4567218/?ref_=plg_rt_1,"Added to Netflix:August 1, 2017"
461,Fast & Furious Spy Racers,tvshow,2019,TV-Y7,1 Season,A government agency recruits teen driver Tony Toretto and his thrill-seeking friends to infiltrate a criminal street racing circuit as undercover spies.,Kids' TV,"Tyler Posey,Charlet Chung,Jorge Diaz,Camille Ramsey,Luke Youngblood,Renée Elise Goldsberry",,United States,https://www.imdb.com/title/tt8322592/?ref_=plg_rt_1,"Added to Netflix:December 26, 2019"
