,title,type,release_year,rating,runtime,description,genres,cast,director,country,imdb_link,date_added
819,Lucky Days,tvshow,2010,TV-PG,1 Season,"When laidback Ren, who is about to divorce his money-crazy wife, finds a time-traveling computer, he decides to use it to reboot his marriage.","International TV Shows,Romantic TV Shows,TV Comedies","Chris Wang,Tammy Chen,Fan Kuang-yao,Chen Bor Jeng,Lin Mei-hsiu,Ma Nien-hsien",,China,https://www.imdb.com/title/tt6954548/?ref_=plg_rt_1,"Added to Netflix:September 1, 2016"
820,Lugar de Mulher,tvshow,2019,TV-MA,1 Season,"Four comedians from Brazil riff on sexuality, politics, religion and motherhood – and set out to prove a woman's place is anywhere she wants it to be.","International TV Shows,Stand-Up Comedy & Talk Shows,TV Comedies",,,Brazil,https://www.imdb.com/title/tt11215186/?ref_=plg_rt_1,"Added to Netflix:November 28, 2019"
821,Luis Miguel - The Series,tvshow,2018,TV-MA,1 Season,"This series dramatizes the life story of Mexican superstar singer Luis Miguel, who has captivated audiences in Latin America and beyond for decades.","International TV Shows,Spanish-Language TV Shows,TV Dramas","Diego Boneta,Juan Pablo Zurita,Camila Sodi,Óscar Jaenada,Izan Llunas,Paulina Dávila,Martín Bello,Anna Favella,César Bordón,Vanessa Bauche",,Mexico,https://www.imdb.com/title/tt8045690/?ref_=plg_rt_1,"Added to Netflix:July 12, 2019"
822,Luna Petunia,tvshow,2017,TV-Y,3 Seasons,"With help from her magic toy chest, fun-loving Luna Petunia enters the fantastic land of Amazia, where adventures, friendship and learning await.",Kids' TV,"Ciara Alexys,Katie Griffin,Cory Doran,Jonah Wineberg",,United States,https://www.imdb.com/title/tt4588068/?ref_=plg_rt_1,"New Season Added:November 17, 2017"
823,Luna Petunia: Return to Amazia,tvshow,2018,TV-Y,2 Seasons,"Luna Petunia returns to magical Amazia, adding memories to her scrapbook with old friends – and a new pal from the Animal Empire.",Kids' TV,"Ciara Alexys,Katie Griffin,Cory Doran,Jonah Weinberg,Stephanie Lynn Robinson,Stephanie Anne Mills,Robert Tinkler",,"Canada,United States",https://www.imdb.com/title/tt7924854/?ref_=plg_rt_1,"New Season Added:July 20, 2018"
824,Lunatics,tvshow,2019,TV-MA,1 Season,This mockumentary series follows the peculiar lives of six eccentric – and sometimes obscene – misfits who march to their own beat.,"International TV Shows,TV Comedies",Chris Lilley,,Australia,https://www.imdb.com/title/tt8164794/?ref_=plg_rt_1,"Added to Netflix:April 19, 2019"
825,Luo Bao Bei,tvshow,2018,TV-Y,1 Season,"A bright and spirited seven-year-old girl uses her vivid, dreamlike imagination to navigate everyday adventures alongside her real and imaginary BFFs.","British TV Shows,Kids' TV","Hana Burnett,Natalia-Jade Jonathan,Leo Tang,Gok Wan,Ching-He Huang,Pik Sen Lim,David Yip",,"China,United Kingdom",https://www.imdb.com/title/tt7192414/?ref_=plg_rt_1,"Added to Netflix:August 31, 2019"
826,Madam Secretary,tvshow,2019,TV-PG,6 Seasons,"When a highly capable woman becomes secretary of state, she struggles to find balance between the demands of world politics and those of her family.",TV Dramas,"Téa Leoni,Tim Daly,Bebe Neuwirth,Zeljko Ivanek,Erich Bergen,Patina Miller,Geoffrey Arend,Kathrine Herzer,Evan Roe,Wallis Currie-Wood",,United States,https://www.imdb.com/title/tt3501074/?ref_=plg_rt_1,"New Season Added:May 15, 2020"
827,Made in Mexico,tvshow,2018,TV-MA,1 Season,"These Mexico City socialites may lead opulent lives, but a peek behind the curtain reveals a tangled web of intrigue, envy and personal struggles.","International TV Shows,Reality TV,Spanish-Language TV Shows",,,United States,https://www.imdb.com/title/tt8871764/?ref_=plg_rt_1,"Added to Netflix:September 28, 2018"
828,Magi: Adventure of Sinbad,tvshow,2016,TV-14,1 Season,The Magi who became High King of the Seven Seas started as a boy determined to make the world a better place. He begins with a dangerous dungeon.,"Anime Series,International TV Shows","Daisuke Ono,Tomokazu Sugita,Takahiro Sakurai,Keiji Fujiwara,Akira Ishida,Katsuyuki Konishi,Yoko Hikasa,Ai Kayano,Takehito Koyasu,Hiroki Touchi",,Japan,https://www.imdb.com/title/tt4431276/?ref_=plg_rt_1,"Added to Netflix:July 14, 2016"
829,Magi: The Labyrinth of Magic,tvshow,2013,TV-14,2 Seasons,A land of mysterious ruins and a magical treasure hunt await young Aladdin and his courageous friend Alibaba for the adventure of their lives.,"Anime Series,International TV Shows","Kaori Ishihara,Yuki Kaji,Haruka Tomatsu,Daisuke Ono,Ryohei Kimura,Yoshimasa Hosoya,Takahiro Sakurai,Showtaro Morikubo,Yui Horie,Tomokazu Sugita",,Japan,https://www.imdb.com/title/tt2425098/?ref_=plg_rt_1,"New Season Added:June 21, 2019"
830,Magic Phone,tvshow,2016,TV-PG,1 Season,"When an ordinary guy crosses paths 15 years later with his childhood sweetheart, now an actress, a magic cellphone allows him to be her protector.","International TV Shows,Korean TV Shows,Romantic TV Shows","Jin-woo Kim,Min-ji Park,In-jun Gwak,Gi-du Kim",,South Korea,https://www.imdb.com/title/tt7162434/?ref_=plg_rt_1,"Added to Netflix:June 10, 2017"
831,Magical Andes,tvshow,2019,TV-G,1 Season,"From Argentina to Colombia, this stunning documentary follows five characters who share their deep connection to South America's majestic mountains.","Docuseries,International TV Shows,Science & Nature TV",,,,,"Added to Netflix:October 15, 2019"
832,Maharakshak Devi,tvshow,2015,TV-14,1 Season,"After years spent in isolation, a young girl with extraordinary powers returns to human society to battle dark, mythological beings.","International TV Shows,TV Action & Adventure,TV Sci-Fi & Fantasy","Umang Jain,Indraneil Sengupta,Rohit Bakshi,Karan Suchak,Shresth Kumar,Ankit Gera,Rushiraj Pawar,Nikita Sharma,Varun Kapoor,Kamalika Guha Thakurta,Sahil Uppal,Charu Asopa",,India,https://www.imdb.com/title/tt6921490/?ref_=plg_rt_1,"Added to Netflix:April 15, 2017"
833,Maharakshak: Aryan,tvshow,2014,TV-14,1 Season,"Shy nerd Aryan learns soon after his 18th birthday that he has inherited superpowers, which he must use to vanquish a variety of evil threats.","International TV Shows,TV Action & Adventure,TV Sci-Fi & Fantasy","Aakarshan Singh,Vikramjeet Virk,Reena Aggarwal,Khalid Siddiqui,Abigail Jain,Rishabh Jain",,India,https://www.imdb.com/title/tt6979286/?ref_=plg_rt_1,"Added to Netflix:April 1, 2017"
834,Maid-Sama!,tvshow,2010,TV-14,1 Season,"To keep the boys in line, student council president Misaki runs the school with an iron fist – while secretly working as a waitress at a maid café.","Anime Series,Romantic TV Shows","Ayumi Fujimura,Nobuhiko Okamoto,Kazuyoshi Shiibashi,Kana Hanazawa,Yu Kobayashi,Mitsuhiro Ichiki,Takuma Terashima,Yoshimasa Hosoya",,Japan,https://www.imdb.com/title/tt1634208/?ref_=plg_rt_1,"Added to Netflix:November 1, 2019"
835,Mak Cun,tvshow,2015,TV-PG,1 Season,A woman with an entrepreneurial spirit takes life into her own hands by starting a beauty cream business that inspires other women to take chances.,"International TV Shows,TV Comedies,TV Dramas","Erma Fatima,Rahim Razali,Umie Aida,Nora Danish",,,,"Added to Netflix:September 29, 2017"
836,Making a Murderer,tvshow,2018,TV-14,2 Seasons,"Filmed over 10 years, this real-life thriller follows a DNA exoneree who, while exposing police corruption, becomes a suspect in a grisly new crime.","Crime TV Shows,Docuseries",,,United States,https://www.imdb.com/title/tt5189670/?ref_=plg_rt_1,"New Season Added:October 19, 2018"
837,Mako Mermaids: An H2O Adventure,tvshow,2016,TV-G,4 Seasons,"This ""H2O"" sequel follows Zac, a boy who accidentally turns into a merman and threatens the existence of three young mermaids who guard Mako Island.","Kids' TV,TV Comedies","Lucy Fry,Ivy Latimer,Amy Ruffle,Chai Romruen,Isabel Durant,Allie Bertram,Linda Ngo,Gemma Forsyth,Dominic Deutscher,Kerith Atkinson,Rowan Hills,Brooke Nichole Lee",,Australia,https://www.imdb.com/title/tt2548214/?ref_=plg_rt_1,"New Season Added:May 28, 2020"
838,Malibu Rescue: The Series,tvshow,2019,TV-G,1 Season,"On the heels of Junior Rescue training, Team Flounder returns to brave the beach in a series of thrilling saves and lighthearted laughs.","Kids' TV,TV Action & Adventure,TV Comedies","Ricardo Hurtado,Breanna Yde,Jackie R. Jacobson,Abby Donnelly,Alkoya Brunson,Jeremy Howard,JT Neal,Bryana Salaz,Ian Ziering,Camaron Engels",,United States,https://www.imdb.com/title/tt9098432/?ref_=plg_rt_1,"Added to Netflix:June 3, 2019"
839,Man Down,tvshow,2017,TV-MA,4 Seasons,"A childish idiot trapped in an adult's body, schoolteacher Dan hates his job, hates his girlfriend-less life and has good reason to fear his dad.","British TV Shows,TV Comedies","Greg Davies,Roisin Conaty,Jeany Spark,Gwyneth Powell,Isy Suttie,Michael Wozniak,Elliot Levey,Ruth Bratt,Deirdre Mullins,Steven Berkoff,Stella Gonet,Rik Mayall,Ashley McGuire,Stephanie Cole",,United Kingdom,https://www.imdb.com/title/tt3063454/?ref_=plg_rt_1,"New Season Added:November 30, 2017"
840,Man to Man,tvshow,2017,TV-14,1 Season,"Disguised as a bodyguard, a special agent must complete his national secret tasks while pandering to the whims of his ill-tempered world star.","Crime TV Shows,International TV Shows,Korean TV Shows","Hae-Jin Park,Sung-woong Park,Min-jung Kim,Jung-an Chae,Jung-hoon Yeon,Hyun-sung Jang,Man-sik Jung,Shin-il Kang,Ho-jin Chun,In-ho Tae",Chang-Min Lee,South Korea,https://www.imdb.com/title/tt6032762/?ref_=plg_rt_1,"Added to Netflix:June 10, 2017"
841,Man vs Wild with Sunny Leone,tvshow,2018,TV-14,1 Season,The adventures of Bear Grylls get a unique spin as Bollywood star Sunny Leone hosts the show famous for revealing Bear's wilderness survival skills.,"International TV Shows,Reality TV,TV Action & Adventure","Bear Grylls,Sunny Leone",,,https://www.imdb.com/title/tt9316056/?ref_=plg_rt_1,"Added to Netflix:December 1, 2018"
842,Manhunt,tvshow,2017,TV-14,1 Season,"Faced with few clues and an increasingly panicked public, the FBI calls on a new kind of profiler to help track down the infamous Unabomber.","Crime TV Shows,TV Dramas,TV Mysteries","Sam Worthington,Paul Bettany,Chris Noth,Jeremy Bobb,Ben Weber,Lynn Collins,Brían F. O'Byrne,Keisha Castle-Hughes,Mark Duplass,Elizabeth Reaser,Diesel Madkins",,United States,https://www.imdb.com/title/tt5618256/?ref_=plg_rt_1,"Added to Netflix:September 19, 2017"
843,Maniac,tvshow,2015,TV-MA,1 Season,"A nondescript man in a mental hospital has an exciting life of adventure and romance – in his head. He may be insane, or maybe he's just having fun.","International TV Shows,TV Comedies,TV Dramas","Espen Petrus Andersen Lervaag,Håkon Bast Mossige,Arif Salum,Ingeborg Raustøl,Marte Germaine Christensen,Mats Mogeland",,Norway,https://www.imdb.com/title/tt3714902/?ref_=plg_rt_1,"Added to Netflix:September 1, 2017"
844,Maniac,tvshow,2018,TV-MA,1 Season,Two struggling strangers connect during a mind-bending pharmaceutical trial involving a doctor with mother issues and an emotionally complex computer.,"TV Comedies,TV Dramas,TV Mysteries","Emma Stone,Jonah Hill,Justin Theroux,Sally Field,Gabriel Byrne,Sonoya Mizuno,Julia Garner,Billy Magnussen,Jemima Kirke",,United States,https://www.imdb.com/title/tt5580146/?ref_=plg_rt_1,"Added to Netflix:September 21, 2018"
845,Mar de Plástico,tvshow,2017,TV-MA,2 Seasons,"In a town in southern Spain where racial tensions run high among the workers in its many greenhouses, a cop investigates the murder of a young woman.","Crime TV Shows,International TV Shows,Spanish-Language TV Shows","Rodolfo Sancho,Belén López,Pedro Casablanc,Luis Fernández,Patrick Criado,Nya de la Rubia,Jesús Castro,Fernando Cayo",,Spain,https://www.imdb.com/title/tt4719586/?ref_=plg_rt_1,"New Season Added:April 27, 2017"
846,Marcella,tvshow,2019,TV-MA,3 Seasons,"Her marriage just ended and she's returning to work as a London detective after 12 years away. Is the serial killer she once investigated back, too?","British TV Shows,Crime TV Shows,International TV Shows","Anna Friel,Nicholas Pinnock,Sinéad Cusack,Nina Sosanya,Harry Lloyd,Laura Carmichael,Maeve Dermody,Ray Panthaki,Ian Puleston-Davies,Patrick Baladi,Florence Pugh,Jamie Bamber,Charlie Covell,Andrew Lancel,Jack Doolan,Tobias Santelmann,Stephen Lord,Ben Cura,Imogen Faires",,United Kingdom,https://www.imdb.com/title/tt5269594/?ref_=plg_rt_1,"New Season Added:June 14, 2020"
847,March Comes in Like a Lion,tvshow,2017,TV-14,2 Seasons,"Orphaned young, a reclusive 17-year-old professional shogi player starts to come out of his shell when three sisters take him under their wing.","Anime Series,International TV Shows,Teen TV Shows","Kengo Kawanishi,Ai Kayano,Kana Hanazawa,Misaki Kuno,Nobuhiko Okamoto,Marina Inoue,Yoshimasa Hosoya,Shinichiro Miki,Tomokazu Sugita,Subaru Kimura,Shigeru Chiba,Toru Okawa,Takahiro Sakurai",,Japan,https://www.imdb.com/title/tt6074794/?ref_=plg_rt_1,"New Season Added:June 1, 2019"
848,Marching Orders,tvshow,2018,TV-14,1 Season,"A top-ranked college marching band’s members fight to keep their spots, memorize routines, tend to their social lives – and slay the competition.",Docuseries,,,United States,https://www.imdb.com/title/tt6647696/?ref_=plg_rt_1,"Added to Netflix:August 3, 2018"
849,Marco Polo,tvshow,2016,TV-MA,2 Seasons,"Set in a world of greed, betrayal, sexual intrigue and rivalry, “Marco Polo” is based on the famed explorer’s adventures in Kublai Khan’s court.","TV Action & Adventure,TV Dramas","Lorenzo Richelmy,Benedict Wong,Chin Han,Joan Chen,Michelle Yeoh,Rick Yune,Claudia Kim,Remy Hii,Zhu Zhu,Tom Wu,Mahesh Jadu,Olivia Cheng,Uli Latukefu,Pierfrancesco Favino,Jacqueline Chan,Leonard Wu,Gabriel Byrne",,United States,https://www.imdb.com/title/tt2189461/?ref_=plg_rt_1,"New Season Added:July 1, 2016"
850,Marianne,tvshow,2019,TV-MA,1 Season,"Lured back to her hometown, a famous horror writer discovers that the evil spirit who plagues her dreams is now wreaking havoc in the real world.","International TV Shows,TV Dramas,TV Horror","Victoire Du Bois,Lucie Boujenah,Tiphaine Daviot,Ralph Amoussou,Bellamine Abdelmalek,Mehdi Meskar,Alban Lenoir,Mireille Herbstmeyer,Corinne Valancogne,Patrick d'Assumçao,Pierre Aussedat",,France,https://www.imdb.com/title/tt10875696/?ref_=plg_rt_1,"Added to Netflix:September 13, 2019"
851,Marlon,tvshow,2018,TV-14,2 Seasons,"After the friendliest divorce ever, a carefree but devoted father navigates post-split parenting life with his levelheaded ex-wife and two kids.",TV Comedies,"Marlon Wayans,Essence Atkins,Bresha Webb,Diallo Riddle,Notlim Taylor,Amir O'Neil",,United States,https://www.imdb.com/title/tt5720168/?ref_=plg_rt_1,"New Season Added:June 14, 2019"
852,Married at First Sight,tvshow,2019,TV-14,1 Season,"Set up by experts, four couples meet at the altar for the first time and test their compatibility after the wedding.","Reality TV,Romantic TV Shows","Viviana Coles,Calvin Roberson,Pepper Schwartz",,United States,https://www.imdb.com/title/tt3868860/?ref_=plg_rt_1,"Added to Netflix:April 13, 2020"
853,Mars,tvshow,2018,TV-PG,2 Seasons,Fact meets fiction in this docudrama chronicling the journey of a spacecraft crew as it embarks in 2033 on a mission to colonize the red planet.,"Docuseries,Science & Nature TV,TV Dramas","Jihae,Alberto Ammann,Clémentine Poidatz,Anamaria Marinca,Sammi Rotibi,Nicholas Wittman,Cosima Shaw",Everardo Gout,United States,https://www.imdb.com/title/tt4939064/?ref_=plg_rt_1,"New Season Added:November 1, 2019"
854,Marseille,tvshow,2018,TV-MA,2 Seasons,The longtime mayor of Marseille is preparing to hand over the reins to his protégé when a sudden and ruthless battle erupts for control of the city.,"International TV Shows,TV Dramas,TV Thrillers","Gérard Depardieu,Benoît Magimel,Géraldine Pailhas,Nadia Farès,Stéphane Caillard,Jean-René Privat,Pascal Elso,Gérard Meylan",,France,https://www.imdb.com/title/tt4003966/?ref_=plg_rt_1,"New Season Added:February 23, 2018"
855,Marvel's Agents of S.H.I.E.L.D.,tvshow,2019,TV-14,6 Seasons,"Agent Phil Coulson, seen in action in Marvel's The Avengers, assembles a team of top S.H.I.E.L.D. agents to investigate bizarre threats.","TV Action & Adventure,TV Sci-Fi & Fantasy","Clark Gregg,Ming-Na Wen,Brett Dalton,Chloe Bennet,Iain De Caestecker,Elizabeth Henstridge,Adrianne Palicki,Luke Mitchell,Henry Simmons",,United States,https://www.imdb.com/title/tt2364582/?ref_=plg_rt_1,"New Season Added:September 1, 2019"
856,Marvel's Daredevil,tvshow,2018,TV-MA,3 Seasons,"Blinded as a young boy, Matt Murdock fights injustice by day as a lawyer and by night as the Super Hero Daredevil in Hell's Kitchen, New York City.","Crime TV Shows,TV Action & Adventure","Charlie Cox,Deborah Ann Woll,Elden Henson,Rosario Dawson,Vincent D'Onofrio,Jon Bernthal,Elodie Yung,Scott Glenn,Stephen Rider,Vondie Curtis-Hall,Ayelet Zurer,Toby Leonard Moore,Bob Gunton",,United States,https://www.imdb.com/title/tt3322312/?ref_=plg_rt_1,"New Season Added:October 19, 2018"
857,Marvel's Iron Fist,tvshow,2018,TV-MA,2 Seasons,"Danny Rand resurfaces 15 years after being presumed dead. Now, with the power of the Iron Fist, he seeks to reclaim his past and fulfill his destiny.","Crime TV Shows,TV Action & Adventure,TV Dramas","Finn Jones,Jessica Henwick,David Wenham,Jessica Stroup,Tom Pelphrey",,United States,https://www.imdb.com/title/tt3322310/?ref_=plg_rt_1,"New Season Added:September 7, 2018"
858,Marvel's Jessica Jones,tvshow,2019,TV-MA,3 Seasons,"Haunted by a traumatic past, Jessica Jones uses her gifts as a private eye to find her tormentor before he can harm anyone else in Hell's Kitchen.","Crime TV Shows,TV Action & Adventure,TV Dramas","Krysten Ritter,David Tennant,Rachael Taylor,Mike Colter,Carrie-Anne Moss,Eka Darville,Erin Moriarty,Wil Traval,Susie Abromeit",,United States,https://www.imdb.com/title/tt2357547/?ref_=plg_rt_1,"New Season Added:June 14, 2019"
859,Marvel's Luke Cage,tvshow,2018,TV-MA,2 Seasons,"A hoodie-wearing, unbreakable ex-con fights to clear his name and save his neighborhood. He wasn't looking for a fight, but the people need a hero.","Crime TV Shows,TV Action & Adventure,TV Dramas","Mike Colter,Alfre Woodard,Rosario Dawson,Simone Missick,Mahershala Ali,Erik LaRay Harvey,Theo Rossi,Frank Whaley,Frankie Faison,Sonia Braga,Ron Cephas Jones",,United States,https://www.imdb.com/title/tt3322314/?ref_=plg_rt_1,"New Season Added:June 22, 2018"
860,Marvel's The Defenders,tvshow,2017,TV-MA,1 Season,"Daredevil, Jessica Jones, Luke Cage and Iron Fist join forces to take on common enemies as a sinister conspiracy threatens New York City.","Crime TV Shows,TV Action & Adventure,TV Dramas","Charlie Cox,Krysten Ritter,Mike Colter,Finn Jones,Sigourney Weaver,Elodie Yung,Elden Henson,Jessica Henwick,Simone Missick,Rachael Taylor,Deborah Ann Woll,Rosario Dawson,Carrie-Anne Moss,Eka Darville,Scott Glenn",,United States,https://www.imdb.com/title/tt4230076/?ref_=plg_rt_1,"Added to Netflix:August 18, 2017"
861,Marvel's The Punisher,tvshow,2019,TV-MA,2 Seasons,A former Marine out to punish the criminals responsible for his family's murder finds himself ensnared in a military conspiracy.,"Crime TV Shows,TV Action & Adventure,TV Thrillers","Jon Bernthal,Ebon Moss-Bachrach,Ben Barnes,Amber Rose Revah,Jason R. Moore,Daniel Webber,Jaime Ray Newman,Michael Nathanson,Deborah Ann Woll,Paul Schulze",,United States,https://www.imdb.com/title/tt5675620/?ref_=plg_rt_1,"New Season Added:January 18, 2019"
862,Masha and the Bear,tvshow,2019,TV-Y,4 Seasons,"Lively little Masha lives near the forest, where she has many wonderful adventures with her best friend, a bear who used to be in the circus.",Kids' TV,"Alina Kukushkina,Boris Kutnevich,Giselle Nieto,Elsie Fisher",,Russia,https://www.imdb.com/title/tt1884856/?ref_=plg_rt_1,"New Season Added:May 1, 2020"
863,Masha's Spooky Stories,tvshow,2012,TV-Y,1 Season,"Masha explains why there's no need to be scared of things like monsters, the dark, going to a new school, thunder and other common childhood fears.",Kids' TV,,,"United States,Russia",https://www.imdb.com/title/tt6979430/?ref_=plg_rt_1,"Added to Netflix:October 1, 2016"
864,Masha's Tales,tvshow,2012,TV-Y,1 Season,"Fairy tales get a funny twist when Masha retells them, because she tends to get the details just a little jumbled up in this animated kids' series.",Kids' TV,,,,,"Added to Netflix:February 1, 2016"
865,Master of None,tvshow,2017,TV-MA,2 Seasons,Dev tries to jump-start his acting career and elevate his dating game with help from his eclectic group of friends in this award-winning series.,TV Comedies,"Aziz Ansari,Noël Wells,Eric Wareheim,Lena Waithe,Kelvin Yu,Fatima Ansari,Shoukath Ansari,Alessandra Mastronardi,Bobby Cannavale",,United States,https://www.imdb.com/title/tt4635276/?ref_=plg_rt_1,"New Season Added:May 12, 2017"
866,MeatEater,tvshow,2019,TV-14,2 Seasons,Steven Rinella scrounges in some of America's wildest terrains in this unscripted series showing him on the hunt for wild animals from ducks to deer.,"Docuseries,Reality TV,Science & Nature TV",Steven Rinella,,United States,https://www.imdb.com/title/tt2169245/?ref_=plg_rt_1,"New Season Added:March 28, 2020"
867,Medal of Honor,tvshow,2018,TV-MA,1 Season,"Honoring service members whose courage merited the awarding of a Medal of Honor, this docudrama series re-creates their inspiring true stories.","Docuseries,TV Dramas","Oliver Hudson,Ben Schwartz,Paul Wesley,Aldis Hodge,Jonny Weston,Joseph Cross,Jake Abel,Derek Mio",,United States,https://www.imdb.com/title/tt7440274/?ref_=plg_rt_1,"Added to Netflix:November 9, 2018"
868,Medici: Masters of Florence,tvshow,2019,TV-MA,3 Seasons,"After his father's murder, banking heir Cosimo Medici battles opponents of his artistic, economic and political visions for 15th-century Florence.","International TV Shows,TV Dramas","Richard Madden,Dustin Hoffman,Stuart Martin,Annabel Scholey",,"Italy,United Kingdom,France",https://www.imdb.com/title/tt5057130/?ref_=plg_rt_1,"New Season Added:May 1, 2020"
869,Meet the Adebanjos,tvshow,2016,TV-PG,3 Seasons,"In South London, tradition clashes with culture as a Nigerian father tries to instill his old-fashioned African values into his modern British family.","British TV Shows,International TV Shows,TV Comedies","Wale Ojo,Yetunde Oduwole,Andrea Aboagye,Daniel Davids,Moji Bamtefa,Jordan Coulson",,United Kingdom,https://www.imdb.com/title/tt2344781/?ref_=plg_rt_1,"New Season Added:November 4, 2019"
870,Megalobox,tvshow,2018,TV-MA,1 Season,"Created for the 50th anniversary of manga ""Ashita No Joe,"" mechanized human fighters known as Megalo Boxers battle each other for boxing supremacy.","Anime Series,International TV Shows","Yoshimasa Hosoya,Shiro Saito,Hiroki Yasumoto,Nanako Mori,Michiyo Murase,Hiroyuki Kinoshita",,Japan,https://www.imdb.com/title/tt7965802/?ref_=plg_rt_1,"Added to Netflix:June 1, 2020"
871,Melodies of Life - Born This Way,tvshow,2016,TV-14,1 Season,"A celebrated pastry chef and his fellow staff members at a bake shop embark on bittersweet adventures in love, work and friendship.","International TV Shows,Romantic TV Shows,TV Comedies",,,,,"Added to Netflix:June 21, 2019"
872,Memories of the Alhambra,tvshow,2018,TV-MA,1 Season,"While looking for the cryptic creator of an innovative augmented-reality game, an investment firm executive meets a woman who runs a hostel in Spain.","Crime TV Shows,International TV Shows,Korean TV Shows","Hyun Bin,Park Shin-hye,Park Hoon,Kim Yong-rim,Chanyeol,Lee Re,Lee Hak Joo,Lee Si-won,Kim Eui-sung",,South Korea,https://www.imdb.com/title/tt8236556/?ref_=plg_rt_1,"Added to Netflix:December 2, 2018"
873,Memory Love,tvshow,2017,TV-14,1 Season,"Losing her memory – and her boyfriend – after a car accident, Jia-en crosses paths with a heart transplant recipient who helps her recall her past.","International TV Shows,Romantic TV Shows,TV Dramas","Andy Chen,Mandy Wei,Jolin Chien,Mandy Tao,Kris Shen,Nylon Chen",,,https://www.imdb.com/title/tt9015516/?ref_=plg_rt_1,"Added to Netflix:January 18, 2019"
874,Men on a Mission,tvshow,2019,TV-14,4 Seasons,"Male celebs play make-believe as high schoolers, welcoming star transfer students every week and engaging in battles of witty humor and slapstick.","International TV Shows,Korean TV Shows,Stand-Up Comedy & Talk Shows","Ho-dong Kang,Soo-geun Lee,Sang-min Lee,Young-chul Kim,Jang-hoon Seo,Hee-chul Kim,Kyung-hoon Min",Jung-ah Im,South Korea,https://www.imdb.com/title/tt5247622/?ref_=plg_rt_1,"New Season Added:April 9, 2019"
875,Mere Papa Hero Hiralal,tvshow,2018,TV-14,1 Season,"A simple auto-rickshaw driver on the streets of Lucknow, Hiralal Tiwari does everything he can to give his gravely ill daughter a happy life.","International TV Shows,TV Dramas","Sarwar Ahuja,Riva Arora",,,,"Added to Netflix:May 1, 2018"
876,Merlí,tvshow,2015,TV-MA,1 Season,"An unconventional high school philosophy teacher upsets a few parents and staff, romances others and inspires all his pupils, including his gay son.","International TV Shows,TV Dramas,Teen TV Shows","Francesc Orella,David Solans,Candela Antón,Albert Baró,Adrian Grösser,Marcos Franz,Pau Poch,Júlia Creus,Carlos Cuevas,Elisabet Casanovas,Iñaki Mur,Pau Durà,Pere Ponce,Mar del Hoyo,Rubén de Eguia,Patrícia Bargalló,Assun Planas,Pep Jové,Anna Maria Barbany,Marta Marco,Jordi Martínez,Victòria Pagès,Marta Domingo,Anna Ycobalzeta,Oriol Pla,Pepa López",,Spain,https://www.imdb.com/title/tt4580372/?ref_=plg_rt_1,"Added to Netflix:December 1, 2016"
877,Merlin,tvshow,2012,TV-PG,5 Seasons,"This family-oriented retelling of the King Arthur legend finds Merlin arriving in Camelot, where he hones his magic skills with the help of his uncle.","British TV Shows,International TV Shows,TV Action & Adventure","Colin Morgan,Bradley James,Katie McGrath,Angel Coulby,Richard Wilson,Anthony Head,John Hurt,Nathaniel Parker",James Hawes,United Kingdom,https://www.imdb.com/title/tt1199099/?ref_=plg_rt_1,"New Season Added:December 15, 2016"
