,title,type,imdb_rating,tomato_rating,genres,maturity_rating,time_period,runtime,platform,tags,country,description,ps
119,Bolt,movie,6.8/10,89%,"['Animation', 'Action & Adventure', 'Comedy', 'Drama', 'Family']",Rated: 7+ (PG),2008,1h 38m,"['Netflix', 'Disney+']","['Friendship', 'Dog', 'Animal', 'Pet', 'Disney', 'Feel-good']",['America'],"Bolt is the star of the biggest show in Hollywood. The only problem is, he thinks it's real. After he's accidentally shipped to New York City and separated from Penny, his beloved co-star and owner, Bolt must harness all his ""super powers"" to find a way home.Bolt featuring John Travolta and Miley Cyrus is streaming with subscription on Netflix, streaming with subscription on Disney+, available for rent or purchase on iTunes, and 4 others. It's an action & adventure and animation movie with a high Rotten Tomatoes (critics) score of 89% and a better than average IMDb audience rating of 6.8 (184,392 votes).",All Clear
120,Chasing Amy,movie,7.2/10,87%,"['Comedy', 'LGBTQ', 'Drama', 'Romance']",Rated: 18+ (R),1997,1h 54m,['Netflix'],"['Friendship', 'College', 'Comic Book', 'Mature', 'Feel-good']",['America'],"Holden and Banky are comic book artists. Everything is going good for them until they meet Alyssa, also a comic book artist. Holden falls for her, but his hopes are crushed when he finds out she's a lesbian.Chasing Amy featuring Ben Affleck and Joey Lauren Adams is streaming with subscription on Netflix, streaming with subscription on Hoopla, available for rent or purchase on iTunes, and 4 others. It's a comedy and drama movie with a high Rotten Tomatoes (critics) score of 87% and a better than average IMDb audience rating of 7.2 (130,082 votes).",All Clear
121,United 93,movie,7.5/10,90%,"['Action & Adventure', 'Drama', 'History', 'Thriller', 'Mystery', 'Crime']",Rated: 18+ (R),2006,1h 51m,['Netflix'],"['Police', 'War', 'Disaster', 'Based On True Story']","['France', 'France', 'United Kingdom', 'America']","A real time account of the events on United Flight 93, one of the planes hijacked on 9/11 that crashed near Shanksville, Pennsylvania when passengers foiled the terrorist plot.United 93 featuring J.J. Johnson and Polly Adams is streaming with subscription on Netflix, available for rent or purchase on iTunes, available for rent or purchase on Google Play, and 4 others. It's an action & adventure and crime movie with a high Rotten Tomatoes (critics) score of 90% and a better than average IMDb audience rating of 7.5 (96,475 votes).",All Clear
122,Clueless,movie,6.8/10,80%,"['Comedy', 'LGBTQ', 'Romance', 'Drama']",Rated: 13+ (PG-13),1995,1h 37m,['Netflix'],"['High School', 'Friendship', 'Female Director', 'Doctor', 'Teen']",['America'],"Shallow, rich and socially successful Cher is at the top of her Beverly Hills high school's pecking scale. Seeing herself as a matchmaker, Cher first coaxes two teachers into dating each other. Emboldened by her success, she decides to give hopelessly klutzy new student Tai a makeover. When Tai becomes more popular than she is, Cher realizes that her disapproving ex-stepbrother was right about how misguided she was -- and falls for him.Clueless featuring Alicia Silverstone and Stacey Dash is streaming with subscription on Netflix, streaming via tv everywhere with Freeform, available for rent or purchase on iTunes, and 5 others. It's a comedy and drama movie with a high Rotten Tomatoes (critics) score of 80% and a better than average IMDb audience rating of 6.8 (172,923 votes).",All Clear
123,Tremors,movie,7.1/10,88%,"['Horror', 'Cult', 'Comedy', 'Science-Fiction', 'Action & Adventure', 'Fantasy']",Rated: 13+ (PG-13),1990,1h 36m,['Netflix'],"['Monster', 'Technology', 'Survival']",['America'],"Hick handymen Val McKee and Earl Bassett can barely eke out a living in the Nevada hamlet of Perfection, so they decide to leave town -- despite an admonition from a shapely seismology coed who's picking up odd readings on her equipment. Before long, Val and Earl discover what's responsible for those readings: 30-foot-long carnivorous worms with a proclivity for sucking their prey underground.Tremors featuring Kevin Bacon and Fred Ward is streaming with subscription on Netflix, available for rent or purchase on iTunes, available for rent or purchase on Google Play, and 3 others. It's an action & adventure and comedy movie with a high Rotten Tomatoes (critics) score of 88% and a better than average IMDb audience rating of 7.1 (116,074 votes).",All Clear
124,The Princess and the Frog,movie,7.1/10,85%,"['Animation', 'Family', 'Fantasy', 'Action & Adventure', 'Comedy', 'Musical', 'Romance']",Rated: All (G),2009,1h 37m,"['Netflix', 'Disney+']","['Princess', 'Supernatural', 'Animal', 'Royalty', 'Disney', 'Adaptation', 'Teen']",['America'],"A waitress, desperate to fulfill her dreams as a restaurant owner, is set on a journey to turn a frog prince back into a human being, but she has to face the same problem after she kisses him.The Princess and the Frog featuring Anika Noni Rose and Bruno Campos is streaming with subscription on Netflix, streaming with subscription on Disney+, available for rent or purchase on iTunes, and 5 others. It's an action & adventure and animation movie with a high Rotten Tomatoes (critics) score of 85% and a better than average IMDb audience rating of 7.1 (118,665 votes).",All Clear
125,The Wicker Man,movie,7.5/10,89%,"['Horror', 'Cult', 'Mystery', 'Thriller']",Rated: 18+ (R),1973,1h 34m,['Netflix'],"['Based on Books', 'Police', 'Religion', 'Adaptation', 'Mature']",['United Kingdom'],"Police sergeant Neil Howie is called to an island village in search of a missing girl whom the locals claim never existed. Stranger still, however, are the rituals that take place there.The Wicker Man featuring Edward Woodward and Christopher Lee is streaming with subscription on Netflix, available for rent or purchase on iTunes, available for rent or purchase on Google Play, and 2 others. It's a cult and horror movie with a high Rotten Tomatoes (critics) score of 89% and a better than average IMDb audience rating of 7.5 (66,285 votes).",All Clear
126,A Single Man,movie,7.6/10,85%,"['Drama', 'LGBTQ', 'Romance']",Rated: 18+ (R),2009,1h 37m,['Netflix'],"['Based on Books', 'Teacher', 'Adaptation', 'Mature']",['America'],"The life of George Falconer, a British college professor, is reeling with the recent and sudden loss of his longtime partner. This traumatic event makes George challenge his own will to live as he seeks the console of his close girl friend Charley, who is struggling with her own questions about life.A Single Man featuring Colin Firth and Julianne Moore is streaming with subscription on Netflix. It's a drama and LGBTQ movie with a high Rotten Tomatoes (critics) score of 85% and a high IMDb audience rating of 7.6 (103,599 votes).",All Clear
127,Extraction,movie,6.8/10,68%,"['Action & Adventure', 'Thriller', 'Drama', 'Mystery']",Rated: 18+ (R),2020,1h 56m,['Netflix'],"['Comic Book', 'Adaptation']",['America'],"Tyler Rake, a fearless mercenary who offers his services on the black market, embarks on a dangerous mission when he is hired to rescue the kidnapped son of a Mumbai crime lord…Extraction featuring Chris Hemsworth and Rudhraksh Jaiswal is streaming with subscription on Netflix. It's an action & adventure and drama movie with a better than average Rotten Tomatoes (critics) score of 68% and a better than average IMDb audience rating of 6.8 (124,899 votes).",All Clear
128,Bad Genius,movie,7.6/10,100%,"['Comedy', 'Crime', 'Drama', 'Thriller']",Rated: 13+ (PG-13),2017,2h 10m,['Netflix'],"['High School', 'Friendship']",['Thailand'],"Lynn, a brilliant student, after helping her friends to get the grades they need, develops the idea of starting a much bigger exam-cheating business.Bad Genius featuring Chutimon Chuengcharoensukying and Eisaya Hosuwan is streaming with subscription on Netflix, and available for rent or purchase on iTunes. It's a comedy and crime movie with a very high Rotten Tomatoes (critics) score of 100% and a high IMDb audience rating of 7.6 (16,275 votes).",All Clear
129,The Gift,movie,7/10,91%,"['Mystery', 'Thriller', 'Drama', 'Horror', 'Documentary']",Rated: 18+ (R),2015,1h 48m,['Netflix'],['Suspense'],"['Australia', 'Australia', 'America']","A husband and wife try to reinvigorate their relationship but their lives are threatened by a ""friend"" from the husband's past who holds a horrifying secret about him, sending their world into a tailspin.The Gift featuring Jason Bateman and Rebecca Hall is streaming with subscription on Netflix, available for rent or purchase on iTunes, available for rent or purchase on Google Play, and 4 others. It's a documentary and drama movie with a very high Rotten Tomatoes (critics) score of 91% and a better than average IMDb audience rating of 7.0 (133,488 votes).",All Clear
130,Neon Genesis Evangelion: The End of Evangelion,movie,,,,,,,,,,"The second of two theatrically released follow-ups to the Neon Genesis Evangelion series. Comprising of two alternate episodes which were first intended to take the place of episodes 25 and 26, this finale answers many of the questions surrounding the series, while also opening up some new possibilities.Neon Genesis Evangelion: The End of Evangelion featuring Megumi Ogata and Megumi Hayashibara is streaming with subscription on Netflix. It's an action & adventure and animation movie with a high Rotten Tomatoes (critics) score of 88% and a high IMDb audience rating of 8.1 (35,153 votes).","['8.1/10', '88%', 'Animation\xa0Anime\xa0...More GenresAnimationAnimeAction & AdventureDramaFantasyScience-Fiction', '1997', '1h 27m', 'On: Netflix\xa0', 'Tags:\xa0Dystopia\xa0Robot\xa0Apocalypse\xa0...More TagsDystopiaRobotApocalypseSciencePsychologyGeniusReligionFuturistic', 'Country:\xa0Japan']"
131,Zindagi Na Milegi Dobara,movie,8.1/10,91%,"['Action & Adventure', 'Comedy', 'Drama', 'Travel', 'Romance']",Rated: 7+ (PG),2011,2h 46m,['Netflix'],"['Friendship', 'Music', 'Sports']",['India'],"Three friends who were inseparable in childhood decide to go on a three-week-long bachelor road trip to Spain, in order to re-establish their bond and explore thrilling adventures, before one of them gets married. What will they learn of themselves and each other during the adventure?Zindagi Na Milegi Dobara featuring Hrithik Roshan and Farhan Akhtar is streaming with subscription on Netflix, available for rent or purchase on iTunes, and available for rent or purchase on Microsoft Store. It's an action & adventure and comedy movie with a very high Rotten Tomatoes (critics) score of 91% and a high IMDb audience rating of 8.1 (64,389 votes).",All Clear
132,Blow,movie,7.6/10,55%,"['Biography', 'Crime', 'Drama']",Rated: 18+ (R),2001,2h 4m,['Netflix'],"['War', 'Drug', 'Gangster']",['America'],"A boy named George Jung grows up in a struggling family in the 1950's. His mother nags at her husband as he is trying to make a living for the family. It is finally revealed that George's father cannot make a living and the family goes bankrupt. George does not want the same thing to happen to him, and his friend Tuna, in the 1960's, suggests that he deal marijuana. He is a big hit in California in the 1960's, yet he goes to jail, where he finds out about the wonders of cocaine. As a result, when released, he gets rich by bringing cocaine to America. However, he soon pays the price.Blow featuring Johnny Depp and Penélope Cruz is streaming with subscription on Netflix, available for rent or purchase on iTunes, available for rent or purchase on Google Play, and 4 others. It's a biography and crime movie with an average Rotten Tomatoes (critics) score of 55% and a high IMDb audience rating of 7.6 (234,760 votes).",All Clear
133,"Jim & Andy: The Great Beyond- Featuring a Very Special, Contractually Obligated Mention of Tony Clifton",movie,,,,,,,,,,"Offbeat documentarian Chris Smith provides a behind-the-scenes look at how Jim Carrey adopted the persona of idiosyncratic comedian Andy Kaufman on the set of Man on the Moon.Jim & Andy: The Great Beyond- Featuring a Very Special, Contractually Obligated Mention of Tony Clifton featuring Jim Carrey and Danny DeVito is streaming with subscription on Netflix. It's a comedy and documentary movie with a very high Rotten Tomatoes (critics) score of 94% and a high IMDb audience rating of 7.7 (21,874 votes).","['7.7/10', '94%', 'Documentary\xa0Comedy\xa0', 'Rated: 18+ (R)', '2017', '1h 34m', 'On: Netflix\xa0']"
134,The Squid and the Whale,movie,7.3/10,92%,"['Comedy', 'Independent', 'Drama']",Rated: 18+ (R),2005,1h 21m,"['Free Services', 'Netflix', 'Prime Video', 'Free Services', 'Netflix', 'Prime Video', 'Kanopy']","['New York', 'Mature']",['America'],"Based on the true childhood experiences of Noah Baumbach and his brother, The Squid and the Whale tells the touching story of two young boys dealing with their parents divorce in Brooklyn in the 1980's.The Squid and the Whale featuring Jeff Daniels and Laura Linney is streaming with subscription on Netflix, streaming with subscription on Prime Video, free on Tubi, and 8 others. It's a comedy and drama movie with a very high Rotten Tomatoes (critics) score of 92% and a better than average IMDb audience rating of 7.3 (75,465 votes).",All Clear
135,Steve Jobs,movie,7.2/10,85%,"['Biography', 'Drama', 'History']",Rated: 18+ (R),2015,2h 2m,['Netflix'],"['Technology', 'Adaptation', 'Based On True Story']","['United Kingdom', 'United Kingdom', 'America']","Set backstage at three iconic product launches and ending in 1998 with the unveiling of the iMac, Steve Jobs takes us behind the scenes of the digital revolution to paint an intimate portrait of the brilliant man at its epicenter.Steve Jobs featuring Michael Fassbender and Kate Winslet is streaming with subscription on Netflix, streaming with subscription on Hoopla, available for rent or purchase on iTunes, and 6 others. It's a biography and drama movie with a high Rotten Tomatoes (critics) score of 85% and a better than average IMDb audience rating of 7.2 (148,737 votes).",All Clear
136,Tootsie,movie,7.4/10,90%,"['Comedy', 'Romance', 'Drama']",Rated: 7+ (PG),1982,1h 56m,['Netflix'],"['Friendship', 'New York']",['America'],"When struggling, out of work actor Michael Dorsey secretly adopts a female alter ego - Dorothy Michaels - in order to land a part in a daytime drama, he unwittingly becomes a feminist icon and ends up in a romantic pickle.Tootsie featuring Dustin Hoffman and Jessica Lange is streaming with subscription on Netflix, available for rent or purchase on iTunes, available for rent or purchase on Google Play, and 4 others. It's a comedy and drama movie with a high Rotten Tomatoes (critics) score of 90% and a better than average IMDb audience rating of 7.4 (94,930 votes).",All Clear
137,The Patriot,movie,7.2/10,61%,"['Action & Adventure', 'Drama', 'History']",Rated: 18+ (R),2000,2h 45m,"['Netflix', 'Hulu']","['War', 'Martial Arts', 'Doctor', 'Adaptation', 'Based On True Story']","['Germany', 'Germany', 'America']","After proving himself on the field of battle in the French and Indian War, Benjamin Martin wants nothing more to do with such things, preferring the simple life of a farmer. But when his son Gabriel enlists in the army to defend their new nation, America, against the British, Benjamin reluctantly returns to his old life to protect his son.The Patriot featuring Mel Gibson and Heath Ledger is streaming with subscription on Netflix, streaming with subscription on Hulu, available for rent or purchase on iTunes, and 5 others. It's an action & adventure and drama movie with an average Rotten Tomatoes (critics) score of 61% and a better than average IMDb audience rating of 7.2 (248,722 votes).",All Clear
138,The Queen,movie,7.3/10,96%,"['Biography', 'Drama', 'History']",Rated: 13+ (PG-13),2006,1h 43m,['Netflix'],"['Princess', 'Animal', 'Royalty', 'Adaptation', 'Based On True Story', 'Political']","['France', 'France', 'Italy', 'United Kingdom', 'America']","The Queen is an intimate behind the scenes glimpse at the interaction between HM Elizabeth II and Prime Minister Tony Blair during their struggle, following the death of Diana, to reach a compromise between what was a private tragedy for the Royal family and the public's demand for an overt display of mourning.The Queen featuring Helen Mirren and Michael Sheen is streaming with subscription on Netflix, available for rent or purchase on iTunes, available for rent or purchase on Google Play, and 3 others. It's a biography and drama movie with a very high Rotten Tomatoes (critics) score of 96% and a better than average IMDb audience rating of 7.3 (101,748 votes).",All Clear
139,The Croods,movie,7.2/10,71%,"['Animation', 'Action & Adventure', 'Comedy', 'Family', 'Fantasy']",Rated: 7+ (PG),2013,1h 38m,['Netflix'],['Teen'],['America'],"The Croods is a prehistoric comedy adventure that follows the world's first family as they embark on a journey of a lifetime when the cave that has always shielded them from danger is destroyed. Traveling across a spectacular landscape, the Croods discover an incredible new world filled with fantastic creatures -- and their outlook is changed forever.The Croods featuring Nicolas Cage and Emma Stone is streaming with subscription on Netflix, available for rent or purchase on iTunes, available for rent or purchase on Google Play, and 5 others. It's an action & adventure and animation movie with a better than average Rotten Tomatoes (critics) score of 71% and a better than average IMDb audience rating of 7.2 (185,321 votes).",All Clear
140,Solo: A Star Wars Story,movie,6.9/10,70%,"['Action & Adventure', 'Fantasy', 'Science-Fiction', 'Drama']",Rated: 13+ (PG-13),2018,2h 15m,['Netflix'],['Space'],['America'],"Through a series of daring escapades deep within a dark and dangerous criminal underworld, Han Solo meets his mighty future copilot Chewbacca and encounters the notorious gambler Lando Calrissian.Solo: A Star Wars Story featuring Alden Ehrenreich and Joonas Suotamo is streaming with subscription on Netflix, available for rent or purchase on iTunes, available for rent or purchase on Google Play, and 5 others. It's an action & adventure and drama movie with a better than average Rotten Tomatoes (critics) score of 70% and a better than average IMDb audience rating of 6.9 (272,894 votes).",All Clear
141,The Half of It,movie,,,,,,,,,,"Shy, straight-A student Ellie is hired by sweet but inarticulate jock Paul, who needs help wooing the most popular girl in school. But their new and unlikely friendship gets tricky when Ellie discovers she has feelings for the same girl.The Half of It featuring Leah Lewis and Daniel Diemer is streaming with subscription on Netflix. It's a comedy and drama movie with a very high Rotten Tomatoes (critics) score of 96% and a better than average IMDb audience rating of 7.0 (19,528 votes).","['7/10', '96%', 'Comedy\xa0Romance\xa0...More GenresComedyRomanceDrama', 'Rated: 13+ (PG-13)', '2020', '1h 44m', 'On: Netflix\xa0']"
142,Cape Fear,movie,7.3/10,73%,"['Thriller', 'Crime', 'Mystery', 'Drama']",Rated: 18+ (R),1991,2h 8m,['Netflix'],"['Prison', 'Revenge', 'Dog', 'Animal']",['America'],"Sam Bowden is a small-town corporate attorney. Max Cady is a tattooed, cigar-smoking, bible-quoting, psychotic rapist. What do they have in common? Fourteen years ago, Sam was a public defender assigned to Max Cady's rape trial, and he made a serious error: he hid a document from his illiterate client that could have gotten him acquitted. Now, the cagey, bibliophile Cady has been released, and he intends to teach Sam Bowden and his family a thing or two about loss.Cape Fear featuring Robert De Niro and Nick Nolte is streaming with subscription on Netflix, available for rent or purchase on iTunes, available for rent or purchase on Google Play, and 3 others. It's a crime and drama movie with a better than average Rotten Tomatoes (critics) score of 73% and a better than average IMDb audience rating of 7.3 (166,230 votes).",All Clear
143,Frances Ha,movie,7.5/10,92%,"['Comedy', 'Drama', 'Romance']",Rated: 18+ (R),2013,1h 26m,"['Netflix', 'The Criterion Channel']","['Friendship', 'Dance', 'Teacher', 'College']","['Brazil', 'Brazil', 'America']","An aspiring dancer moves to New York City and becomes caught up in a whirlwind of flighty fair-weather friends, diminishing fortunes and career setbacks.Frances Ha featuring Greta Gerwig and Mickey Sumner is streaming with subscription on Netflix, streaming with subscription on The Criterion Channel, available for rent or purchase on iTunes, and 3 others. It's a comedy and drama movie with a very high Rotten Tomatoes (critics) score of 92% and a better than average IMDb audience rating of 7.5 (69,711 votes).",All Clear
144,Locke,movie,7.1/10,91%,"['Drama', 'Mystery', 'Thriller']",Rated: 18+ (R),2014,1h 25m,"['Netflix', 'Kanopy']",['Car'],"['United Kingdom', 'United Kingdom', 'America']","Ivan Locke has worked hard to craft a good life for himself. Tonight, that life will collapse around him. On the eve of the biggest challenge of his career, Ivan receives a phone call that sets in motion a series of events that will unravel his family, job, and soul.Locke featuring Tom Hardy and Ruth Wilson is streaming with subscription on Netflix, streaming with subscription on Kanopy, available for rent or purchase on iTunes, and 5 others. It's a drama and mystery movie with a very high Rotten Tomatoes (critics) score of 91% and a better than average IMDb audience rating of 7.1 (130,324 votes).",All Clear
145,The Square,movie,,,,,,,,,,"The Square, a new film by Jehane Noujaim (Control Room; Rafea: Solar Mama), looks at the hard realities faced day-to-day by people working to build Egypt’s new democracy. Catapulting us into the action spread across 2011 and 2012, the film provides a kaleidoscopic, visceral experience of the struggle. Cairo’s Tahrir Square is the heart and soul of the film, which follows several young activists. Armed with values, determination, music, humor, an abundance of social media, and sheer obstinacy, they know that the thorny path to democracy only began with Hosni Mubarek’s fall. The life-and-death struggle between the people and the power of the state is still playing out.The Square featuring Khalid Abdalla and Dina Abdullah is streaming with subscription on Netflix, streaming with subscription on Prime Video, streaming with subscription on Fandor, and 3 others. It's a documentary and drama movie with a very high Rotten Tomatoes (critics) score of 100% and a high IMDb audience rating of 8.1 (8,403 votes).","['8.1/10', '100%', 'Documentary\xa0Drama\xa0...More GenresDocumentaryDramaHistory', '2013', '1h 28m', 'On: Free Services\xa0Netflix\xa0Prime Video\xa0...More ServicesFree ServicesNetflixPrime VideoFandor', 'Tags:\xa0Female Director\xa0Egypt\xa0Police\xa0...More TagsFemale DirectorEgyptPoliceWarAbout Africa', 'Country:\xa0Egypt\xa0...More CountriesEgyptUnited KingdomAmerica']"
146,Starred Up,movie,7.4/10,99%,"['Drama', 'Crime']",Rated: 18+ (R),2013,1h 46m,"['Free Services', 'Netflix', 'Prime Video', 'Free Services', 'Netflix', 'Prime Video', 'Kanopy']","['Prison', 'Psychology']","['Ireland', 'Ireland', 'United Kingdom']","19-year-old Eric, arrogant and ultra-violent, is prematurely transferred to the same adult prison facility as his estranged father. As his explosive temper quickly finds him enemies in both prison authorities and fellow inmates — and his already volatile relationship with his father is pushed past breaking point — Eric is approached by a volunteer psychotherapist, who runs an anger management group for prisoners. Torn between gang politics, prison corruption, and a glimmer of something better, Eric finds himself in a fight for his own life, unsure if his own father is there to protect him or join in punishing him.Starred Up featuring Jack O'Connell and Ben Mendelsohn is streaming with subscription on Netflix, streaming with subscription on Prime Video, free on Tubi, and 9 others. It's a crime and drama movie with a very high Rotten Tomatoes (critics) score of 99% and a better than average IMDb audience rating of 7.4 (42,095 votes).",All Clear
147,Blue Ruin,movie,7.1/10,96%,"['Crime', 'Independent', 'Drama', 'Thriller', 'Mystery']",Rated: 18+ (R),2013,1h 31m,['Netflix'],['Revenge'],['America'],"When the quiet life of a beach bum is upended by dreadful news, he sets off for his childhood home to carry out an act of vengeance. However, he proves an inept assassin and finds himself in a brutal fight to protect his estranged family.Blue Ruin featuring Macon Blair and Devin Ratray is streaming with subscription on Netflix, available for rent or purchase on iTunes, available for rent or purchase on Google Play, and 3 others. It's a crime and drama movie with a very high Rotten Tomatoes (critics) score of 96% and a better than average IMDb audience rating of 7.1 (63,925 votes).",All Clear
148,My Life as a Zucchini,movie,,,,,,,,,,"After his mother’s death, Zucchini is befriended by a kind police officer, Raymond, who accompanies him to his new foster home filled with other orphans his age. There, with the help of his newfound friends, Zucchini eventually learns to trust and love as he searches for a new family of his own.My Life as a Zucchini featuring Gaspard Schlatter and Sixtine Murat is streaming with subscription on Netflix, available for rent or purchase on iTunes, available for rent or purchase on Google Play, and 4 others. It's an animation and comedy movie with a very high Rotten Tomatoes (critics) score of 99% and a high IMDb audience rating of 7.8 (20,127 votes).","['7.8/10', '99%', 'Animation\xa0LGBTQ\xa0...More GenresAnimationLGBTQFamilyComedyDrama', 'Rated: 13+ (PG-13)', '2016', '1h 6m', 'On: Netflix\xa0']"
