,title,type,imdb_rating,tomato_rating,genres,maturity_rating,time_period,runtime,platform,tags,country,description,ps
244,The One I Love,movie,7.1/10,82%,"['Comedy', 'Drama', 'Romance', 'Science-Fiction', 'Mystery', 'Thriller', 'Fantasy']",Rated: 18+ (R),2014,1h 31m,['Netflix'],"['Escape', 'Suspense', 'Doctor']",['America'],"On the brink of separation, Ethan and Sophie escape to a beautiful vacation house for a weekend getaway in an attempt to save their marriage. What begins as a romantic and fun retreat soon becomes surreal, when an unexpected discovery forces the two to examine themselves, their relationship, and their future.The One I Love featuring Mark Duplass and Elisabeth Moss is streaming with subscription on Netflix, available for rent or purchase on iTunes, available for rent or purchase on Google Play, and 3 others. It's a comedy and drama movie with a high Rotten Tomatoes (critics) score of 82% and a better than average IMDb audience rating of 7.1 (33,759 votes).",All Clear
245,American Factory,movie,,,,,,,,,,"In post-industrial Ohio, a Chinese billionaire opens a new factory in the husk of an abandoned General Motors plant, hiring two thousand blue-collar Americans. Early days of hope and optimism give way to setbacks as high-tech China clashes with working-class America.American Factory featuring Junming 'Jimmy' Wang and Sherrod Brown is streaming with subscription on Netflix. It's a documentary movie with a very high Rotten Tomatoes (critics) score of 97% and a better than average IMDb audience rating of 7.4 (14,929 votes).","['7.4/10', '97%', 'Documentary\xa0', 'Rated: 16+', '2019', '1h 50m', 'On: Netflix\xa0']"
246,Sinister,movie,6.8/10,64%,"['Horror', 'Mystery', 'Thriller']",Rated: 18+ (R),2012,1h 50m,['Netflix'],"['Prison', 'Supernatural', 'Ghost']",['America'],"Found footage helps a true-crime novelist realize how and why a family was murdered in his new home, though his discoveries put his entire family in the path of a supernatural entity.Sinister featuring Ethan Hawke and Juliet Rylance is streaming with subscription on Netflix, available for rent or purchase on iTunes, available for rent or purchase on Google Play, and 4 others. It's a horror and mystery movie with a better than average Rotten Tomatoes (critics) score of 64% and a better than average IMDb audience rating of 6.8 (211,556 votes).",All Clear
247,The Distinguished Citizen,movie,,,,,,,,,,"After refusing big and prestigious awards all over the world, Mr. Mantovani, Literature Nobel Prize winner, accepts an invitation to visit his hometown in Argentina, which has been the inspiration for all of his books. It turns out that accepting this invitation is the worse idea of his life. Expect the unexpected when you have used real people as characters in your novels!The Distinguished Citizen featuring Oscar Martínez and Dady Brieva is streaming with subscription on Netflix. It's a comedy and drama movie with a very high Rotten Tomatoes (critics) score of 100% and a better than average IMDb audience rating of 7.5 (8,802 votes).","['7.5/10', '100%', 'Comedy\xa0Drama\xa0', '2016', '1h 58m', 'On: Netflix\xa0']"
248,Scooby-Doo on Zombie Island,movie,7.8/10,86%,"['Animation', 'Comedy', 'Mystery', 'Action & Adventure', 'Family', 'Fantasy', 'Thriller']",Rated: All (G),1998,1h 17m,['Netflix'],"['Zombie', 'Ghost']",['America'],"The Mystery Gang reunite and visit Moonscar Island, a remote island with a dark secret. Daphne wants more than just a villain in a costume, and they get more than they ever expected.Scooby-Doo on Zombie Island featuring Scott Innes and Billy West is streaming with subscription on Netflix, available for rent or purchase on iTunes, available for rent or purchase on Google Play, and 3 others. It's an action & adventure and animation movie with a high Rotten Tomatoes (critics) score of 86% and a high IMDb audience rating of 7.8 (11,274 votes).",All Clear
249,What Happened to Monday,movie,6.9/10,59%,"['Science-Fiction', 'Thriller', 'Action & Adventure', 'Crime', 'Drama']",Rated: 18+ (R),2017,2h 3m,['Netflix'],"['Dystopia', 'Apocalypse', 'Futuristic']","['Belgium', 'Belgium', 'France', 'United Kingdom']","In a world where families are limited to one child due to overpopulation, a set of identical septuplets must avoid being put to a long sleep by the government and dangerous infighting while investigating the disappearance of one of their own.What Happened to Monday featuring Noomi Rapace and Marwan Kenzari is streaming with subscription on Netflix. It's an action & adventure and crime movie with an average Rotten Tomatoes (critics) score of 59% and a better than average IMDb audience rating of 6.9 (97,019 votes).",All Clear
250,Madagascar: Escape 2 Africa,movie,6.6/10,64%,"['Animation', 'Action & Adventure', 'Comedy', 'Family']",Rated: 7+ (PG),2008,1h 29m,['Netflix'],"['Dance', 'Jungle', 'About Africa', 'Animal']",['America'],"Alex, Marty, and other zoo animals find a way to escape from Madagascar when the penguins reassemble a wrecked airplane. The precariously repaired craft stays airborne just long enough to make it to the African continent. There the New Yorkers encounter members of their own species for the first time. Africa proves to be a wild place, but Alex and company wonder if it is better than their Central Park home.Madagascar: Escape 2 Africa featuring Ben Stiller and Jada Pinkett Smith is streaming with subscription on Netflix, available for rent or purchase on iTunes, available for rent or purchase on Google Play, and 3 others. It's an action & adventure and animation movie with a better than average Rotten Tomatoes (critics) score of 64% and an average IMDb audience rating of 6.6 (198,134 votes).",All Clear
251,The Hundred-Foot Journey,movie,7.3/10,67%,"['Comedy', 'Drama']",Rated: 7+ (PG),2014,2h 2m,['Netflix'],"['Based on Books', 'Adaptation', 'Feel-good']","['India', 'India', 'United Arab Emirates', 'America']","A story centered around an Indian family who moves to France and opens a restaurant across the street from a Michelin-starred French restaurant.The Hundred-Foot Journey featuring Helen Mirren and Manish Dayal is streaming with subscription on Netflix, available for rent or purchase on iTunes, available for rent or purchase on Google Play, and 3 others. It's a comedy and drama movie with a better than average Rotten Tomatoes (critics) score of 67% and a better than average IMDb audience rating of 7.3 (74,284 votes).",All Clear
252,Jarhead,movie,7/10,61%,"['Drama', 'Action & Adventure', 'Biography', 'History']",Rated: 18+ (R),2005,2h 3m,['Netflix'],"['Military', 'War', 'Based On True Story']","['Germany', 'Germany', 'America']","Jarhead is a film about a US Marine Anthony Swofford’s experience in the Gulf War. After putting up with an arduous boot camp, Swofford and his unit are sent to the Persian Gulf where they are eager to fight, but are forced to stay back from the action. Swofford struggles with the possibility of his girlfriend cheating on him, and as his mental state deteriorates, his desire to kill increases.Jarhead featuring Jamie Foxx and Jake Gyllenhaal is streaming with subscription on Netflix, available for rent or purchase on iTunes, available for rent or purchase on Google Play, and 4 others. It's an action & adventure and biography movie with an average Rotten Tomatoes (critics) score of 61% and a better than average IMDb audience rating of 7.0 (171,746 votes).",All Clear
253,Salt,movie,6.4/10,62%,"['Action & Adventure', 'Crime', 'Mystery', 'Thriller']",Rated: 13+ (PG-13),2010,1h 40m,['Netflix'],"['Police', 'War', 'Revenge', 'Superhero', 'Kidnapping', 'Spy', 'Political']",['America'],"As a CIA officer, Evelyn Salt swore an oath to duty, honor and country. Her loyalty will be tested when a defector accuses her of being a Russian spy. Salt goes on the run, using all her skills and years of experience as a covert operative to elude capture. Salt's efforts to prove her innocence only serve to cast doubt on her motives, as the hunt to uncover the truth behind her identity continues and the question remains: ""Who is Salt?""Salt featuring Angelina Jolie and Liev Schreiber is streaming with subscription on Netflix, available for rent or purchase on iTunes, available for rent or purchase on Google Play, and 4 others. It's an action & adventure and crime movie with an average Rotten Tomatoes (critics) score of 62% and an average IMDb audience rating of 6.4 (289,443 votes).",All Clear
254,The Matrix Revolutions,movie,6.8/10,35%,"['Action & Adventure', 'Science-Fiction', 'Mystery', 'Thriller']",Rated: 18+ (R),2003,2h 9m,['Netflix'],"['Female Director', 'Dystopia', 'Robot', 'Apocalypse', 'Martial Arts', 'Technology', 'Science', 'Ghost', 'Genius', 'Survival', 'Fighting', 'Religion', 'Futuristic', 'Sports']","['Australia', 'Australia', 'America']","The human city of Zion defends itself against the massive invasion of the machines as Neo fights to end the war at another front while also opposing the rogue Agent Smith.The Matrix Revolutions featuring Keanu Reeves and Laurence Fishburne is streaming with subscription on Netflix, available for rent or purchase on iTunes, available for rent or purchase on Prime Video, and 2 others. It's an action & adventure and mystery movie with a low Rotten Tomatoes (critics) score of 35% and a better than average IMDb audience rating of 6.8 (436,391 votes).",All Clear
255,Slow West,movie,6.9/10,92%,"['Action & Adventure', 'Thriller', 'Drama', 'Romance', 'Mystery']",Rated: 18+ (R),2015,1h 24m,"['Netflix', 'Kanopy']","['Animal', 'Sports']","['New Zealand', 'New Zealand', 'United Kingdom']","In the Old West, a 17-year-old Scottish boy teams up with a mysterious gunman to find the woman with whom he is infatuated.Slow West featuring Michael Fassbender and Kodi Smit-McPhee is streaming with subscription on Netflix, streaming with subscription on Kanopy, streaming with subscription on Hoopla, and 6 others. It's an action & adventure and drama movie with a very high Rotten Tomatoes (critics) score of 92% and a better than average IMDb audience rating of 6.9 (41,212 votes).",All Clear
256,The White Helmets,movie,7.5/10,100%,"['Documentary', 'Crime']",Rated: 16+,2016,40 minutes,['Netflix'],"['War', 'Short']","['Syria', 'Syria', 'United Kingdom']","As daily airstrikes pound civilian targets in Syria, a group of indomitable first responders risk their lives to rescue victims from the rubble.The White Helmets featuring Khalid Farah and Mohammed Farah is streaming with subscription on Netflix. It's a crime and documentary movie with a very high Rotten Tomatoes (critics) score of 100% and a better than average IMDb audience rating of 7.5 (6,740 votes).",All Clear
257,Defiance,movie,7.2/10,57%,"['Action & Adventure', 'Drama', 'History', 'Thriller', 'Mystery']",Rated: 18+ (R),2008,2h 17m,['Netflix'],"['War', 'World War II', 'Survival', 'Fighting', 'Based On True Story']",['America'],"Based on a true story, during World War II, four Jewish brothers escape their Nazi-occupied homeland of West Belarus in Poland and join the Soviet partisans to combat the Nazis. The brothers begin the rescue of roughly 1,200 Jews still trapped in the ghettos of Poland.Defiance featuring Daniel Craig and Liev Schreiber is streaming with subscription on Netflix, available for rent or purchase on iTunes, available for rent or purchase on Google Play, and 4 others. It's an action & adventure and drama movie with an average Rotten Tomatoes (critics) score of 57% and a better than average IMDb audience rating of 7.2 (135,073 votes).",All Clear
258,Chasing Coral,movie,,,,,,,,,,"Coral reefs are the nursery for all life in the oceans, a remarkable ecosystem that sustains us. Yet with carbon emissions warming the seas, a phenomenon called “coral bleaching”—a sign of mass coral death—has been accelerating around the world, and the public has no idea of the scale or implication of the catastrophe silently raging underwater.Chasing Coral featuring Andrew Ackerman and Pim Bongaerts is streaming with subscription on Netflix. It's a documentary movie with a very high Rotten Tomatoes (critics) score of 100% and a high IMDb audience rating of 8.1 (3,855 votes).","['8.1/10', '100%', 'Documentary\xa0', '2017', '1h 33m', 'On: Netflix\xa0', 'Tags:\xa0Science\xa0Sports\xa0', 'Country:\xa0America']"
259,The Perfection,movie,,,,,,,,,,"When troubled musical prodigy Charlotte seeks out Elizabeth, the new star pupil of her former school, the encounter sends both musicians down a sinister path with shocking consequences.The Perfection featuring Allison Williams and Logan Browning is streaming with subscription on Netflix. It's a drama and horror movie with a high Rotten Tomatoes (critics) score of 83% and an average IMDb audience rating of 6.1 (31,867 votes).","['6.1/10', '83%', 'Drama\xa0Horror\xa0...More GenresDramaHorrorThriller', 'Rated: 18+ (R)', '2018', '1h 30m', 'On: Netflix\xa0']"
260,The Wolf's Call,movie,,,,,,,,,,"With nuclear war looming, a military expert in underwater acoustics strives to prove things aren't as they seem—or sound—using only his ears.The Wolf's Call featuring François Civil and Omar Sy is streaming with subscription on Netflix. It's an action & adventure and drama movie with a very high Rotten Tomatoes (critics) score of 92% and a better than average IMDb audience rating of 6.9 (11,307 votes).","['6.9/10', '92%', 'Thriller\xa0Drama\xa0...More GenresThrillerDramaAction & AdventureScience-FictionMystery', 'Rated: 16+', '2019', '1h 55m', 'On: Netflix\xa0']"
261,Ace Ventura: Pet Detective,movie,6.9/10,48%,"['Comedy', 'Mystery', 'Thriller']",Rated: 13+ (PG-13),1994,1h 26m,['Netflix'],"['Animal', 'Pet']",['America'],"He's Ace Ventura: Pet Detective. Jim Carrey is on the case to find the Miami Dolphins' missing mascot and quarterback Dan Marino. He goes eyeball to eyeball with a man-eating shark, stakes out the Miami Dolphins and woos and wows the ladies. Whether he's undercover, under fire or underwater, he always gets his man… or beast!Ace Ventura: Pet Detective featuring Jim Carrey and Sean Young is streaming with subscription on Netflix, available for rent or purchase on iTunes, available for rent or purchase on Google Play, and 3 others. It's a comedy and mystery movie with a less than average Rotten Tomatoes (critics) score of 48% and a better than average IMDb audience rating of 6.9 (270,160 votes).",All Clear
262,Blood Father,movie,6.4/10,89%,"['Action & Adventure', 'Independent', 'Thriller', 'Crime', 'Drama', 'Mystery']",Rated: 18+ (R),2016,1h 28m,['Netflix'],['Drug'],['France'],"An ex-con reunites with his estranged wayward 16-year old daughter to protect her from drug dealers who are trying to kill her.Blood Father featuring Mel Gibson and Erin Moriarty is streaming with subscription on Netflix, available for rent or purchase on iTunes, available for rent or purchase on Google Play, and 4 others. It's an action & adventure and crime movie with a high Rotten Tomatoes (critics) score of 89% and an average IMDb audience rating of 6.4 (57,491 votes).",All Clear
263,The End of the Tour,movie,,,,,,,,,,"The story of the five-day interview between Rolling Stone reporter David Lipsky and acclaimed novelist David Foster Wallace, which took place right after the 1996 publication of Wallace's groundbreaking epic novel, 'Infinite Jest.'The End of the Tour featuring Jason Segel and Jesse Eisenberg is streaming with subscription on Netflix, streaming with subscription on Kanopy, streaming with subscription on Hoopla, and 5 others. It's a biography and drama movie with a very high Rotten Tomatoes (critics) score of 92% and a better than average IMDb audience rating of 7.3 (27,804 votes).","['7.3/10', '92%', 'Drama\xa0Biography\xa0', 'Rated: 18+ (R)', '2015', '1h 46m', 'On: Netflix\xa0Kanopy\xa0']"
264,Dave Chappelle: Sticks & Stones,movie,,,,,,,,,,"Dave Chappelle takes on gun culture, the opioid crisis and the tidal wave of celebrity scandals in this defiant stand-up special.Dave Chappelle: Sticks & Stones featuring Dave Chappelle is streaming with subscription on Netflix, and available for rent or purchase on Microsoft Store. It's a comedy and documentary movie with a low Rotten Tomatoes (critics) score of 35% and a high IMDb audience rating of 8.5 (20,049 votes).","['8.5/10', '35%', 'Comedy\xa0Stand-up & Talk\xa0...More GenresComedyStand-up & TalkDocumentary', 'Rated: 18+ (R)', '2019', '1h 6m', 'On: Netflix\xa0']"
265,Rush: Beyond the Lighted Stage,movie,,,,,,,,,,"An in-depth look at the Canadian rock band Rush, chronicling the band's musical evolution from their progressive rock sound of the '70s to their current heavy rock styleRush: Beyond the Lighted Stage featuring Geddy Lee and Neil Peart is streaming with subscription on Netflix, and available for rent or purchase on Prime Video. It's a biography and documentary movie with a high Rotten Tomatoes (critics) score of 90% and a high IMDb audience rating of 8.4 (4,020 votes).","['8.4/10', '90%', 'Documentary\xa0Biography\xa0...More GenresDocumentaryBiographyMusical', '2010', '1h 47m', 'On: Netflix\xa0']"
266,Suburra,movie,,,,,,,,,,"A gangster known as ""Samurai"" wants to turn the waterfront of Rome into a new Las Vegas. All the local mob bosses have agreed to work for this common goal. But peace is not to last long.Suburra featuring Pierfrancesco Favino and Claudio Amendola is streaming with subscription on Netflix. It's a crime and drama movie with a very high Rotten Tomatoes (critics) score of 91% and a better than average IMDb audience rating of 7.4 (16,991 votes).","['7.4/10', '91%', 'Crime\xa0Drama\xa0...More GenresCrimeDramaThrillerMystery', '2015', '2h 10m', 'On: Netflix\xa0']"
267,Ip Man 3,movie,7.1/10,78%,"['Action & Adventure', 'Biography', 'Drama', 'History']",Rated: 13+ (PG-13),2015,1h 45m,"['Free Services', 'Netflix']","['Martial Arts', 'Gangster', 'Based On True Story']",['Hong Kong'],"When a band of brutal gangsters led by a crooked property developer make a play to take over the city, Master Ip is forced to take a stand.Ip Man 3 featuring Donnie Yen and Lynn Hung is streaming with subscription on Netflix, streaming with subscription on Hoopla, available for purchase on iTunes, and 4 others. It's an action & adventure and biography movie with a high Rotten Tomatoes (critics) score of 78% and a better than average IMDb audience rating of 7.1 (45,897 votes).",All Clear
268,Yes Man,movie,6.8/10,46%,"['Comedy', 'Romance']",Rated: 13+ (PG-13),2008,1h 44m,['Netflix'],"['Sports', 'Feel-good']",['America'],"Carl Allen has stumbled across a way to shake free of post-divorce blues and a dead-end job: embrace life and say yes to everything.Yes Man featuring Jim Carrey and Zooey Deschanel is streaming with subscription on Netflix, available for rent or purchase on iTunes, available for rent or purchase on Google Play, and 4 others. It's a comedy and romance movie with a less than average Rotten Tomatoes (critics) score of 46% and a better than average IMDb audience rating of 6.8 (327,362 votes).",All Clear
269,The Death of Mr. Lazarescu,movie,7.9/10,93%,"['Drama', 'Comedy']",Rated: 18+ (R),2005,2h 30m,"['Free Services', 'Netflix', 'Kanopy']","['Dark Comedy', 'Doctor', 'Mature']",['Romania'],"Mr. Lazarescu is a retired Romanian engineer, spending his time in the company of his cats and booze. When he starts feeling unusually ill, he first seeks painkillers from his neighbors. It soon becomes apparent that Lazarescu is indeed sick, and an ambulance arrives with a nurse who has a few ideas about what could be the problem. However, a major traffic accident and poor organization leaves little room in Romanian hospitals for the fading Lazarescu.The Death of Mr. Lazarescu featuring Ioan Fiscuteanu and Luminița Gheorghiu is streaming with subscription on Netflix, free on VUDU, streaming with subscription on Kanopy, and 1 other. It's a comedy and drama movie with a very high Rotten Tomatoes (critics) score of 93% and a high IMDb audience rating of 7.9 (13,144 votes).",All Clear
270,My Week with Marilyn,movie,7/10,83%,"['Biography', 'Drama']",Rated: 13+ (PG-13),2011,1h 39m,['Netflix'],"['Based on Books', 'Royalty', 'Adaptation', 'Mature', 'Based On True Story']",['United Kingdom'],"Sir Laurence Olivier is making a movie in London. Young Colin Clark, an eager film student, wants to be involved and he navigates himself a job on the set. When film star Marilyn Monroe arrives for the start of shooting, all of London is excited to see the blonde bombshell, while Olivier is struggling to meet her many demands and acting ineptness, and Colin is intrigued by her. Colin's intrigue is met when Marilyn invites him into her inner world where she struggles with her fame, her beauty and her desire to be a great actress.My Week with Marilyn featuring Michelle Williams and Eddie Redmayne is streaming with subscription on Netflix, available for rent or purchase on iTunes, available for rent or purchase on Google Play, and 3 others. It's a biography and drama movie with a high Rotten Tomatoes (critics) score of 83% and a better than average IMDb audience rating of 7.0 (81,842 votes).",All Clear
271,Get Him to the Greek,movie,6.4/10,72%,"['Comedy', 'Musical', 'Action & Adventure']",Rated: 18+ (R),2010,1h 49m,['Netflix'],['Music'],['America'],"Pinnacle records has the perfect plan to get their sinking company back on track: a comeback concert in LA featuring Aldous Snow, a fading rockstar who has dropped off the radar in recent years. Record company intern Aaron Green is faced with the monumental task of bringing his idol, out of control rock star Aldous Snow, back to LA for his comeback show.Get Him to the Greek featuring Jonah Hill and Russell Brand is streaming with subscription on Netflix, available for rent or purchase on iTunes, available for rent or purchase on Google Play, and 4 others. It's an action & adventure and comedy movie with a better than average Rotten Tomatoes (critics) score of 72% and an average IMDb audience rating of 6.4 (167,022 votes).",All Clear
272,Private Life,movie,,,,,,,,,,"Richard and Rachel, a couple in the throes of infertility, try to maintain their marriage as they descend deeper and deeper into the insular world of assisted reproduction and domestic adoption.Private Life featuring Kathryn Hahn and Paul Giamatti is streaming with subscription on Netflix. It's a comedy and drama movie with a very high Rotten Tomatoes (critics) score of 94% and a better than average IMDb audience rating of 7.2 (14,024 votes).","['7.2/10', '94%', 'Comedy\xa0Drama\xa0', '2018', '2h 3m', 'On: Netflix\xa0', 'Tags:\xa0Female Director\xa0Doctor\xa0', 'Country:\xa0America']"
273,Secret Superstar,movie,,,,,,,,,,"Insia Malik is a talented 15-year-old school girl from Baroda whose spirit is ripped because her mother is in a troubled and violent marriage. Of course she still dares to pursue her dream of becoming a singer and she also valiantly attempts to free her mother from her conservative, cold father.Secret Superstar featuring Zaira Wasim and Aamir Khan is streaming with subscription on Netflix. It's a drama and family movie with a high Rotten Tomatoes (critics) score of 90% and a high IMDb audience rating of 7.9 (19,267 votes).","['7.9/10', '90%', 'Drama\xa0Family\xa0', '2017', '2h 30m', 'On: Netflix\xa0']"
274,Richard Pryor: Live in Concert,movie,8.2/10,92%,"['Comedy', 'Documentary']",Rated: 18+ (R),1979,1h 18m,['Netflix'],['Dark Comedy'],['America'],"Richard Pryor delivers monologues on race, sex, family and his favorite target—himself, live at the Terrace Theatre in Long Beach, California.Richard Pryor: Live in Concert featuring Richard Pryor and Jennifer Lee Pryor is streaming with subscription on Netflix. It's a comedy and documentary movie with a very high Rotten Tomatoes (critics) score of 92% and a high IMDb audience rating of 8.2 (4,306 votes).",All Clear
275,The Meyerowitz Stories (New and Selected),movie,6.9/10,93%,"['Comedy', 'Drama']",Rated: 18+ (R),2017,1h 52m,['Netflix'],"['New York', 'Feel-good']",['America'],"An estranged family gathers together in New York for an event celebrating the artistic work of their father.The Meyerowitz Stories (New and Selected) featuring Adam Sandler and Ben Stiller is streaming with subscription on Netflix. It's a comedy and drama movie with a very high Rotten Tomatoes (critics) score of 93% and a better than average IMDb audience rating of 6.9 (39,155 votes).",All Clear
276,Inequality for All,movie,,,,,,,,,,"U.S. Labor Secretary Robert Reich tries to raise awareness of the country's widening economic gap.Inequality for All featuring Robert Reich and Dolly Parton is streaming with subscription on Netflix, available for rent or purchase on iTunes, available for rent or purchase on Google Play, and 3 others. It's a documentary movie with a high Rotten Tomatoes (critics) score of 90% and a high IMDb audience rating of 8.0 (6,471 votes).","['8/10', '90%', 'Documentary\xa0', 'Rated: 7+ (PG)', '2013', '1h 28m', 'On: Netflix\xa0']"
277,20 Feet from Stardom,movie,,,,,,,,,,"Backup singers live in a world that lies just beyond the spotlight. Their voices bring harmony to the biggest bands in popular music, but we've had no idea who these singers are or what lives they lead, until now.20 Feet from Stardom featuring Darlene Love and Lisa Fischer is streaming with subscription on Netflix, available for rent or purchase on iTunes, available for rent or purchase on Google Play, and 2 others. It's a biography and documentary movie with a very high Rotten Tomatoes (critics) score of 99% and a better than average IMDb audience rating of 7.4 (11,982 votes).","['7.4/10', '99%', 'Documentary\xa0History\xa0...More GenresDocumentaryHistoryBiographyMusical', 'Rated: 13+ (PG-13)', '2013', '1h 29m', 'On: Netflix\xa0']"
