,title,type,imdb_rating,tomato_rating,genres,maturity_rating,time_period,runtime,platform,tags,country,description,ps
343,Triple Frontier,movie,6.4/10,72%,"['Action & Adventure', 'Thriller', 'Crime', 'Drama', 'Mystery']",Rated: 18+ (R),2019,2h 6m,['Netflix'],"['Military', 'Jungle', 'Drug', 'Survival']",['America'],"Struggling to make ends meet, former special ops soldiers reunite for a high-stakes heist: stealing $75 million from a South American drug lord.Triple Frontier featuring Ben Affleck and Oscar Isaac is streaming with subscription on Netflix. It's an action & adventure and crime movie with a better than average Rotten Tomatoes (critics) score of 72% and an average IMDb audience rating of 6.4 (99,036 votes).",All Clear
344,It Comes at Night,movie,6.2/10,87%,"['Horror', 'Mystery', 'Drama', 'Thriller']",Rated: 18+ (R),2017,1h 31m,"['Netflix', 'Kanopy']","['Apocalypse', 'Dog', 'Doctor', 'Psychology', 'Animal']",['America'],"Secure within a desolate home as an unnatural threat terrorizes the world, a man has established a tenuous domestic order with his wife and son, but this will soon be put to test when a desperate young family arrives seeking refuge.It Comes at Night featuring Joel Edgerton and Christopher Abbott is streaming with subscription on Netflix, streaming with subscription on Kanopy, available for rent or purchase on iTunes, and 6 others. It's a drama and horror movie with a high Rotten Tomatoes (critics) score of 87% and an average IMDb audience rating of 6.2 (79,447 votes).",All Clear
345,Turbo,movie,6.4/10,67%,"['Action & Adventure', 'Children', 'Comedy', 'Animation', 'Family']",Rated: 7+ (PG),2013,1h 36m,['Netflix'],"['Friendship', 'Car', 'Racing', 'Supernatural']",['America'],"The tale of an ordinary garden snail who dreams of winning the Indy 500.Turbo featuring Ryan Reynolds and Paul Giamatti is streaming with subscription on Netflix, available for rent or purchase on iTunes, available for rent or purchase on Google Play, and 5 others. It's an action & adventure and animation movie with a better than average Rotten Tomatoes (critics) score of 67% and an average IMDb audience rating of 6.4 (80,683 votes).",All Clear
346,Springsteen On Broadway,movie,,,,,,,,,,"Springsteen on Broadway is a solo acoustic performance written and performed by Tony Award, Academy Award, and 20-time Grammy Award winner Bruce Springsteen. Based on his worldwide best-selling autobiography 'Born to Run,' Springsteen on Broadway is a unique evening with Bruce, his guitar, a piano, and his very personal stories. In addition, it features a special appearance by Patti Scialfa. Netflix will allow global audiences to see the show critics have been raving about from anywhere they are.Springsteen On Broadway featuring Bruce Springsteen is streaming with subscription on Netflix. It's a documentary and musical movie with a very high Rotten Tomatoes (critics) score of 95% and a high IMDb audience rating of 8.5 (1,738 votes).","['8.5/10', '95%', 'Documentary\xa0Musical\xa0', '2018', '2h 33m', 'On: Netflix\xa0']"
347,Delhi Belly,movie,,,,,,,,,,"Three unsuspecting, average guys find themselves on the hit list of one of India's most-powerful crime syndicates.Delhi Belly featuring Imran Khan and Kunaal Roy Kapur is streaming with subscription on Netflix. It's an action & adventure and comedy movie with a high Rotten Tomatoes (critics) score of 87% and a high IMDb audience rating of 7.6 (26,433 votes).","['7.6/10', '87%', 'Comedy\xa0Crime\xa0...More GenresComedyCrimeDramaAction & Adventure', '2011', '1h 42m', 'On: Netflix\xa0']"
348,Bright,movie,6.3/10,28%,"['Action & Adventure', 'Crime', 'Fantasy', 'Science-Fiction']",Rated: 18+ (R),2017,1h 57m,['Netflix'],['Police'],['America'],"In an alternate present-day where magical creatures live among us, two L.A. cops become embroiled in a prophesied turf battle.Bright featuring Will Smith and Joel Edgerton is streaming with subscription on Netflix. It's an action & adventure and crime movie with a very low Rotten Tomatoes (critics) score of 28% and an average IMDb audience rating of 6.3 (162,532 votes).",All Clear
349,Being Elmo: A Puppeteer's Journey,movie,7.6/10,95%,"['Documentary', 'Family']",Rated: 7+ (PG),2011,1h 20m,['Netflix'],['Female Director'],['America'],"Beloved by children of all ages around the world, Elmo is an international icon. Few people know his creator, Kevin Clash, who dreamed of working with his idol, master puppeteer Jim Henson. Displaying his creativity and talent at a young age, Kevin ultimately found a home on Sesame Street. Narrated by Whoopi Goldberg, this documentary includes rare archival footage, interviews with Frank Oz, Rosie O’Donnell, Cheryl Henson, Joan Ganz Cooney and others and offers a behind-the-scenes look at Sesame Street and the Jim Henson Workshop.Being Elmo: A Puppeteer's Journey featuring Kevin Clash and Whoopi Goldberg is streaming with subscription on Netflix, streaming with subscription on Hoopla, available for rent or purchase on iTunes, and 1 other. It's a documentary and family movie with a very high Rotten Tomatoes (critics) score of 95% and a high IMDb audience rating of 7.6 (6,637 votes).",All Clear
350,The Sky Is Pink,movie,,,,,,,,,,"The 25-year-old love story of a couple is told through the lens of their spunky teenage daughter who is diagnosed with pulmonary fibrosis.The Sky Is Pink featuring Priyanka Chopra and Zaira Wasim is streaming with subscription on Netflix, available for rent or purchase on iTunes, and available for rent or purchase on Google Play. It's a drama and family movie with a better than average Rotten Tomatoes (critics) score of 72% and a high IMDb audience rating of 7.6 (5,893 votes).","['7.6/10', '72%', 'Drama\xa0Family\xa0...More GenresDramaFamilyRomance', '2019', '2h 23m', 'On: Netflix\xa0', 'Tags:\xa0Adaptation\xa0Based On True Story\xa0', 'Country:\xa0India']"
351,Calibre,movie,6.7/10,93%,"['Thriller', 'Mystery']",Rated: 18+ (R),2018,1h 41m,['Netflix'],"['Drug', 'Hunting']",['United Kingdom'],"Two lifelong friends head up to an isolated Scottish Highlands village for a weekend hunting trip that descends into a never-ending nightmare as they attempt to cover up a horrific hunting accident.Calibre featuring Jack Lowden and Martin McCann is streaming with subscription on Netflix. It's a mystery and thriller movie with a very high Rotten Tomatoes (critics) score of 93% and a better than average IMDb audience rating of 6.7 (19,478 votes).",All Clear
352,Mansfield Park,movie,7.1/10,77%,"['Comedy', 'Drama', 'Romance']",Rated: 13+ (PG-13),1999,1h 52m,['Netflix'],"['Based on Books', 'Female Director', 'Adaptation']",['United Kingdom'],"This fun and sexy comedy tells a timelessly entertaining story where wealthy, secret passions and mischievous women put love to the test.. When a spirited young woman, Fanny Price, is sent away to live on the great country estate of her rich cousins, she's meant to learn the ways of proper society. But while Fanny learns ""their"" ways, she also enlightens them with a wit and sparkle all her own!Mansfield Park featuring Frances O'Connor and Lindsay Duncan is streaming with subscription on Netflix, streaming with subscription on Hoopla, available for rent or purchase on iTunes, and 4 others. It's a comedy and drama movie with a high Rotten Tomatoes (critics) score of 77% and a better than average IMDb audience rating of 7.1 (21,327 votes).",All Clear
353,Mary and the Witch's Flower,movie,6.8/10,89%,"['Animation', 'Anime', 'Action & Adventure', 'Family', 'Fantasy']",Rated: 7+ (PG),2017,1h 43m,['Netflix'],"['Based on Books', 'Magic', 'Supernatural', 'Animal', 'Adaptation']",['Japan'],"Mary Smith, a young girl who lives with her great-aunt in the countryside, follows a mysterious cat into the nearby forest where she finds a strange flower and an old broom, none of which is as ordinary as it seems.Mary and the Witch's Flower featuring Hana Sugisaki and Ryunosuke Kamiki is streaming with subscription on Netflix, available for rent or purchase on iTunes, available for rent or purchase on Google Play, and 4 others. It's an action & adventure and animation movie with a high Rotten Tomatoes (critics) score of 89% and a better than average IMDb audience rating of 6.8 (11,115 votes).",All Clear
354,Bobby Robson: More Than a Manager,movie,,,,,,,,,,"The definitive portrait of one of sport's most inspirational, influential figures - whose legacy lives on far beyond the football field.Bobby Robson: More Than a Manager featuring Bobby Robson and Elsie Robson is streaming with subscription on Netflix, available for purchase on iTunes, available for rent or purchase on Prime Video, and 1 other. It's a documentary and sport movie with a very high Rotten Tomatoes (critics) score of 100% and a high IMDb audience rating of 8.2 (2,391 votes).","['8.2/10', '100%', 'Documentary\xa0Sport\xa0', '2018', '1h 44m', 'On: Netflix\xa0']"
355,First They Killed My Father,movie,,,,,,,,,,"A 5-year-old girl embarks on a harrowing quest for survival amid the sudden rise and terrifying reign of the Khmer Rouge in Cambodia.First They Killed My Father featuring Sareum Srey Moch and Phoeung Kompheak is streaming with subscription on Netflix. It's a biography and drama movie with a high Rotten Tomatoes (critics) score of 89% and a better than average IMDb audience rating of 7.2 (13,921 votes).","['7.2/10', '89%', 'Biography\xa0Drama\xa0...More GenresBiographyDramaHistory', 'Rated: 18+ (R)', '2017', '2h 16m', 'On: Netflix\xa0']"
356,21,movie,6.8/10,36%,"['Biography', 'Crime', 'Drama', 'History', 'Thriller', 'Mystery']",Rated: 13+ (PG-13),2008,2h 3m,['Netflix'],"['Friendship', 'College', 'Video Games']",['America'],"Ben Campbell is a young, highly intelligent, student at M.I.T. in Boston who strives to succeed. Wanting a scholarship to transfer to Harvard School of Medicine with the desire to become a doctor, Ben learns that he cannot afford the $300,000 for the four to five years of schooling as he comes from a poor, working-class background. But one evening, Ben is introduced by his unorthodox math professor Micky Rosa into a small but secretive club of five. Students Jill, Choi, Kianna, and Fisher, who are being trained by Professor Rosa of the skill of card counting at blackjack.21 featuring Jim Sturgess and Kevin Spacey is streaming with subscription on Netflix, available for rent or purchase on iTunes, available for rent or purchase on Google Play, and 3 others. It's a biography and crime movie with a low Rotten Tomatoes (critics) score of 36% and a better than average IMDb audience rating of 6.8 (224,246 votes).",All Clear
357,Outlaw King,movie,6.9/10,61%,"['Drama', 'Action & Adventure', 'History', 'Biography']",Rated: 18+ (R),2018,2h 2m,['Netflix'],['Medieval'],"['United Kingdom', 'United Kingdom', 'America']","Forced into exile by the English after being crowned King of Scotland, legendary warrior Robert the Bruce fights to reclaim the throne.Outlaw King featuring Chris Pine and Florence Pugh is streaming with subscription on Netflix. It's an action & adventure and biography movie with an average Rotten Tomatoes (critics) score of 61% and a better than average IMDb audience rating of 6.9 (55,374 votes).",All Clear
358,The American Meme,movie,,,,,,,,,,"Paris Hilton, the Fat Jew, and Brittany Furlan have all used social media to achieve massive internet fame. But, American Meme explores, is it worth it?The American Meme featuring Paris Hilton and Brittany Furlan is streaming with subscription on Netflix. It's a documentary movie with a very high Rotten Tomatoes (critics) score of 100% and a better than average IMDb audience rating of 7.2 (10,444 votes).","['7.2/10', '100%', 'Documentary\xa0', '2018', '1h 35m', 'On: Netflix\xa0']"
359,The Babysitter,movie,6.3/10,71%,"['Horror', 'Action & Adventure', 'Comedy']",Rated: 18+ (R),2017,1h 25m,['Netflix'],['Teen'],['America'],"When Cole stays up past his bedtime, he discovers that his hot babysitter is part of a Satanic cult that will stop at nothing to keep him quiet.The Babysitter featuring Judah Lewis and Samara Weaving is streaming with subscription on Netflix. It's an action & adventure and comedy movie with a better than average Rotten Tomatoes (critics) score of 71% and an average IMDb audience rating of 6.3 (57,543 votes).",All Clear
360,The Devil We Know,movie,,,,,,,,,,"Unraveling one of the biggest environmental scandals of our time, a group of citizens in West Virginia take on a powerful corporation after they discover it has knowingly been dumping a toxic chemical — now found in the blood of 99.7% of Americans — into the local drinking water supply.The Devil We Know is streaming with subscription on Netflix, available for rent or purchase on iTunes, available for rent or purchase on Google Play, and 1 other. It's a documentary movie with a very high Rotten Tomatoes (critics) score of 100% and a high IMDb audience rating of 7.7 (843 votes).","['7.7/10', '100%', 'Documentary\xa0', '2018', '1h 28m', 'On: Netflix\xa0', 'Tags:\xa0Doctor\xa0', 'Country:\xa0America']"
361,Heneral Luna,movie,,,,,,,,,,"A Filipino general who believes he can turn the tide of battle in the Philippine-American war. But little does he know that he faces a greatest threat to the country's revolution against the invading Americans.Heneral Luna featuring John Arcilla and Mon Confiado is streaming with subscription on Netflix. It's an action & adventure and comedy movie with a better than average Rotten Tomatoes (critics) score of 71% and a high IMDb audience rating of 7.6 (1,794 votes).","['7.6/10', '71%', 'Comedy\xa0Action & Adventure\xa0...More GenresComedyAction & AdventureDramaHistory', 'Rated: 18+ (R)', '2015', '1h 58m', 'On: Netflix\xa0']"
362,Even the Rain,movie,,,,,,,,,,"As a director and his crew shoot a controversial film about Christopher Columbus in Cochabamba, Bolivia, local people rise up against plans to privatize the water supply.Even the Rain featuring Gael García Bernal and Luis Tosar is streaming with subscription on Netflix. It's a drama and history movie with a high Rotten Tomatoes (critics) score of 87% and a better than average IMDb audience rating of 7.4 (12,418 votes).","['7.4/10', '87%', 'Drama\xa0History\xa0', '2010', '1h 44m', 'On: Netflix\xa0', 'Tags:\xa0Female Director\xa0', 'Country:\xa0France\xa0...More CountriesFranceMexicoSpain']"
363,Jodhaa Akbar,movie,7.6/10,75%,"['Action & Adventure', 'Biography', 'Drama', 'History', 'Romance']",Rated: 13+ (PG-13),2008,3h 33m,['Netflix'],"['Medieval', 'Fighting', 'Religion', 'Royalty', 'Political']",['India'],"Jodhaa Akbar is a sixteenth century love story about a marriage of alliance that gave birth to true love between a great Mughal Emperor, Akbar and a Rajput princess, Jodhaa.Jodhaa Akbar featuring Hrithik Roshan and Aishwarya Rai Bachchan is streaming with subscription on Netflix. It's an action & adventure and biography movie with a better than average Rotten Tomatoes (critics) score of 75% and a high IMDb audience rating of 7.6 (28,756 votes).",All Clear
364,Up in Smoke,movie,7/10,50%,"['Comedy', 'Cult', 'Musical']",Rated: 18+ (R),1978,1h 26m,['Netflix'],"['Friendship', 'Drug', 'Religion', 'Feel-good']",['America'],"An unemployed pot-smoking slacker and amateur drummer, Anthony Stoner ditches his strict parents and hits the road, eventually meeting kindred spirit Pedro de Pacas. While the drug-ingesting duo is soon arrested for possession of marijuana, Anthony and Pedro get released on a technicality, allowing them to continue their many misadventures and ultimately compete in a rock band contest, where they perform the raucous tune ""Earache My Eye.""Up in Smoke featuring Cheech Marin and Tommy Chong is streaming with subscription on Netflix, available for rent or purchase on iTunes, available for rent or purchase on Google Play, and 4 others. It's a comedy and cult movie with an average Rotten Tomatoes (critics) score of 50% and a better than average IMDb audience rating of 7.0 (35,209 votes).",All Clear
365,Kai Po Che!,movie,,,,,,,,,,"Three friends growing up in India at the turn of the millennium set out to open a training academy to produce the country's next cricket stars.Kai Po Che! featuring Sushant Singh Rajput and Rajkummar Rao is streaming with subscription on Netflix. It's a drama and sport movie with a high Rotten Tomatoes (critics) score of 76% and a high IMDb audience rating of 7.6 (26,913 votes).","['7.6/10', '76%', 'Drama\xa0Sport\xa0', '2013', '2h 6m', 'On: Netflix\xa0', 'Tags:\xa0Friendship\xa0', 'Country:\xa0India']"
366,The Ritual,movie,6.3/10,71%,['Horror'],Rated: 18+ (R),2017,1h 34m,['Netflix'],"['Based on Books', 'Friendship', 'Monster', 'Supernatural', 'Psychology', 'Survival', 'Adaptation', 'Sports']",['United Kingdom'],"A group of college friends reunite for a trip to the forest, but encounter a menacing presence in the woods that's stalking them.The Ritual featuring Rafe Spall and Robert James-Collier is streaming with subscription on Netflix. It's a horror movie with a better than average Rotten Tomatoes (critics) score of 71% and an average IMDb audience rating of 6.3 (70,003 votes).",All Clear
367,Super Dark Times,movie,,,,,,,,,,"Teenagers Zach and Josh have been best friends their whole lives, but when a gruesome accident leads to a cover-up, the secret drives a wedge between them and propels them down a rabbit hole of escalating paranoia and violence.Super Dark Times featuring Owen Campbell and Charlie Tahan is streaming with subscription on Netflix, available for rent or purchase on iTunes, available for rent or purchase on Google Play, and 4 others. It's a crime and drama movie with a high Rotten Tomatoes (critics) score of 89% and an average IMDb audience rating of 6.6 (16,957 votes).","['6.6/10', '89%', 'Drama\xa0Thriller\xa0...More GenresDramaThrillerCrimeHorrorMystery', '2017', '1h 42m', 'On: Netflix\xa0', 'Tags:\xa0Coming of Age\xa0High School\xa0Friendship\xa0...More TagsComing of AgeHigh SchoolFriendshipNew YorkSuspenseDoctorDrugHolidayChristmasTeen', 'Country:\xa0America']"
368,Get Me Roger Stone,movie,7.4/10,88%,"['Documentary', 'Biography', 'History']",Rated: 16+,2017,1h 40m,['Netflix'],['Political'],['America'],"From his days of testifying at the Watergate hearings to advising recent presidential candidate Donald Trump, Roger Stone has long offended people on both sides of the political fence as a force in conservative America. Outspoken author, pundit, ahead of his time election strategist, this is his story.Get Me Roger Stone featuring Roger Stone and Donald Trump is streaming with subscription on Netflix. It's a biography and documentary movie with a high Rotten Tomatoes (critics) score of 88% and a better than average IMDb audience rating of 7.4 (6,113 votes).",All Clear
369,Krisha,movie,7.2/10,95%,"['Comedy', 'Drama']",Rated: 18+ (R),2016,1h 21m,"['Netflix', 'Kanopy']","['Doctor', 'Holiday']",['America'],"When Krisha returns to her estranged family for Thanksgiving dinner, past demons threaten to ruin the festivities.Krisha featuring Krisha Fairchild and Alex Dobrenko is streaming with subscription on Netflix, streaming with subscription on Kanopy, streaming with subscription on Hoopla, and 5 others. It's a comedy and drama movie with a very high Rotten Tomatoes (critics) score of 95% and a better than average IMDb audience rating of 7.2 (7,162 votes).",All Clear
370,Tomorrow Never Dies,movie,6.5/10,57%,"['Action & Adventure', 'Thriller', 'Mystery']",Rated: 13+ (PG-13),1997,1h 59m,['Netflix'],"['Military', 'Spy', 'Political']","['United Kingdom', 'United Kingdom', 'America']","A deranged media mogul is staging international incidents to pit the world's superpowers against each other. Now 007 must take on this evil mastermind in an adrenaline-charged battle to end his reign of terror and prevent global pandemonium.Tomorrow Never Dies featuring Pierce Brosnan and Jonathan Pryce is streaming with subscription on Netflix, available for rent or purchase on iTunes, available for rent or purchase on Google Play, and 3 others. It's an action & adventure and mystery movie with an average Rotten Tomatoes (critics) score of 57% and an average IMDb audience rating of 6.5 (176,800 votes).",All Clear
371,Dear Ex,movie,,,,,,,,,,"When Sanlian's ex-husband passes away, she discovers he has altered his insurance policy, cutting out their son in favor of a stranger named Jay.Dear Ex featuring Hsieh Ying Shiuan and Qiu Ze is streaming with subscription on Netflix. It's a comedy and drama movie with a high Rotten Tomatoes (critics) score of 89% and a better than average IMDb audience rating of 7.4 (3,184 votes).","['7.4/10', '89%', 'Comedy\xa0LGBTQ\xa0...More GenresComedyLGBTQRomanceDrama', 'Rated: 18+ (R)', '2018', '1h 39m', 'On: Netflix\xa0']"
372,"Extremely Wicked, Shockingly Evil and Vile",movie,6.6/10,55%,"['Thriller', 'Crime', 'Drama', 'Biography', 'Mystery']",Rated: 18+ (R),2019,1h 51m,['Netflix'],"['Based on Books', 'Serial Killer', 'Adaptation', 'Based On True Story']",['America'],"A chronicle of the crimes of Ted Bundy, from the perspective of his longtime girlfriend, Elizabeth Kloepfer, who refused to believe the truth about him for years.Extremely Wicked, Shockingly Evil and Vile featuring Zac Efron and Lily Collins is streaming with subscription on Netflix. It's a biography and crime movie with an average Rotten Tomatoes (critics) score of 55% and an average IMDb audience rating of 6.6 (70,570 votes).",All Clear
373,Kill the Messenger,movie,,,,,,,,,,"A reporter becomes the target of a vicious smear campaign that drives him to the point of suicide after he exposes the CIA's role in arming Contra rebels in Nicaragua and importing cocaine into California. Based on the true story of journalist Gary Webb.Kill the Messenger featuring Jeremy Renner and Mary Elizabeth Winstead is streaming with subscription on Netflix, available for rent or purchase on iTunes, available for rent or purchase on Google Play, and 3 others. It's an action & adventure and biography movie with a high Rotten Tomatoes (critics) score of 77% and a better than average IMDb audience rating of 6.9 (43,282 votes).","['6.9/10', '77%', 'Thriller\xa0Biography\xa0...More GenresThrillerBiographyCrimeDramaMysteryAction & Adventure', 'Rated: 18+ (R)', '2014', '1h 52m', 'On: Netflix\xa0']"
374,How the Grinch Stole Christmas,movie,6.2/10,50%,"['Comedy', 'Family', 'Fantasy']",Rated: 7+ (PG),2000,1h 44m,['Netflix'],"['Dating', 'Holiday', 'Christmas']","['Germany', 'Germany', 'America']","Inside a snowflake exists the magical land of Whoville. In Whoville, live the Whos, an almost mutated sort of Munchkin-like people. All the Whos love Christmas, yet just outside of their beloved Whoville lives the Grinch. The Grinch is a nasty creature that hates Christmas, and plots to steal it away from the Whos, whom he equally abhors. Yet a small child, Cindy Lou Who, decides to try befriending the Grinch.How the Grinch Stole Christmas featuring Jim Carrey and Taylor Momsen is streaming with subscription on Netflix, available for rent or purchase on iTunes, available for purchase on Google Play, and 3 others. It's a comedy and family movie with an average Rotten Tomatoes (critics) score of 50% and an average IMDb audience rating of 6.2 (197,061 votes).",All Clear
375,The Duchess,movie,6.9/10,62%,"['Biography', 'Drama', 'History', 'Romance']",Rated: 13+ (PG-13),2008,1h 50m,"['Netflix', 'Prime Video', 'CBS All Access']","['Royalty', 'Based On True Story']",['United Kingdom'],"A chronicle of the life of 18th century aristocrat Georgiana, Duchess of Devonshire, who was reviled for her extravagant political and personal life.The Duchess featuring Keira Knightley and Ralph Fiennes is streaming with subscription on Netflix, streaming with subscription on Prime Video, streaming on CBS All Access, and 7 others. It's a biography and drama movie with an average Rotten Tomatoes (critics) score of 62% and a better than average IMDb audience rating of 6.9 (76,408 votes).",All Clear
376,Veronica,movie,6.2/10,88%,"['Drama', 'Horror']",Rated: 18+ (R),2017,1h 45m,['Netflix'],"['Supernatural', 'Science', 'Ghost', 'Religion', 'Adaptation', 'Based On True Story']",['Spain'],"Madrid, June 1991. After celebrating a session of Ouija with her friends, Verónica is besieged by dangerous supernatural presences that threaten to harm her entire family.Veronica featuring Sandra Escacena and Bruna González is streaming with subscription on Netflix. It's a drama and horror movie with a high Rotten Tomatoes (critics) score of 88% and an average IMDb audience rating of 6.2 (33,330 votes).",All Clear
377,Beasts of No Nation,movie,,,,,,,,,,"A drama based on the experiences of Agu, a child soldier fighting in the civil war of an unnamed African country. Follows the journey of a young boy, Agu, who is forced to join a group of soldiers in a fictional West African country. While Agu fears his commander and many of the men around him, his fledgling childhood has been brutally shattered by the war raging through his country, and he is at first torn between conflicting revulsion and fascination Depicts the mechanics of war and does not shy away from explicit, visceral detail, and paints a complex, difficult picture of Agu as a child soldier.Beasts of No Nation featuring Idris Elba and Opeyemi Fagbohungbe is streaming with subscription on Netflix. It's a drama movie with a very high Rotten Tomatoes (critics) score of 91% and a high IMDb audience rating of 7.7 (70,587 votes).","['7.7/10', '91%', 'Drama\xa0', '2015', '2h 17m', 'On: Netflix\xa0', 'Tags:\xa0Based on Books\xa0Military\xa0War\xa0...More TagsBased on BooksMilitaryWarAbout AfricaAdaptationPolitical', 'Country:\xa0Ghana\xa0...More CountriesGhanaAmerica']"
